主管機關,公告日期,處分日期,處分字號,事業單位名稱或負責人,違法法規法條,違反法規內容,罰鍰金額,備註說明
職業安全衛生署,20160110,20151208,勞職授字第1040204125號,三和工業股份有限公司,職業安全衛生設施規則58條第5款、機械設備器具安全標準第4條第1項暨職業安全衛生法第6條第1項,設置之電腦數值控制之自動化機械(自動倉儲機作業區)，具有危險部分之安全門未具有連鎖性能；衝壓機械由人員收取物料(氣缸墊片)之區域，未設有有安全護圍等防護裝置。,,
職業安全衛生署,20161210,20161019,勞職授字第1050203731號,三和工業股份有限公司,職業安全衛生設施規則第57條第1項、第93條、第95條暨職業安全衛生法第6條第1項,對於自動裁料機之調整有導致危害勞工之虞，未停止相關機械運轉及送料；升降機之升降路1樓出入口，未有安全裝置，使升降搬器及升降路出入口之任一門開啟時升降機不能開動，及升降機在開動中任一門開啟時能停止上下；未有連鎖裝置，使搬器地板與樓板相差7.5公分以上時，升降路出入口門不能開啟之。,,
職業安全衛生署,20160110,20151208,勞職授字第1040204125號,三和工業股份有限公司,職業安全衛生設施規則58條第5款、機械設備器具安全標準第4條第1項暨職業安全衛生法第6條第1項,設置之電腦數值控制之自動化機械(自動倉儲機作業區)，具有危險部分之安全門未具有連鎖性能；衝壓機械由人員收取物料(氣缸墊片)之區域，未設有有安全護圍等防護裝置。,,
職業安全衛生署,20161210,20161019,勞職授字第1050203731號,三和工業股份有限公司,職業安全衛生設施規則第57條第1項、第93條、第95條暨職業安全衛生法第6條第1項,對於自動裁料機之調整有導致危害勞工之虞，未停止相關機械運轉及送料；升降機之升降路1樓出入口，未有安全裝置，使升降搬器及升降路出入口之任一門開啟時升降機不能開動，及升降機在開動中任一門開啟時能停止上下；未有連鎖裝置，使搬器地板與樓板相差7.5公分以上時，升降路出入口門不能開啟之。,,
桃園市,20200409,20200227,府勞檢字第1090045887號,三和工業股份有限公司羅財浩,機械設備器具安全標準第6條第1項第3款暨職業安全衛生法第6條第1項,衝剪機械之安全裝置，應具有下列機能之一：一、…。三、感應式安全裝置：滑塊等在閉合動作中，遇身體之一部接近危險界限時，能使滑塊等停止動作。四、…。,,
桃園市,20211005,20210831,府勞檢字第1100217766號,三和工業股份有限公司羅財浩,機械設備器具安全標準第6條第1項第3款暨職業安全衛生法第6條第1項,衝剪機械之安全裝置，應具有下列機能之一：一、…。三、感應式安全裝置：滑塊等在閉合動作中，遇身體之一部接近危險界限時，能使滑塊等停止動作。四、…。,,
桃園市,20221109,20220921,府勞檢字第1110263097號,三和工業股份有限公司羅財浩,機械設備器具安全標準第6條第1項第3款暨職業安全衛生法第6條第1項,衝剪機械之安全裝置，應具有下列機能之一：一、…。三、感應式安全裝置：滑塊等在閉合動作中，遇身體之一部接近危險界限時，能使滑塊等停止動作。四、…。,,
