主管機關,公告日期,處分日期,處分字號,事業單位名稱或負責人,違法法規法條,違反法規內容,罰鍰金額,備註說明
桃園市,20210309,20210105,110年府勞檢字1090338475號,三商物業股份有限公司馬希武,勞基法第38條第1項,雇主未依規定給予繼續工作滿一定期間勞工之特別休假,20000,
新北市,20241220,20240923,新北府勞檢字第11346606551號,三商物業股份有限公司徐清文,勞動基準法第32條第2項,延長工作時間超過法令規定,20000,
新北市,20241220,20240923,新北府勞檢字第11346606552號,三商物業股份有限公司徐清文,勞動基準法第36條,每七日中未有一日之休息做為例假,20000,
新北市,20241220,20240923,新北府勞檢字第1134660655號,三商物業股份有限公司徐清文,勞動基準法第24條,延長工作時間未依規定加給工資,20000,
桃園市,20241007,20240809,113年府勞檢字1130220162號,三商物業股份有限公司徐清文,勞基法第30條第6項,未逐日記載勞工出勤情形至分鐘為止,20000,
