主管機關,公告日期,處分日期,處分字號,事業單位名稱或負責人,違法法規法條,違反法規內容,罰鍰金額,備註說明
台北市,20160419,20160203,北市勞職字第10531171400號,三盛營造股份有限公司,營造安全衛生設施標準第19條第1項暨職業安全衛生法第6條第1項第5款,對於高度2公尺以上之開口部分從事營建施工管理作業，勞工有遭受墜落危險之虞者，未於該處設置護欄、護蓋或安全網等防護設備。,,
台北市,20170706,20170531,北市勞職字第10634068600號,三盛營造股份有限公司,1職業安全衛生法第27條第1項第1、2、3、4款。;2.職業安全衛生設施規則第281條第1項暨職業安全衛生法第6條第1項第5款。;3.營造安全衛生設施標準第5條暨職業安全衛生法第6條第1項第7款。;4.營造安全衛生設施標準第19條第1項暨職業安全衛生法第6條第1項第5款。,1.與承攬人分別僱用勞工共同作業，未設置協議組織，將承攬人納入協議組織運作，且對於承攬人所僱勞工於高度2公尺以上之從事作業有墜落、頭顱受創等具有嚴重危害勞工及發生職業災害之虞之工作場所，未「確實巡視」並「指揮」命令停止該危險作業；亦未採積極具體作為「連繫」及要求承攬人依規定，於高度2公尺以上開口處設置護蓋、護欄或安全網及使進場作業勞工確實戴用適當之安全帽，又對於承攬人從事之作業，未依規定，指導承攬人選任經合格訓練之作業主管在現場監督指揮勞工作業。;2.僱用勞工於高度2公尺以上之從事作業，勞工有墜落之虞，未使勞工確實使用安全帶。;3.對工作場所暴露之鋼筋等易生職業災害者，未採取彎曲尖端、加蓋或加裝防護套等防護設施。;4.對於高度2公尺以上之開口部分從事作業，未於該處設置護欄、護蓋或安全網等防護設備，使勞工有遭受墜落危險之虞。,,
台北市,20170901,20170706,北市勞職字第10635326500號,三盛營造股份有限公司,1.職業安全衛生法第27條第1項第1、2、3款。;2.營造安全衛生設施標準第19條第1項暨職業安全衛生法第6條第1項第5款。,1.與（再）承攬人分別僱用勞工共同作業，對於（再）承攬人所僱勞工於高度二公尺以上分別從事作業有頭顱受創具有嚴重危害勞工及發生職業災害之虞之工作場所，未「確實巡視」並「指揮」命令停止該危險作業；亦未採積極具體作為「連繫」及要求（再）承攬人依規定，於高度2公尺以上處所作業，勞工有墜落之虞者，應以架設施工架或設置工作台及於該處設置護欄、護蓋或安全網等防護設備並使進場作業勞工確實戴用適當之安全帽。;2.對於高度2公尺以上之開口部分從事作業，勞工有遭受墜落危險之虞，未於開口處設置護欄、護蓋或安全網等防護設備。,,
台北市,20171101,20170921,北市勞職字第10637649904號,三盛營造股份有限公司,職業安全衛生法第27條第1項第1、2、3款。,與承攬人分別僱用勞工共同作業，對於承攬人所僱勞工於工區從事作業時，該作業場所有使勞工頭顱受創等具有嚴重危害勞工及發生職業災害之虞，惟受裁處人未「確實巡視」並「指揮」命令停止該作業;亦未採積極具體作為「連繫」及要求承攬人依1規定，對於進入工作場所從事作業人員，提供適當安全帽，並使其正確戴用。,,
台北市,20181001,20180706,北市勞職字第10760180731號,三盛營造股份有限公司,營造安全衛生設施標準第19條第1項暨職業安全衛生法第6條第1項第5款,有墜落危險之處所未設防護設備。,,
台北市,20181101,20180817,北市勞職字第10760435501號,三盛營造股份有限公司,職業安全衛生法第27條第1項第4款,原事業單位未採取承攬管理必要措施。,,
