主管機關,公告日期,處分日期,處分字號,事業單位名稱或負責人,違法法規法條,違反法規內容,罰鍰金額,備註說明
新北市,20160823,20160628,新北府勞檢字第10534501841號,上泓企業有限公司,勞動基準法第24條,延長工作時間未依規定加給工資,,
新北市,20160823,20160628,新北府勞檢字第10534501842號,上泓企業有限公司,勞動基準法第36條,每七日中未有一日之休息作為例假,,
新北市,20160823,20160628,新北府勞檢字第10534501844號,上泓企業有限公司,勞動基準法第39條,假日工資未給或於休假日工作未依規定加倍發給,,
新北市,20160823,20160628,新北府勞檢字第1053450184號,上泓企業有限公司,勞動基準法第22條第2項,工資未全額直接給付勞工,,
新北市,20170218,20161101,新北府勞檢字第1053467220號,上泓企業有限公司,勞動基準法第32條第2項,延長工作時間超過法令規定,,
新北市,20180221,20171103,新北府勞資字第1062171654號,上泓企業有限公司,勞動基準法第80條,拒絕、規避或阻撓勞工檢查員依法執行職務,,
