主管機關,公告日期,處分日期,處分字號,事業單位名稱或負責人,違法法規法條,違反法規內容,罰鍰金額,備註說明
台北市,20190304,20190130,北市勞動字第10760409261號,世界聯合通運有限公司黃靖宇,勞動基準法第39條;勞動基準法第36條第1項,假日工資未給或於休假日工作未依規定加給工資;未使勞工每7日中有2日之休息，其中1日為例假，1日為休息日,,
新北市,20190618,20190315,新北府勞檢字第10842484951號,世界聯合通運有限公司,勞動基準法第36條第1項,每七日中未有一日之休息作為例假,,
新北市,20190618,20190315,新北府勞檢字第10842484952號,世界聯合通運有限公司,勞動基準法第38條第4項,年度終結未休之日數未發給工資,,
新北市,20190618,20190315,新北府勞檢字第1084248495號,世界聯合通運有限公司,勞動基準法第23條第1項,工資未定期給付勞工,,
新北市,20201221,20200901,新北府勞檢字第10947903381號,世界聯合通運有限公司黃靖宇,勞動基準法第36條第1項,未給予勞工例假休息,40000,
新北市,20201221,20200901,新北府勞檢字第1094790338號,世界聯合通運有限公司黃靖宇,勞動基準法第22條第2項,工資未全額直接給付勞工,20000,
台北市,20221104,20220907,北市勞動字第11160808661號,世界聯合通運有限公司黃靖宇,勞動基準法第36條第1項,未使勞工每7日中有2日之休息，其中1日為例假，1日為休息日,50000,
勞動部勞工保險局,20230911,20230703,保退三字第11260073030號,世界聯合通運有限公司黃靖宇,勞工退休金條例第15條第2項,雇主未依規定覈實申報調整勞工退休金提繳工資。,5000,
