主管機關,公告日期,處分日期,處分字號,事業單位名稱或負責人,違法法規法條,違反法規內容,罰鍰金額,備註說明
台北市,20170804,20170616,北市勞動字第10632804100號,世登營造有限公司陳進華,勞動基準法第30條第6項;勞動基準法第36條,出勤紀錄未逐日記載勞工出勤情形至分鐘為止;每七日中未有一日之休息作為例假,,
桃園市,20181011,20180827,府勞檢字第1070011055號,世登營造有限公司陳進華,職業安全衛生設施規則第230條第1項第3款暨職業安全衛生法第6條第1項;職業安全衛生設施規則第230條第1項第4款暨職業安全衛生法第6條第1項;營造安全衛生設施標準第11條之1暨職業安全衛生法第6條第1項;營造安全衛生設施標準第19條第1項暨職業安全衛生法第6條第1項,雇主對於使用之合梯，應符合下列規定：一、…。三、梯腳與地面之角度應在七十五度以內，且兩梯腳間有金屬等硬質繫材扣牢，腳部有防滑絕緣腳座套。四、…。;雇主對於使用之合梯，應符合下列規定：一、…。四、有安全之防滑梯面。;雇主對於進入營繕工程工作場所作業人員，應提供適當安全帽，並使其正確戴用。;雇主對於高度二公尺以上之屋頂、鋼樑、開口部分、階梯、樓梯、坡道、工作臺、擋土牆、擋土支撐、施工構臺、橋樑墩柱及橋樑上部結構、橋臺等場所作業，勞工有遭受墜落危險之虞者，應於該處設置護欄、護蓋或安全網等防護設備。,,
桃園市,20180410,20180205,府勞檢字第1070029940號,世登營造有限公司陳進華,營造安全衛生設施標準第11條之1暨職業安全衛生法第6條第1項;營造安全衛生設施標準第19條第1項暨職業安全衛生法第6條第1項;營造安全衛生設施標準第59條第4款暨職業安全衛生法第6條第1項,雇主對於進入營繕工程工作場所作業人員，應提供適當安全帽，並使其正確戴用。;雇主對於高度二公尺以上之屋頂、鋼樑、開口部分、階梯、樓梯、坡道、工作臺、擋土牆、擋土支撐、施工構臺、橋樑墩柱及橋樑上部結構、橋臺等場所作業，勞工有遭受墜落危險之虞者，應於該處設置護欄、護蓋或安全網等防護設備。;雇主對於鋼管施工架之設置，應依下列規定辦理：一、…。四、構件之連接部分或交叉部分，應以適當之金屬附屬配件確實連接固定，並以適當之斜撐材補強。但系統式施工架應以輪盤及插銷扣件等組配件連接。五、…。,,
桃園市,20190311,20190121,府勞檢字第1080017659號,世登營造有限公司陳進華,職業安全衛生設施規則第230條第1項第3款暨職業安全衛生法第6條第1項;職業安全衛生設施規則第230條第1項第4款暨職業安全衛生法第6條第1項;營造安全衛生設施標準第11條之1暨職業安全衛生法第6條第1項;營造安全衛生設施標準第19條第1項暨職業安全衛生法第6條第1項,雇主對於使用之合梯，應符合下列規定：一、…。三、梯腳與地面之角度應在七十五度以內，且兩梯腳間有金屬等硬質繫材扣牢，腳部有防滑絕緣腳座套。四、…。;雇主對於使用之合梯，應符合下列規定：一、…。四、有安全之防滑梯面。;雇主對於進入營繕工程工作場所作業人員，應提供適當安全帽，並使其正確戴用。;雇主對於高度二公尺以上之屋頂、鋼樑、開口部分、階梯、樓梯、坡道、工作臺、擋土牆、擋土支撐、施工構臺、橋樑墩柱及橋樑上部結構、橋臺等場所作業，勞工有遭受墜落危險之虞者，應於該處設置護欄、護蓋或安全網等防護設備。,,
台北市,20201204,20200907,北市勞職字第10960930061號,世登營造有限公司,營造安全衛生設施標準第11-1條暨職業安全衛生法第6條第1項第1、3、5款,未提供安全帽使正確戴用。,,
