主管機關,公告日期,處分日期,處分字號,事業單位名稱或負責人,違法法規法條,違反法規內容,罰鍰金額,備註說明
台北市,20140406,20140113,府勞動字第10237579000號,中國人壽保險股份有限公司,勞動基準法第24條;勞動基準法第49條第1項;勞動基準法第32條第1項;勞動基準法第32條第2項,延長工作時間未依規定加給工資;未經勞資會議同意使女性勞工於午後10時至翌晨6時之時間內工作;延長工作時間不符法定要件;延長工作時間超過法令規定,,
高雄市,20140421,20140115,高市勞條字第10238280700號,中國人壽保險股份有限公司,勞動基準法第24條;勞動基準法第32條第2項,延長工作時間未依規定加給工資;延長工作時間超過法令規定,,
高雄市,20150921,20150723,高市勞條字第10433816300號,中國人壽保險股份有限公司,勞動基準法第30條第5項,未依規定置備勞工出勤紀錄表,,
台北市,20170224,20161212,北市勞動字第10542826500號,中國人壽保險股份有限公司王銘陽,勞動基準法第30條第6項,出勤紀錄未逐日記載勞工出勤情形至分鐘為止,,
桃園市,20170106,20161221,105年府勞檢字1050315895號,中國人壽保險股份有限公司王銘陽,勞基法第30條第6項,未逐日記載勞工出勤情形至分鐘為止,,
台南市,20170310,20170202,府勞條字第1060035911號,中國人壽保險股份有限公司王銘陽,勞動基準法第30條第6項,未逐日記載勞工出勤情形至分鐘為止。,,
台南市,20170310,20170217,府勞條字第1060139366號,中國人壽保險股份有限公司王銘陽,勞動基準法第27條,違反主管機關限期給付工資之命令。,,
高雄市,20170619,20170207,高市勞條字第10630519100號,中國人壽保險股份有限公司王銘陽,勞動基準法第22條第2項;勞動基準法第30條第6項,工資未全額直接給付勞工;未依規定逐日記載勞工出勤情形至分鐘為止,,
台北市,20230105,20221107,北市勞動字第11160289911號,中國人壽保險股份有限公司譚碩倫,勞動基準法第22條第2項,工資未依法給付給勞工,20000,
