主管機關,公告日期,處分日期,處分字號,事業單位名稱或負責人,違法法規法條,違反法規內容,罰鍰金額,備註說明
職業安全衛生署,20180611,20180321,勞職授字第1070200831號,中台橡膠工業股份有限公司,職業安全衛生設施規則第57條第1項職業安全衛生法第6條第1項,對於機械之掃除、上油、檢查、修理或調整有導致危害勞工之虞者，未停止相關機械運轉及送料。,,
職業安全衛生署,20200408,20190220,勞職授字第10802005121號,中台橡膠工業股份有限公司,優先管理化學品之指定及運作管理辦法第6條第1項職業安全衛生法第14條第2項,未將優先管理化學品之指定環保清洗劑相關資料報請中央主管機關備查。,,
職業安全衛生署,20200408,20190220,勞職授字第1080200512號,中台橡膠工業股份有限公司,勞工作業環境監測實施辦法第10條之1暨職業安全衛生法第12條第3項,"對於工作場所實施作業環境監測前,其所訂定之含採樣策略之作業環境監測計畫之相似暴露族群之建立,僅針對「粉塵」建立相似暴露族群,未依不同部門之危害、作業類型及暴露特性,建立有機溶劑各相似暴露族群;另對於上開計畫四、採樣策略之規劃及執行,僅規劃「噪音」,未規劃有機溶劑、粉塵等項目。",,
職業安全衛生署,20190709,20190418,勞職授字第1080201435號,中台橡膠工業股份有限公司,職業安全衛生設施規則第43條第1項、第245條暨職業安全衛生法第6條第1項,對於馬達轉軸未設護罩、護圍等設備、廠內維修區作業使用之焊接柄部分破損。,,
桃園市,20210705,20210521,府勞檢字第1100133334號,中台橡膠工業股份有限公司李文惠,職業安全衛生設施規則第57條第2項暨職業安全衛生法第6條第1項,前項機械停止運轉時，有彈簧等彈性元件、液壓、氣壓或真空蓄能等殘壓引起之危險者，雇主應採釋壓、關斷或阻隔等適當設備或措施。,,
桃園市,20250414,20250203,114年府勞檢字1140020080號,中台橡膠工業股份有限公司深町秀隆,職業安全衛生設施規則第43條第1項暨職業安全衛生法第6條第1項。;職業安全衛生設施規則第82條第1項暨職業安全衛生法第6條第1項。;固定式起重機安全檢查構造標準第40條暨職業安全衛生法第6條第1項。;有機溶劑中毒預防規則第26條暨職業安全衛生法第6條第1項。;職業安全衛生設施規則第209條暨職業安全衛生法第6條第1項。;機械設備器具安全標準第104條第1項暨職業安全衛生法第6條第1項。,雇主對於機械之原動機、轉軸、齒輪、帶輪、飛輪、傳動輪、傳動帶等有危害勞工之虞之部分，應有護罩、護圍、套胴、跨橋等設備。;雇主對於射出成型機、鑄鋼造形機、打模機、橡膠加硫成型機、輪胎成型機及其他加壓成型之機械等，有危害勞工之虞者，應設置安全門、雙手操作式安全裝置、感應式安全裝置或其他安全裝置。;吊鉤應設置防止吊掛用鋼索等脫落之阻擋裝置。;對於曾儲存有機溶劑或其混存物之容器而有發散有機溶劑蒸氣之虞者，應將該容器予以密閉或堆積於室外之一定場所。;雇主對於乙炔熔接裝置及氧乙炔熔接裝置，為防止氧氣背壓過高、氧氣逆流及回火造成危險，應於每一吹管分別設置安全器。;桌上用研磨機及床式研磨機使用之護罩，應以設置舌板或其他方法，使研磨之必要部分之研磨輪周邊與護罩間之間隙可調整在十毫米以下。,,
