主管機關,公告日期,處分日期,處分字號,事業單位名稱或負責人,違法法規法條,違反法規內容,罰鍰金額,備註說明
桃園市,20190610,20190426,府勞檢字第1080099485號,中興紡織廠股份有限公司鮑泰鈞,職業安全衛生設施規則第126條暨職業安全衛生法第6條第1項;機械設備器具安全標準第80條暨職業安全衛生法第6條第1項,雇主對於荷重在一公噸以上之堆高機，應指派經特殊安全衛生教育、訓練人員操作。;堆高機應設置後扶架。但堆高機已註明限使用於將桅桿後傾之際貨物掉落時無引起危害之虞者，不在此限。,,
桃園市,20190805,20190626,府勞檢字第1080159797號,中興紡織廠股份有限公司鮑泰鈞,職業安全衛生設施規則第43條第1項暨職業安全衛生法第6條第1項;固定式起重機安全檢查構造標準第45條第4款暨職業安全衛生法第6條第1項;固定式起重機安全檢查構造標準第45條第3款暨職業安全衛生法第6條第1項;職業安全衛生設施規則第287條暨職業安全衛生法第6條第1項;固定式起重機安全檢查構造標準第40條暨職業安全衛生法第6條第1項,雇主對於機械之原動機、轉軸、齒輪、帶輪、飛輪、傳動輪、傳動帶等有危害勞工之虞之部分，應有護罩、護圍、套胴、跨橋等設備。;操作人員於地面上操作，並隨荷物移動之固定起重機，其操作用開關器，應符合下列規定：一、…。四、電纜線不得作為支撐操作用開關器重量之引索。但該電纜線具有足夠強度時，不在此限。;操作人員於地面上操作，並隨荷物移動之固定起重機，其操作用開關器，應符合下列規定：一、…。三、應於操作人員易見處標示該操作用開關器所控制之動作種類及動作方向。四、…。;雇主對於勞工有暴露於高溫、低溫、非游離輻射線、生物病原體、有害氣體、蒸氣、粉塵或其他有害物之虞者，應置備安全衛生防護具，如安全面罩、防塵口罩、防毒面具、防護眼鏡、防護衣等適當之防護具，並使勞工確實使用。;吊鉤應設置防止吊掛用鋼索等脫落之阻擋裝置。但於特殊環境吊掛特定荷物，實施全程安全分析，報經檢查機構認可者，不在此限。,,
桃園市,20191209,20191003,府勞檢字第1080247732號,中興紡織廠股份有限公司鮑泰鈞,機械設備器具安全標準第80條暨職業安全衛生法第6條第1項,堆高機應設置後扶架。但堆高機已註明限使用於將桅桿後傾之際貨物掉落時無引起危害之虞者，不在此限。,,
桃園市,20200409,20200217,府勞檢字第1090036828號,中興紡織廠股份有限公司鮑泰鈞,起重升降機具安全規則第62條第2項暨職業安全衛生法第6條第1項;職業安全衛生設施規則第108條第5款暨職業安全衛生法第6條第1項,雇主對於前項起重機具操作及吊掛作業，應分別指派具法定資格之勞工擔任之。但於地面以按鍵方式操作之固定式起重機，或積載型卡車起重機，其起重及吊掛作業，得由起重機操作者一人兼任之。;雇主對於高壓氣體之貯存，應依下列規定辦理：一、…。五、應安穩置放並加固定及裝妥護蓋。六、…。,,
桃園市,20240108,20231120,112年府勞檢字1120325157號,中興紡織廠股份有限公司鮑泰鈞,勞基法第39條,例假、休息日、第37條所定之休假日及特別休假出勤，未依規定加給工資,50000,
桃園市,20231205,20231031,府勞檢字第11203028821號,中興紡織廠股份有限公司鮑泰鈞,職業安全衛生法第27條第1項第1款;職業安全衛生法第27條第1項第2款;職業安全衛生法第27條第1項第3款;職業安全衛生法第27條第1項第4款,事業單位與承攬人、再承攬人分別僱用勞工共同作業時，為防止職業災害，原事業單位應採取下列必要措施：一、設置協議組織，並指定工作場所負責人，擔任指揮、監督及協調之工作。二、…。;事業單位與承攬人、再承攬人分別僱用勞工共同作業時，為防止職業災害，原事業單位應採取下列必要措施：一、…。二、工作之連繫與調整。三、…。;事業單位與承攬人、再承攬人分別僱用勞工共同作業時，為防止職業災害，原事業單位應採取下列必要措施：一、…。三、工作場所之巡視。四、…。;事業單位與承攬人、再承攬人分別僱用勞工共同作業時，為防止職業災害，原事業單位應採取下列必要措施：一、…。四、相關承攬事業間之安全衛生教育之指導及協助。五、…。,,
桃園市,20231205,20231031,府勞檢字第1120302882號,中興紡織廠股份有限公司鮑泰鈞,職業安全衛生設施規則第195條暨職業安全衛生法第6條第1項,雇主對於化學設備或其配管存有腐蝕性之危險物或閃火點在６５℃以上之化學物質之部分，為防止爆炸、火災、腐蝕及洩漏之危險，該部分應依危險物、化學物質之種類、溫度、濃度、壓力等，使用不易腐蝕之材料製造或裝設內襯等。,,
桃園市,20241009,20240823,113年府勞檢字1130232157號,中興紡織廠股份有限公司鮑泰鈞,粉塵危害預防標準第006條暨職業安全衛生法第6條第1項,雇主為防止特定粉塵發生源之粉塵之發散，應依規定所列之每一特定粉塵發生源，分別設置對應同表該欄所列設備之任何之一種或具同等以上性能之設備。,,
