主管機關,公告日期,處分日期,處分字號,事業單位名稱或負責人,違法法規法條,違反法規內容,罰鍰金額,備註說明
台北市,20230705,20230516,府勞職字第11260657081號,九旺營造股份有限公司沈淑君,營造安全衛生設施標準第19條第1項暨職業安全衛生法第6條第1項第13款,有墜落危險之處所未設防護設備。,,
台北市,20231106,20230919,府勞職字第11260958941號,九旺營造股份有限公司沈淑君,職業安全衛生法第27條第1項第1款、第2款、第3款,原事業單位未採取承攬管理必要措施。,,
台北市,20240805,20240614,北市勞職字第11360727691號,九旺營造股份有限公司沈淑君,職業安全衛生設施規則第230條第1項第3款暨職業安全衛生法第6條第1項第1款、第2款、第3款、第4款、第5款、第6款、第7款、第8款、第9款、第10款、第11款、第12款、第13款、第14款;職業安全衛生設施規則第243條第1項第3款暨職業安全衛生法第6條第1項第1款、第2款、第3款、第4款、第5款、第6款、第7款、第8款、第9款、第10款、第11款、第12款、第13款、第14款,合梯未符合規定。;未依規定裝設漏電斷路器。,,
台北市,20241007,20240809,北市勞職字第11360823871號,九旺營造股份有限公司沈淑君,營造安全衛生設施標準第19條第1項暨職業安全衛生法第6條第1項第13款;職業安全衛生設施規則第232條暨職業安全衛生法第6條第1項第13款,有墜落危險之處所未設防護設備。;未設置警告標示並禁止人員進入。,,
台北市,20241105,20240913,北市勞職字第11360881781號,九旺營造股份有限公司沈淑君,營造安全衛生設施標準第19條第1項暨職業安全衛生法第6條第1項第13款,有墜落危險之處所未設防護設備。,,
