主管機關,公告日期,處分日期,處分字號,事業單位名稱或負責人,違法法規法條,違反法規內容,罰鍰金額,備註說明
新北市,20160823,20160519,新北府勞檢字第10534453691號,九鴻管理顧問有限公司,勞動基準法第36條,每七日中未有一日之休息作為例假,,
新北市,20160823,20160519,新北府勞檢字第1053445369號,九鴻管理顧問有限公司,勞動基準法第32條第2項,延長工作時間超過法令規定,,
新北市,20160823,20160519,新北府勞檢字第10534453691號,九鴻管理顧問有限公司,勞動基準法第36條,每七日中未有一日之休息作為例假,,
新北市,20160823,20160519,新北府勞檢字第1053445369號,九鴻管理顧問有限公司,勞動基準法第32條第2項,延長工作時間超過法令規定,,
台南市,20221110,20221014,南市勞安字第1111308771號,九鴻管理顧問有限公司沈秀枝,勞動基準法第21條第1項;勞動基準法第24條;勞動基準法第39條,未達基本工資;延長工作時間未依規定加給工資;假日工資未給或於休假日工作未依規定加給工資。,60000,
勞動部勞工保險局,20250210,20241225,保退一字第11369911125號,九鴻管理顧問有限公司沈秀枝,勞工退休金條例第19條第1項,雇主未按時繳納勞工退休金致加徵滯納金。,634056,
台中市,20240905,20240703,府授勞動字第1130178300號,九鴻管理顧問有限公司沈秀枝,勞動基準法第24條,未依規給付延長工時工資,20000,
