主管機關,公告日期,處分日期,處分字號,事業單位名稱或負責人,違法法規法條,違反法規內容,罰鍰金額,備註說明
台北市,20200305,20191203,北市勞職字第10861026863,于舜工程有限公司,營造安全衛生設施標準第19條第1項暨職業安全衛生法第6條第1項第5款,有墜落危險之處所未設防護設備。,,
職業安全衛生署,20200805,20200505,勞職授字第10902016211號,于舜工程有限公司,職業安全衛生設施規則第281條第1項暨職業安全衛生法第6條第1項,"在高度2公尺以上之高處作業,未使勞工確實使用安全帶、安全帽及其他必要之防護具。",,
勞動部勞工保險局,20210810,20210624,保退一字第11069911065號,于舜工程有限公司黃怡文,勞工退休金條例第19條第1項,雇主未按時繳納勞工退休金致加徵滯納金。,2899,
職業安全衛生署,20211104,20210804,勞職授字第11002041021號,于舜工程有限公司,職業安全衛生設施規則第228條項暨職業安全衛生法第6條第1項,對勞工於高差超過一．五公尺以上之場所作業時，未設置能使勞工安全上下之設備。,,
職業安全衛生署,20221009,20220727,勞職授字第11102043062號,于舜工程有限公司黃怡文,職業安全衛生設施規則第116條第14款暨職業安全衛生法第6條第1項,使用座式操作之配衡型堆高機及側舉型堆高機，未使擔任駕駛之勞工確實使用駕駛座安全帶。,,
職業安全衛生署,20240810,20240627,勞職授字第1130205033A號,于舜工程有限公司黃怡文,營造安全衛生設施標準第19條第1項暨職業安全衛生法第6條第1項,對於高度二公尺以上之開口部分、工作臺等場所作業，勞工有遭受墜落危險之虞者，未於該處設置護欄、護蓋或安全網等防護設備。,,
