主管機關,公告日期,處分日期,處分字號,事業單位名稱或負責人,違法法規法條,違反法規內容,罰鍰金額,備註說明
科技部中部科學工業園區,20171106,20171106,中環字第1060025238號,亞崴機電股份有限公司台中分公司楊德華,職業安全衛生法第27條第1項,事業單位與承攬人、再承攬人分別僱用勞工共同作業時，為防止職業災害，原事業單位應採取下列必要措施。一、設置協議組織，並指定工作場所負責人，擔任指揮、監督及協調之工作。二、工作之連繫與調整。三、工作場所之巡視。……規定,,
科技部中部科學工業園區,20171106,20171106,中環字第1060025238號,亞崴機電股份有限公司台中分公司楊德華,職業安全衛生法第27條第1項,事業單位與承攬人、再承攬人分別僱用勞工共同作業時，為防止職業災害，原事業單位應採取下列必要措施。一、設置協議組織，並指定工作場所負責人，擔任指揮、監督及協調之工作。二、工作之連繫與調整。三、工作場所之巡視。……規定,,
新竹縣,20191105,20190815,108年府勞資字1083906276號,亞崴機電股份有限公司,勞基法第24條,延長工作時間未依規定加給工資;,,
職業安全衛生署,20221209,20220912,勞職授字第11102050131號,亞崴機電股份有限公司楊德華,職業安全衛生法第27條第1項第1款、第2款、第3款、第4款,與承攬人分別僱用勞工共同作業時，未設置協議組織並指定工作場所負責人擔任指揮、監督及協調之工作、未採取工作之連繫與調整之必要措施、未巡視工作場所、未指導及協助相關承攬事業間之安全衛生教育。,,
職業安全衛生署,20250315,20250226,勞職授字第1140250833號,亞崴機電股份有限公司楊德華,職業安全衛生設施規則第90條暨職業安全衛生法第6條第1項,對於起重機具之吊鉤或吊具，未有防止吊舉中所吊物體脫落之裝置。,,
