主管機關,公告日期,處分日期,處分字號,事業單位名稱或負責人,違法法規法條,違反法規內容,罰鍰金額,備註說明
職業安全衛生署,20190211,20181123,勞職授字第10702038173號,亞通利大能源股份有限公司,職業安全衛生法第26條第2項,"承攬人就其承攬之全部或一部分交付再承攬時,未於事前告知再承攬人有關其事業工作環境、危害因素暨本法有關安全衛生規定應採取之措施。",,
台北市,20191205,20190925,北市勞職字第AYAA10860679193號,亞通利大能源股份有限公司,職業安全衛生法第26條第1項,未事前告知該承攬人依規定應採取措施。,,
職業安全衛生署,20191107,20190715,勞職授字第1080203003號,亞通利大能源股份有限公司,營造安全衛生設施標準第19條第1項暨職業安全衛生法第6條第1項,對於高度2公尺以上之施工架開口部分，勞工有發生墜落危害之場所，未設置護欄、護蓋或安全網等防護設備。,,
職業安全衛生署,20191107,20190723,勞職授字第1080203123號,亞通利大能源股份有限公司,職業安全衛生設施規則第43條第1項暨職業安全衛生法第6條第1項,對於高壓沖洗機之傳動帶，勞工有發生捲夾危害之虞，未設置護罩、護圍等設備。,,
台北市,20220105,20211025,北市勞職字第11061010433號,亞通利大能源股份有限公司呂元瑞,營造安全衛生設施標準第11-1條暨職業安全衛生法第6條第1項第1、3、5款;職業安全衛生設施規則第225條第1項暨職業安全衛生法第6條1項第5款,未提供安全帽使正確戴用。;2公尺以上作業未設置工作台。,,
台中市,20220710,20220608,府授勞檢字第1110147513號,亞通利大能源股份有限公司呂元瑞,職業安全衛生法第6條第1項、職業安全衛生法第26條,未符合規定之必要安全衛生設備及措施；事業單位以其事業之全部或一部分交付承攬時，未於事前告知該承攬人有關其事業工作環境、危害因素暨本法及有關安全衛生規定應採取之措施,,
職業安全衛生署,20221110,20220725,勞職授字第1110204244號,亞通利大能源股份有限公司呂元瑞,職業安全衛生法第27條第1項第1款,與承攬人共同作業時，未設置協議組織並指定工作場所負責人擔任指揮、監督及協調之工作。,,
職業安全衛生署,20230209,20221116,勞職授字第11102065542號,亞通利大能源股份有限公司呂元瑞,營造安全衛生設施標準第19條第1項暨職業安全衛生法第6條第1項,對於高度二公尺以上之開口部分、工作臺等場所作業，勞工有遭受墜落危險之虞者，未於該處設置護欄、護蓋或安全網等防護設備。,,
