主管機關,公告日期,處分日期,處分字號,事業單位名稱或負責人,違法法規法條,違反法規內容,罰鍰金額,備註說明
職業安全衛生署,20170603,20170320,勞職授字第1060201241號,信功實業股份有限公司屏東食品工廠,職業安全衛生設施規則第245條暨職業安全衛生法第6條第1項,對電焊作業使用之焊接柄，未有相當之絕緣耐力及耐熱性。,,
職業安全衛生署,20170603,20170320,勞職授字第1060201241號,信功實業股份有限公司屏東食品工廠,職業安全衛生設施規則第245條暨職業安全衛生法第6條第1項,對電焊作業使用之焊接柄，未有相當之絕緣耐力及耐熱性。,,
職業安全衛生署,20201008,20200724,勞職授字第1090203061號,信功實業股份有限公司,職業安全衛生設施規則第43條第1項暨職業安全衛生法第6條第1項,對於機械之原動機、轉軸、齒輪、帶輪、飛輪、傳動輪、傳動帶等有危害勞工之虞之部分，未有護罩、護圍、套胴、跨橋等設備。,,
屏東縣,20210706,20210519,屏府勞動資字第11018800900號,信功實業股份有限公司代表人楊博仁,勞動基準法第32條第2項,延長工作時間超過法令規定。,20000,
職業安全衛生署,20240309,20240119,勞職授字第1130202299號,信功實業股份有限公司楊博仁,職業安全衛生設施規則第116條第14款、同規則第153條暨職業安全衛生法第6條第1項,堆高機操作人員未使用駕駛座安全帶;雇主對於搬運、堆放或處置物料，為防止倒塌、崩塌或掉落，未採取繩索捆綁、護網、擋樁、限制高度或變更堆積等必要設施，並禁止與作業無關人員進入該等場所。,,陳洪澤
