主管機關,公告日期,處分日期,處分字號,事業單位名稱或負責人,違法法規法條,違反法規內容,罰鍰金額,備註說明
桃園市,20160406,20160310,105年府勞條字1050036509號,信實公寓大廈管理維護股份有限公司陸耀祖,勞基法第24條,延長工作時間未依規定加給工資,,
桃園市,20160506,20160412,105年府勞條字1050067930號,信實公寓大廈管理維護股份有限公司陸耀祖,勞基法第32條第2項,延長工作時間超過法令規定,,
台北市,20180201,20171201,北市勞動字第10639678000號,信實公寓大廈管理維護股份有限公司陸耀祖,勞動基準法第39條;勞動基準法第24條第2項,假日工資未給或於休假日工作未依規定加給工資;未依法給付休息日工作之工資,,
桃園市,20201117,20200921,府勞檢字第1090237161號,信實公寓大廈管理維護股份有限公司陸耀祖,職業安全衛生設施規則第21條暨職業安全衛生法第6條第1項,雇主對於勞工工作場所之通道、地板、階梯、坡道、工作台或其他勞工踩踏場所，應保持不致使勞工跌倒、滑倒、踩傷、滾落等之安全狀態，或採取必要之預防措施。,,
桃園市,20240710,20240516,府勞檢字第1130127448號,信實公寓大廈管理維護股份有限公司楊文榮,職業安全衛生設施規則第128條之1第1款暨職業安全衛生法第6條第1項,雇主對於使用高空工作車之作業，應依下列事項辦理：一、除行駛於道路上外，應於事前依作業場所之狀況、高空工作車之種類、容量等訂定包括作業方法之作業計畫，使作業勞工周知，並指定專人指揮監督勞工依計畫從事作業。二、…。,,
