主管機關,公告日期,處分日期,處分字號,事業單位名稱或負責人,違法法規法條,違反法規內容,罰鍰金額,備註說明
台北市,20170801,20170612,北市勞職字第10634087802號,偉合工程有限公司,營造安全衛生設施標準第19條第2項暨職業安全衛生法第6條第1項第5款。,對於高度2公尺以上之開口部分從事作業，因架設護欄有困難者，未使勞工確實使用安全帶等防止墜落之措施，使勞工有遭受墜落危險之虞。,,
台北市,20170801,20170612,北市勞職字第10634087802號,偉合工程有限公司,營造安全衛生設施標準第19條第2項暨職業安全衛生法第6條第1項第5款。,對於高度2公尺以上之開口部分從事作業，因架設護欄有困難者，未使勞工確實使用安全帶等防止墜落之措施，使勞工有遭受墜落危險之虞。,,
台北市,20230206,20221214,北市勞職字第11161204993號,偉合工程有限公司洪進財,營造安全衛生設施標準第11-1條暨職業安全衛生法第6條第1項第1款、第3款、第5款;營造安全衛生設施標準第19條第1項暨職業安全衛生法第6條第1項第5款,未提供安全帽使正確戴用。;有墜落危險之處所未設防護設備。,,
台北市,20250407,20250220,北市勞職字第11460536231號,偉合工程有限公司洪進財,職業安全衛生設施規則第280-1條暨職業安全衛生法第6條第1項第5款,雇主使勞工於有車輛出入或往來之工作場所作業時，有導致勞工遭受交通事故之虞者，未明顯設置警戒標示，或未置備反光背心等防護衣使勞工確實使用。,,
職業安全衛生署,20250215,20250102,勞職授字第1130207404C號,偉合工程有限公司洪進財,職業安全衛生法第26條第2項,以其承攬之全部或一部分交付再承攬時，未於事前告知該再承攬人有關其事業工作環境、危害因素暨職業安全衛生法及有關安全衛生規定應採取之措施。,,
職業安全衛生署,20250215,20250102,勞職授字第1130207404D號,偉合工程有限公司洪進財,營造安全衛生設施標準第第74條第1項第4款暨職業安全衛生法第6條第1項,雇主對於擋土支撐組配、拆除（以下簡稱擋土支撐）作業，未指派擋土支撐作業主管於作業現場辦理下列事項：一、…四、確認安全衛生設備及措施之有效狀況。,,
