主管機關,公告日期,處分日期,處分字號,事業單位名稱或負責人,違法法規法條,違反法規內容,罰鍰金額,備註說明
職業安全衛生署,20200710,20200325,勞職授字第10902012011號,健安水電工程有限公司,職業安全衛生法第49條第1款,發生職業安全衛生法第37條第2項第1款之職業災害。,,
職業安全衛生署,20200710,20200325,勞職授字第1090201201號,健安水電工程有限公司,職業安全衛生法第37條第2項,勞動場所發生罹災人數在1人以上，且需住院治療之職業災害，未於8小時內通報勞動檢查機構。,,
苗栗縣,20200510,20200421,府勞資字第1090074528號,健安水電工程有限公司,勞動基準法第59條第1項第4款,勞工遭遇職業傷害或罹患職業病而死亡時，雇主除給與五個月平均工資之喪葬費外，並應一次給與其遺屬四十個月平均工資之死亡補償。,,
勞動部勞工保險局,20211012,20210823,保退一字第11069911085號,健安水電工程有限公司劉憲章,勞工退休金條例第19條第1項,雇主未按時繳納勞工退休金致加徵滯納金。,1107,
勞動部勞工保險局,20220210,20211223,保退一字第11069911125號,健安水電工程有限公司劉憲章,勞工退休金條例第19條第1項,雇主未按時繳納勞工退休金致加徵滯納金。,2396,
