主管機關,公告日期,處分日期,處分字號,事業單位名稱或負責人,違法法規法條,違反法規內容,罰鍰金額,備註說明
職業安全衛生署,20200708,20200409,勞職授字第1090201494號,僑福營造股份有限公司,營造安全衛生設施標準第19條第1項暨職業安全衛生法第6條第1項,"對於高度2公尺以上之開口邊緣處作業場所,勞工有遭受墜落危害之虞者,未設置護欄、護蓋或安全網等防護設備。",,
台北市,20220105,20211104,北市勞動字第11060256381號,僑福營造股份有限公司甘明豐,勞動基準法第22條第2項,工資未全額給付給勞工,20000,
勞動部勞工保險局,20221212,20221013,保退三字第11113253332號,僑福營造股份有限公司甘明豐,勞工退休金條例第15條第2項,雇主未依規定覈實申報調整勞工退休金提繳工資。,5000,
勞動部勞工保險局,20240611,20240425,保退一字第11369911045號,僑福營造股份有限公司甘明豐,勞工退休金條例第19條第1項,雇主未按時繳納勞工退休金致加徵滯納金。,1413,
桃園市,20250109,20241127,113年府勞檢字1130333832號,僑福營造股份有限公司甘明豐,職業安全衛生設施規則第21條暨職業安全衛生法第6條第1項；營造安全衛生設施標準第5條暨職業安全衛生法第6條第1項；營造安全衛生設施標準第19條第1項暨職業安全衛生法第6條第1項,雇主對於勞工工作場所之通道、地板、階梯，應保持不致使勞工跌倒、滑倒、踩傷等之安全狀態，或採取必要之預防措施。；雇主對於工作場所暴露之鋼筋、鋼材、鐵件、鋁件及其他材料等易生職業災害者，應採取彎曲尖端、加蓋或加裝護套等防護設施。；雇主對於高度二公尺以上之屋頂、鋼梁、開口部分、階梯、樓梯、坡道、工作臺、擋土牆、擋土支撐、施工構臺、橋梁墩柱及橋梁上部結構、橋臺等場所作業，勞工有遭受墜落危險之虞者，應於該處設置護欄、護蓋或安全網等防護設備。,,
