主管機關,公告日期,處分日期,處分字號,事業單位名稱或負責人,違法法規法條,違反法規內容,罰鍰金額,備註說明
新北市,20230612,20230421,新北府勞檢字第11246616611號,億利汽車有限公司張德勝,勞動基準法第36條第1項,未給予勞工例假休息,20000,
新北市,20230612,20230421,新北府勞檢字第11246616611號,億利汽車有限公司張德勝,勞動基準法第36條第1項,未給予勞工例假休息,20000,
新北市,20230612,20230421,新北府勞檢字第1124661661號,億利汽車有限公司張德勝,勞動基準法第30條第6項,出勤紀錄未依規定應逐日記載勞工出勤情形至分鐘,20000,
新北市,20230612,20230421,新北府勞檢字第1124661661號,億利汽車有限公司張德勝,勞動基準法第30條第6項,出勤紀錄未依規定應逐日記載勞工出勤情形至分鐘,20000,
勞動部勞工保險局,20240812,20240604,保退二字第11360067230號,億利汽車有限公司張德勝,勞工退休金條例第15條第2項,雇主未依規定覈實申報調整勞工退休金提繳工資。,5000,
