主管機關,公告日期,處分日期,處分字號,事業單位名稱或負責人,違法法規法條,違反法規內容,罰鍰金額,備註說明
宜蘭縣,20160710,20160530,府勞資字第1050075215號,優尼聖企業股份有限公司,勞基法第32條第2項;勞基法第36條;勞基法第39條,延長工時超過法定上限;勞工未每七日中至少有一日之休假作為例假;休假日工作工資未加倍發給,,
宜蘭縣,20160710,20160530,府勞資字第1050075215號,優尼聖企業股份有限公司,勞基法第32條第2項;勞基法第36條;勞基法第39條,延長工時超過法定上限;勞工未每七日中至少有一日之休假作為例假;休假日工作工資未加倍發給,,
新北市,20230421,20230206,新北府勞檢字第11246523621號,優尼聖企業股份有限公司羅榮科,勞動基準法第36條第1項,未給予勞工例假休息,40000,
新北市,20230421,20230206,新北府勞檢字第1124652362號,優尼聖企業股份有限公司羅榮科,勞動基準法第24條,延長工作時間未依規定加給工資,40000,
桃園市,20230703,20230501,112年府勞檢字11201117961號,優尼聖企業股份有限公司羅榮科,勞基法第36條第2項,採變形工時制度，未依規定安排勞工例假或休息日,50000,
桃園市,20230703,20230501,112年府勞檢字1120111796號,優尼聖企業股份有限公司羅榮科,勞基法第24條第1項,延長工作時間未依規定加給工資,50000,
