主管機關,公告日期,處分日期,處分字號,事業單位名稱或負責人,違法法規法條,違反法規內容,罰鍰金額,備註說明
台北市,20150505,20150324,府勞動字第10338689600號,元鼎國際企業股份有限公司林明祥,勞動基準法第32條第2項;勞動基準法第36條;勞動基準法第38條,延長工作時間超過法令規定;每七日中未有一日之休息作為例假;未依規定給予特別休假,,
台北市,20150605,20150420,府勞動字第10431158300號,元鼎國際企業股份有限公司,勞動基準法第36條;勞動基準法第39條,每七日中未有一日之休息作為例假;假日工資未給或於休假日工作未依規定加給工資,,
高雄市,20150921,20150701,高市勞條字第10435026000號,元鼎國際企業股份有限公司,勞動基準法第24條;勞動基準法第32條第2項;勞動基準法第36條;勞動基準法第38條,延長工作時間未依規定加給工資;延長工作時間超過法令規定;每七日中未有一日之休息作為例假;未依規定給予特別休假,,
台北市,20160425,20160203,北市勞動字第10439644200號,元鼎國際企業股份有限公司林明祥,勞動基準法第24條,延長工作時間未依規定加給工資,,
台南市,20160310,20160219,府勞條字第1050146292號,元鼎國際企業股份有限公司林明祥,勞動基準法第49條第1項,使女工從事夜間工作不符法定要件;,,
高雄市,20160518,20160324,高市勞條字第10531291800號,元鼎國際企業股份有限公司,勞動基準法第32條第2項,延長工作時間超過法令規定,,
