主管機關,公告日期,處分日期,處分字號,事業單位名稱或負責人,違法法規法條,違反法規內容,罰鍰金額,備註說明
屏東縣,20220509,20220321,屏府勞動資字第11110517600號,益鎮即內行競技休閒館,勞動基準法第30條第6項,出勤紀錄未逐日記載勞工出勤情形至分鐘為止。,20000,
屏東縣,20220509,20220321,屏府勞動資字第11110517600號,温益鎮即內行競技休閒館,勞動基準法第30條第6項,出勤紀錄未逐日記載勞工出勤情形至分鐘為止。,20000,
屏東縣,20220509,20220414,屏府勞動資字第11114534200號,益鎮即內行競技休閒館,勞動基準法第36條第1項,未使勞工每7日中有2日之休息，其中1日為例假，1日為休息日。,20000,
屏東縣,20220509,20220414,屏府勞動資字第11114534200號,温益鎮即內行競技休閒館,勞動基準法第36條第1項,未使勞工每7日中有2日之休息，其中1日為例假，1日為休息日。,20000,
屏東縣,20220908,20220803,屏府勞動資字第11150326000號,温益鎮即內行競技休閒館,勞動基準法第36條第1項,未使勞工每7日中有2日之休息，其中1日為例假，1日為休息日。,40000,
屏東縣,20241113,20241018,屏府勞動資字第1130062709號,温益鎮即內行競技休閒館,勞動基準法第30條第5項,未依規定置備勞工出勤紀錄。,90000,
