主管機關,公告日期,處分日期,處分字號,事業單位名稱或負責人,違法法規法條,違反法規內容,罰鍰金額,備註說明
職業安全衛生署,20211001,20210712,勞職授字第1100203630號,全國營造股份有限公司,營造安全衛生設施標準第11條之1職業安全衛生設施規則第228條暨職業安全衛生法第6條第1項,對於進入營繕工程工作場所作業人員，未提供適當安全帽，並使其正確戴用；對於高差1.5公尺以上之鋼構屋頂工作場所作業，未設置使勞工安全上下之設備,,
新北市,20220819,20220615,新北府勞檢字第1114748492號,全國營造股份有限公司李敬評,職業安全衛生法第6條第1項,未符合規定之必要安全衛生設備及措施,,
新北市,20240816,20240528,新北府勞檢字第1134646374號,全國營造股份有限公司李敬評,職業安全衛生法第6條第1項,未符合規定之必要安全衛生設備及措施,,
新北市,20241018,20240822,新北府勞檢字第1134656880號,全國營造股份有限公司李敬評,職業安全衛生法第6條第1項,未符合規定之必要安全衛生設備及措施,,
新北市,20241220,20241011,新北府勞檢字第1134662701號,全國營造股份有限公司李敬評,職業安全衛生法第6條第1項,未符合規定之必要安全衛生設備及措施,,
桃園市,20250414,20250219,114年府勞檢字第1140041789號,全國營造股份有限公司李敬評,職業安全衛生設施規則第238條暨職業安全衛生法第6條第1項；營造安全衛生設施標準第11條之1暨職業安全衛生法第6條第1項；營造安全衛生設施標準第19條第1項暨職業安全衛生法第6條第1項；營造安全衛生設施標準第19條第2項暨職業安全衛生法第6條第1項,雇主對於工作場所有物體飛落之虞者，應設置防止物體飛落之設備，並供給安全帽等防護具，使勞工戴用。；雇主對於進入營繕工程工作場所作業人員，應提供適當安全帽，並使其正確戴用。；雇主對於高度二公尺以上之屋頂、鋼梁、開口部分、階梯、樓梯、坡道、工作臺、擋土牆、擋土支撐、施工構臺、橋梁墩柱及橋梁上部結構、橋臺等場所作業，勞工有遭受墜落危險之虞者，應於該處設置護欄、護蓋或安全網等防護設備。；雇主設置前項設備有困難，或因作業之需要臨時將護欄、護蓋或安全網等防護設備開啟或拆除者，應採取使勞工使用安全帶等防止墜落措施。但其設置困難之原因消失後，應依前項規定辦理。,,
