主管機關,公告日期,處分日期,處分字號,事業單位名稱或負責人,違法法規法條,違反法規內容,罰鍰金額,備註說明
新北市,20171215,20170906,新北府勞檢字第1063579845號,共鵬企業有限公司,勞動基準法第23條第2項,未依規定置備工資清冊,,
新北市,20171215,20170906,新北府勞檢字第1063579845號,共鵬企業有限公司,勞動基準法第23條第2項,未依規定置備工資清冊,,
勞動部勞工保險局,20230810,20230626,保退一字第11269911065號,共鵬企業有限公司吳謝素珍,勞工退休金條例第19條第1項,雇主未按時繳納勞工退休金致加徵滯納金。,36689,
桃園市,20240205,20231208,112年府勞檢字1120331650號,共鵬企業有限公司吳謝素珍,勞基法第22條第2項,工資未全額直接給付勞工,60000,
桃園市,20240205,20231208,112年府勞檢字1120331650號,共鵬企業有限公司吳謝素珍,勞基法第22條第2項,工資未全額直接給付勞工,60000,
桃園市,20231205,20231026,府勞檢字第1120292555號,共鵬企業有限公司吳謝素珍,職業安全衛生設施規則第116條第14款暨職業安全衛生法第6條第1項;機械設備器具安全標準第76條暨職業安全衛生法第6條第1項;機械設備器具安全標準第78條暨職業安全衛生法第6條第1項;工業用機器人危害預防標準第21條第1項第1款暨職業安全衛生法第6條第1項;職業安全衛生設施規則第159條第6款暨職業安全衛生法第6條第1項;機械設備器具安全標準第84條第2項第2款暨職業安全衛生法第6條第1項;機械設備器具安全標準第6條第1項第3款暨職業安全衛生法第6條第1項,雇主對於勞動場所作業之車輛機械，應使駕駛者或有關人員負責執行下列事項：一、…。十四、使用座式操作之配衡型堆高機及側舉型堆高機，應使擔任駕駛之勞工確實使用駕駛座安全帶。但駕駛座配置有車輛傾倒時，防止駕駛者被堆高機壓傷之護欄或其他防護設施者，不在此限。十五、…。;堆高機應於其左右各設一個方向指示器。但最高時速未達二十公里之堆高機，其操控方向盤之中心至堆高機最外側未達六十五公分，且機內無駕駛座者，得免設方向指示器。;堆高機應設置前照燈及後照燈。但堆高機已註明限照度良好場所使用者，不在此限。;雇主於機器人可動範圍之外側，依下列規定設置圍柵或護圍：一、出入口以外之處所，應使工作者不易進入可動範圍內。二、…。;雇主對物料之堆放，應依下列規定：一、…。六、不得妨礙消防器具之緊急使用。七、…。;使用座式操作之堆高機，應符合下列規定：一、…。二、配衡型堆高機及側舉型堆高機之駕駛座，應配置防止車輛傾倒時，駕駛者被堆高機壓傷之安全帶、護欄或其他防護設施。;衝剪機械之安全裝置，應具有下列機能之一：一、…。三、感應式安全裝置：滑塊等在閉合動作中，遇身體之一部接近危險界限時，能使滑塊等停止動作。四、…。,,
