主管機關,公告日期,處分日期,處分字號,事業單位名稱或負責人,違法法規法條,違反法規內容,罰鍰金額,備註說明
南投縣,20170214,20170214,府社勞資字第1060034690號,許淇安即凱安商行,勞動基準法第39條,休例假日出勤工資應加倍發給,,
南投縣,20170214,20170214,府社勞資字第1060034690號,許淇安即凱安商行,勞動基準法第39條,休例假日出勤工資應加倍發給,,
南投縣,20170214,20170214,府社勞資字第1060034693號,許淇安即凱安商行,勞動基準法第24條,雇主延長勞工工作時間者，其延長工作時間之工資依左列標準加給之：一、延長工作時間在二小時以內者，按平日每小時工資額加給三分之一以上。二、再延長工作時間在二小時以內者，按平日每小時工資額加給三分之二以上。三、依第三十二條第三項規定，延長工作時間者，按平日每小時工資額加倍發給之。,,
南投縣,20170214,20170214,府社勞資字第1060034693號,許淇安即凱安商行,勞動基準法第24條,雇主延長勞工工作時間者，其延長工作時間之工資依左列標準加給之：一、延長工作時間在二小時以內者，按平日每小時工資額加給三分之一以上。二、再延長工作時間在二小時以內者，按平日每小時工資額加給三分之二以上。三、依第三十二條第三項規定，延長工作時間者，按平日每小時工資額加倍發給之。,,
南投縣,20241121,20241121,府社勞資字第1130286931號,許淇安即凱安商行,勞動基準法第22條第2項,工資未全額直接給付勞工,20000,
南投縣,20241121,20241121,府社勞資字第1130286933號,許淇安即凱安商行,勞動基準法第24條,延長工作時間未依規定加給工資,20000,
