主管機關,公告日期,處分日期,處分字號,事業單位名稱或負責人,違法法規法條,違反法規內容,罰鍰金額,備註說明
高雄市,20150514,20150309,高市勞條字第10431526700號,創悅保全股份有限公司,勞動基準法第23條第2項;勞動基準法第30條第5項,未依規定置備勞工工資清冊;未依規定置備勞工出勤紀錄表,,
高雄市,20221007,20220808,高市勞條字第11135537200號,創悅保全股份有限公司王淑瓊,勞動基準法第24條;勞動基準法第30條第6項;勞動基準法第39條,延長工作時間未依規定加給工資;未逐日記載勞工出勤情形至分鐘為止;假日工資未給或於休假日工作未依規定加給工資;,60000,
勞動部勞工保險局,20230810,20230605,保退三字第11260062500號,創悅保全股份有限公司王淑瓊,勞工退休金條例第15條第2項,雇主未依規定覈實申報調整勞工退休金提繳工資。,5000,
高雄市,20230804,20230619,高市勞條字第11234975400號,創悅保全股份有限公司王淑瓊,勞動基準法第24條;勞動基準法第30條第6項,延長工作時間未依規定加給工資;未逐日記載勞工出勤情形至分鐘為止。,80000,
高雄市,20240904,20240715,高市勞條字第11334837300號,創悅保全股份有限公司王淑瓊,勞動基準法第24條,延長工作時間未依規定加給工資。,80000,
