主管機關,公告日期,處分日期,處分字號,事業單位名稱或負責人,違法法規法條,違反法規內容,罰鍰金額,備註說明
職業安全衛生署,20181106,20180801,勞職授字第1070203980號,劉添富企業有限公司,營造安全衛生設施標準第5條暨職業安全衛生法第6條第1項,對於工作平台暴露之預留鋼筋，未採取彎曲尖端、加蓋或加裝護套等防護設施。,,
職業安全衛生署,20200306,20191121,勞職授字第1080204994號,劉添富企業有限公司,營造安全衛生設施標準第19條第2項暨職業安全衛生法第6條第1項,對於高度2公尺以上之土坡頂部等場所，勞工有遭受墜落危險之虞者，未採取使勞工使用安全帶之措施。,,
職業安全衛生署,20230810,20230505,勞職授字第1120202349A號,劉添富企業有限公司劉仲祐,營造安全衛生設施標準第19條暨職業安全衛生法第6條第1項,對於高度2公尺以上之擋土牆上作業，勞工有遭受墜落危險之虞者，未於該處設置護欄，或採取使勞工使用安全帶等措施。,,
職業安全衛生署,20231010,20230809,勞職授字第1120203898A號,劉添富企業有限公司劉仲祐,營造安全衛生設施標準第19條暨職業安全衛生法第6條第1項,對於高度2公尺以上之擋土牆上作業，勞工有遭受墜落危險之虞者，未於該處設置護欄，或採取使勞工使用安全帶等措施。,,
職業安全衛生署,20240701,20240510,勞職授字第1130204338號,劉添富企業有限公司劉仲祐,營造安全衛生設施標準第11條之1暨職業安全衛生法第6條第1項,對於進入營繕工程工作場所之作業勞工，未提供適當安全帽並使其正確戴用。,,
職業安全衛生署,20250205,20241202,勞職授字第1130207602號,劉添富企業有限公司劉仲祐,職業安全衛生設施規則第116條第9款暨職業安全衛生法第6條第1項,從事擋土柱鋼筋籠吊運作業，未依規定禁止未具吊運用途設計功能之挖溝機從事吊運作業。,,
