主管機關,公告日期,處分日期,處分字號,事業單位名稱或負責人,違法法規法條,違反法規內容,罰鍰金額,備註說明
台北市,20160119,20151103,府勞動字第10436026400號,博飛實業股份有限公司鄧潤德,勞動基準法第24條;勞動基準法第32條第2項,延長工作時間未依規定加給工資;延長工作時間超過法令規定;,,
台北市,20171201,20171017,北市勞職字第10640112900號,博飛實業股份有限公司,營造安全衛生設施標準第11條之1暨職業安全衛生法第6條第1項第1、3、5款。,對於進入工作場所作業人員，未提供適當安全帽，並使其正確戴用。,,
職業安全衛生署,20180712,20180426,勞職授字第1070201585號,博飛實業股份有限公司,職業安全衛生法第27條第1項,與承攬人分別僱用勞工共同作業時，未設置協議組織並指定工作場所負責人擔任指揮、未監督及協調之工作、未採取工作之連繫與調整之必要措施、未巡視工作場所、未指導及協助相關承攬事業間之安全衛生教育。,,
台北市,20220805,20220602,北市勞動字第11160157811號,博飛實業股份有限公司鄧潤德,勞動基準法第36條第1項,未使勞工每7日中有2日之休息，其中1日為例假，1日為休息日,20000,勞動部111年度因應嚴重特殊傳染性肺炎紓困補助業者勞動條件專案
台北市,20231106,20230920,府勞職字第11260969403號,博飛實業股份有限公司鄧潤德,職業安全衛生設施規則第281條第1項暨職業安全衛生法第6條第1項第5款,2公尺作業未使用安全帶、帽。,,
