主管機關,公告日期,處分日期,處分字號,事業單位名稱或負責人,違法法規法條,違反法規內容,罰鍰金額,備註說明
台北市,20120731,20120611,府勞動字第10133924200號,台北花園大酒店股份有限公司,勞動基準法第32條第2項,延長工作時間超過法令規定,,
台北市,20150408,20150225,府勞動字第10338974300號,台北花園大酒店股份有限公司張茂松,勞動基準法第24條,延長工作時間未依規定加給工資,,
台北市,20160324,20160104,北市勞動字第10436310300號,台北花園大酒店股份有限公司張茂松,勞動基準法第24條;勞動基準法第30條第5項;勞動基準法第32條第2項,延長工作時間未依規定加給工資;未依規定置備勞工出勤紀錄;延長工作時間超過法令規定,,
台北市,20170224,20161229,北市勞動字第10542854900號,台北花園大酒店股份有限公司張茂松,勞動基準法第30條第1項;勞動基準法第36條,正常工時超過法令規定;每七日中未有一日之休息作為例假,,
台北市,20201005,20200827,北市勞動字第10960386321號,台北花園大酒店股份有限公司張茂松,勞動基準法第34條第2項;勞動基準法第39條;勞動基準法第38條第2項,晝夜輪班制勞工於更換班次時，雇主未給予輪班勞工適當之休息時間;假日工資未給或於休假日工作未依規定加給工資;勞工之特別休假期日未由勞工自行排定,60000,訴願不受理
台北市,20220406,20220224,北市勞動字第11160040851號,台北花園大酒店股份有限公司張茂松,勞動基準法第32條第2項;勞動基準法第24條第1項,延長工作時間超過法令規定;延長工作時間未依規定加給工資,100000,
台北市,20230206,20221216,北市勞職字第11161200641號,台北花園大酒店股份有限公司張茂松,職業安全衛生設施規則第95條暨職業安全衛生法第6條第1項第1款,雇主對於升降機之升降路各樓出入口門，搬器地板與樓板相差七．五公分未有連鎖裝置，。,,
