主管機關,公告日期,處分日期,處分字號,事業單位名稱或負責人,違法法規法條,違反法規內容,罰鍰金額,備註說明
職業安全衛生署,20160808,20160630,勞職授字第1050202173號,台灣瀧澤科技股份有限公司,職業安全衛生法第27條第1項,與承攬人分別僱用勞工共同作業時，未設置協議組織，並指定工作場所負責人，擔任指揮、監督及協調之工作，未實施工作之連繫與調整及承攬事業間之安全衛生教育之指導及協助。,,
職業安全衛生署,20160808,20160630,勞職授字第1050202173號,台灣瀧澤科技股份有限公司,職業安全衛生法第27條第1項,與承攬人分別僱用勞工共同作業時，未設置協議組織，並指定工作場所負責人，擔任指揮、監督及協調之工作，未實施工作之連繫與調整及承攬事業間之安全衛生教育之指導及協助。,,
桃園市,20230303,20230112,府勞檢字第1120010397號,台灣瀧澤科技股份有限公司瀧澤修三,職業安全衛生設施規則第152條暨職業安全衛生法第6條第1項,物料搬運、處置，如以車輛機械作業時，應事先清除其通道、碼頭等之阻礙物及採取必要措施。,,
桃園市,20230303,20230131,府勞檢字第1120019884號,台灣瀧澤科技股份有限公司瀧澤修三,職業安全衛生設施規則第57條第1項暨職業安全衛生法第6條第1項,雇主對於機械之掃除、上油、檢查、修理或調整有導致危害勞工之虞者，應停止相關機械運轉及送料。為防止他人操作該機械之起動等裝置或誤送料，應採上鎖或設置標示等措施，並設置防止落下物導致危害勞工之安全設備與措施。,,
桃園市,20250414,20250214,114年府勞檢字1140037008號,台灣瀧澤科技股份有限公司原田一八,固定式起重機安全檢查構造標準第40條暨職業安全衛生法第6條第1項。;起重升降機具安全規則第62條第2項暨職業安全衛生法第6條第1項。;職業安全衛生設施規則第280條暨職業安全衛生法第6條第1項。,吊鉤應設置防止吊掛用鋼索等脫落之阻擋裝置。;雇主對於起重機具操作及吊掛作業，應分別指派具法定資格之勞工擔任之。但於地面以按鍵方式操作之固定式起重機，或積載型卡車起重機，其起重及吊掛作業，得由起重機操作者ㄧ人兼任之。;雇主對於作業中有物體飛落或飛散，致危害勞工之虞時，應使勞工確實使用安全帽及其他必要之防護設施。,,
