主管機關,公告日期,處分日期,處分字號,事業單位名稱或負責人,違法法規法條,違反法規內容,罰鍰金額,備註說明
台北市,20170405,20170208,北市勞職字第10630732904號,台灣動力工程股份有限公司,營造安全衛生設施標準第19條第1項暨職業安全衛生法第6條第1項第5款。,對於高度2公尺以上之開口部分從事作業，未於該處設置護欄、護蓋或安全網等防護設備，使勞工有遭受墜落危險之虞。,,
台北市,20180423,20180227,北市勞職字第10731316302號,台灣動力工程股份有限公司,職業安全衛生設施規則第225條第1項暨職業安全衛生法第6條第1項第5款。,對於勞工於高度2公尺以上之處所進行作業，未以架設施工架或其他方法設置工作台，使勞工有墜落之虞。,,
台北市,20180615,20180409,北市勞職字第10732167102號,台灣動力工程股份有限公司,職業安全衛生法第26條第2項。,將部份作業交付承攬人承攬時，未於事前以書面或協商會議紀錄告知承攬人有關作業之工作環境、危害因素暨有關安全衛生規定應採取之措施。,,
台北市,20180615,20180409,北市勞職字第10732167502號,台灣動力工程股份有限公司,職業安全衛生設施規則第225條第1項暨職業安全衛生法第6條第1項第5款。,對於高度2公尺以上處所作業，勞工有墜落之虞，未以架設施工架或其他方式設置工作台。,,
台北市,20200105,20191015,北市勞職字第10860929793,台灣動力工程股份有限公司,職業安全衛生設施規則第263條暨職業安全衛生法第6條第1項第3款,架空電路作業未設感電防護裝備或措施。,,
