主管機關,公告日期,處分日期,處分字號,事業單位名稱或負責人,違法法規法條,違反法規內容,罰鍰金額,備註說明
新北市,20240621,20240412,新北府勞業字第1130625458號,林鈺庭即合盛起重工程行,勞工退休金條例第12條第1項;勞工退休金條例第12條第2項,雇主未依規定標準發給勞工退休金條例工作年資之資遣費。;雇主未依規定於終止勞動契約後30日內發給新制資遣費。,600000,正確金額為100000元
新北市,20240419,20240229,新北府勞檢字第11346352571號,林鈺庭即合盛起重工程行,勞動基準法第30條第6項,出勤紀錄未依規定應逐日記載勞工出勤情形至分鐘,10000,
新北市,20240419,20240229,新北府勞檢字第11346352571號,林鈺庭即合盛起重工程行,勞動基準法第30條第6項,出勤紀錄未依規定應逐日記載勞工出勤情形至分鐘,10000,
新北市,20240419,20240229,新北府勞檢字第11346352572號,林鈺庭即合盛起重工程行,勞動基準法第38條,未依規定給予特別休假,10000,
新北市,20240419,20240229,新北府勞檢字第11346352572號,林鈺庭即合盛起重工程行,勞動基準法第38條,未依規定給予特別休假,10000,
新北市,20240419,20240229,新北府勞檢字第1134635257號,林鈺庭即合盛起重工程行,勞動基準法第23條第2項,未依規定置備工資清冊,1000,
新北市,20240419,20240229,新北府勞檢字第1134635257號,林鈺庭即合盛起重工程行,勞動基準法第23條第2項,未依規定置備工資清冊,1000,
新北市,20240621,20240402,新北府勞檢字第1134639309號,林鈺庭即合盛起重工程行,勞動基準法第19條,未依規定發給服務證明書,10000,
