主管機關,公告日期,處分日期,處分字號,事業單位名稱或負責人,違法法規法條,違反法規內容,罰鍰金額,備註說明
台北市,20180727,20180508,北市勞職字第10760067732號,同助營造有限公司,營造安全衛生設施標準第5條暨職業安全衛生法第6條第1項第7款。,對工作場所暴露之鋼筋等易生職業災害者，未採取彎曲尖端、加蓋或加裝護套等防護措施。,,
台北市,20190201,20181126,北市勞職字第10760710781號,同助營造有限公司,職業安全衛生設施規則第228條暨職業安全衛生法第6條第1項第5款,未設置安全上下之設備。,,
台北市,20180727,20180508,北市勞職字第10760067732號,同助營造有限公司,營造安全衛生設施標準第5條暨職業安全衛生法第6條第1項第7款。,對工作場所暴露之鋼筋等易生職業災害者，未採取彎曲尖端、加蓋或加裝護套等防護措施。,,
台北市,20190201,20181126,北市勞職字第10760710781號,同助營造有限公司,職業安全衛生設施規則第228條暨職業安全衛生法第6條第1項第5款,未設置安全上下之設備。,,
台北市,20190403,20190109,北市勞職字第10760987861號,同助營造有限公司,營造安全衛生設施標準第19條第1項暨職業安全衛生法第6條第1項第5款;職業安全衛生法第27條第1項第1、2、3、4款,有墜落危險之處所未設防護設備。;原事業單位未採取承攬管理必要措施。,,
台北市,20240905,20240726,北市勞職字第11360798601號,同助營造有限公司郭力瑋,職業安全衛生法第27條第1項第1款、第2款、第3款,原事業單位未採取承攬管理必要措施。,,
台北市,20250205,20241209,北市勞職字第11361165071號,同助營造有限公司郭力瑋,營造安全衛生設施標準第19條第1項暨職業安全衛生法第6條第1項第13款,有墜落危險之處所未設防護設備。,,
