主管機關,公告日期,處分日期,處分字號,事業單位名稱或負責人,違法法規法條,違反法規內容,罰鍰金額,備註說明
新北市,20170218,20160629,新北府勞檢字第10534499381號,名度彩色印刷有限公司,勞動基準法第30條第6項,出勤紀錄未依規定應逐日記載勞工出勤情形至分鐘,,
新北市,20170218,20160629,新北府勞檢字第10534499383號,名度彩色印刷有限公司,勞動基準法第36條,每七日中未有一日之休息作為例假,,
新北市,20170218,20160629,新北府勞檢字第1053449938號,名度彩色印刷有限公司,勞動基準法第22條第2項,工資未全額直接給付勞工,,
新北市,20170218,20160629,新北府勞檢字第10534499381號,名度彩色印刷有限公司,勞動基準法第30條第6項,出勤紀錄未依規定應逐日記載勞工出勤情形至分鐘,,
新北市,20170218,20160629,新北府勞檢字第10534499383號,名度彩色印刷有限公司,勞動基準法第36條,每七日中未有一日之休息作為例假,,
新北市,20170218,20160629,新北府勞檢字第1053449938號,名度彩色印刷有限公司,勞動基準法第22條第2項,工資未全額直接給付勞工,,
新北市,20240419,20240229,新北府勞檢字第11346358771號,名度彩色印刷有限公司許昕榆,勞動基準法第32條第2項,延長工作時間超過法令規定,20000,
新北市,20240419,20240229,新北府勞檢字第11346358772號,名度彩色印刷有限公司許昕榆,勞動基準法第36條第1項,勞工每七日中應有二日之休息，其中一日為例假，一日為休息日,20000,
新北市,20240419,20240229,新北府勞檢字第1134635877號,名度彩色印刷有限公司許昕榆,勞動基準法第30條第6項,出勤紀錄未依規定應逐日記載勞工出勤情形至分鐘,20000,
