主管機關,公告日期,處分日期,處分字號,事業單位名稱或負責人,違法法規法條,違反法規內容,罰鍰金額,備註說明
新北市,20170218,20161219,新北府勞檢字第1053473665號,唐埕公寓大廈管理維護有限公司,勞動基準法第36條,每七日中未有一日之休息作為例假,,
新北市,20170218,20161219,新北府勞檢字第1053473665號,唐埕公寓大廈管理維護有限公司,勞動基準法第36條,每七日中未有一日之休息作為例假,,
新北市,20190618,20190318,新北府勞檢字第1084249095號,唐埕公寓大廈管理維護有限公司,勞動基準法第39條,假日工資未給或於休假日工作未依規定加給工資,,
勞動部勞工保險局,20221011,20220815,保退三字第11160091710號,唐埕公寓大廈管理維護有限公司謝忠村,勞工退休金條例第15條第2項,雇主未依規定覈實申報調整勞工退休金提繳工資。,5000,
新北市,20221216,20220916,新北府勞檢字第1114760635號,唐埕公寓大廈管理維護有限公司謝忠村,勞動基準法第36條第1項,未給予勞工例假休息,20000,
