主管機關,公告日期,處分日期,處分字號,事業單位名稱或負責人,違法法規法條,違反法規內容,罰鍰金額,備註說明
台北市,20190102,20181122,北市勞動字第10760405091號,唯得實業股份有限公司蒲朝森,勞動基準法第80條,拒絕、規避或阻撓勞工檢查員依法執行職務,,
台中市,20220307,20220107,府授勞動字第11100016911號,唯得實業股份有限公司蒲朝森,勞工退休金條例第12條第1項,雇主未依規定標準發給勞工退休金條例工作年資之資遣費。,300000,
台中市,20220307,20220107,府授勞動字第1110001691號,唯得實業股份有限公司蒲朝森,勞動基準法第16條;勞動基準法第24條;勞動基準法第38條,未依法給予預告期間;未依法給付延長工時工資;未依法給予特別休假,60000,
新北市,20231020,20230705,新北府勞檢字第11246707821號,唯得實業股份有限公司蒲朝森,勞動基準法第23條第1項,工資未定期給付勞工,20000,
新北市,20231020,20230705,新北府勞檢字第1124670782號,唯得實業股份有限公司蒲朝森,勞動基準法第22條第2項,工資未全額直接給付勞工,20000,
