主管機關,公告日期,處分日期,處分字號,事業單位名稱或負責人,違法法規法條,違反法規內容,罰鍰金額,備註說明
台北市,20170224,20161219,北市勞動字第10542757400號,喜滿客京華影城股份有限公司沈慶京,勞動基準法第30條第1項;勞動基準法第30條第6項,正常工時超過法令規定;出勤紀錄未逐日記載勞工出勤情形至分鐘為止,,
高雄市,20161222,20160831,高市勞條字第10536878800號,喜滿客京華影城股份有限公司沈慶京,勞動基準法第24條;勞動基準法第36條,延長工作時間未依規定加給工資;每七日中未有一日之休息作為例假,,
高雄市,20180718,20180508,高市勞條字第10733401900號,喜滿客京華影城股份有限公司沈慶京,勞動基準法第32條第2項,延長工作時間超過法令規定,,
台北市,20201204,20201021,北市勞動字第10960675241號,喜滿客京華影城股份有限公司沈慶京,勞動基準法第22條第2項,工資未全額給付給勞工,20000,109年度勞動部工讀生與部分工時勞工勞動條件專案
高雄市,20210708,20210527,高市勞條字第11034358800號,喜滿客京華影城股份有限公司沈慶京,勞動基準法第38條,未依規定給予特別休假,20000,
