主管機關,公告日期,處分日期,處分字號,事業單位名稱或負責人,違法法規法條,違反法規內容,罰鍰金額,備註說明
職業安全衛生署,20160808,20160614,勞職授字第1050202063號,嘉聯實業股份有限公司,機械設備器具安全標準第77條暨職業安全衛生法第6條第1項,堆高機未設置警報裝置。,,
嘉義縣,20170501,20170428,府授社勞資字第10600812281號,嘉聯實業股份有限公司,勞動基準法第39條,假日工資未給或於休假日工作未依規定加給工資,,
嘉義縣,20170501,20170428,府授社勞資字第1060081228號,嘉聯實業股份有限公司,勞動基準法第32條第2項,未依勞動基準法第32條第2項雇主延長勞工工作時間連同正常工作時間，一日不超過12小時。延長之工作時間，一個月不超過46小時,,
桃園市,20240702,20240520,113年府勞檢字11301364891號,嘉聯實業股份有限公司王榮可,勞基法第32條第1項,延長工作時間未經勞資會議同意,20000,
桃園市,20240702,20240520,113年府勞檢字11301364892號,嘉聯實業股份有限公司王榮可,勞基法第70條,雇主未依規定訂立工作規則或未將工作規則報請當地主管機關核備或未將核備後之工作規則公開揭示之,20000,
桃園市,20240702,20240520,113年府勞檢字1130136489號,嘉聯實業股份有限公司王榮可,勞基法第24條第1項,延長工作時間未依規定加給工資,20000,
