主管機關,公告日期,處分日期,處分字號,事業單位名稱或負責人,違法法規法條,違反法規內容,罰鍰金額,備註說明
屏東縣,20200106,20191203,屏府勞動資字第10884568600號,鍾瑞嶂即國仁醫院,勞動基準法第27條,不依主管機關限期給付令之期限給付工資。,,
屏東縣,20200514,20200407,屏府勞動資字第10911570200號,鍾瑞嶂即國仁醫院,勞工退休金條例第13條第1項,雇主未繼續按月提撥勞工退休準備金。,20000,
勞動部勞工保險局,20210712,20210505,保退三字第11010080161號,鍾瑞嶂即國仁醫院,勞工退休金條例第15條第2項,雇主未依規定覈實申報調整勞工退休金提繳工資。,5000,
屏東縣,20241113,20241018,屏府勞動資字第1130060708號,鍾瑞嶂即國仁醫院,勞動基準法第24條第2項;勞動基準法第34條第2項,未依法給付休息日工作之工資;輪班制勞工於更換班次時，雇主未給予輪班勞工適當之休息時間。,40000,過往有違反勞動法令紀錄之事業勞動條件專案檢查
屏東縣,20250506,20250328,屏府勞動資字第1140079984號,鍾瑞嶂即國仁醫院,勞動基準法第22條第2項,工資未依法給付給勞工。,20000,
