主管機關,公告日期,處分日期,處分字號,事業單位名稱或負責人,違法法規法條,違反法規內容,罰鍰金額,備註說明
台北市,20160620,20160427,北市勞動字第10530396100號,國裕開發股份有限公司林鴻道,勞動基準法第39條,假日工資未給或於休假日工作未依規定加給工資,,
台北市,20181106,20180928,北市勞動字第10760399841號,國裕開發股份有限公司林鴻道,勞動基準法第36條第2項,採變形工時制度，未依規定安排勞工例假或休息日,,
台北市,20160620,20160427,北市勞動字第10530396100號,國裕開發股份有限公司林鴻道,勞動基準法第39條,假日工資未給或於休假日工作未依規定加給工資,,
台北市,20181106,20180928,北市勞動字第10760399841號,國裕開發股份有限公司林鴻道,勞動基準法第36條第2項,採變形工時制度，未依規定安排勞工例假或休息日,,
台北市,20210105,20201120,北市勞動字第10960636871號,國裕開發股份有限公司林鴻道,勞動基準法第39條;勞動基準法第24條第1項;勞動基準法第24條第2項,假日工資未給或於休假日工作未依規定加給工資;延長工作時間未依規定加給工資;未依法給付休息日工作之工資,140000,訴願駁回
台北市,20221005,20220830,北市勞動字第11160789231號,國裕開發股份有限公司林鴻道,勞動基準法第34條第2項,晝夜輪班制勞工於更換班次時，雇主未給予輪班勞工適當之休息時間,50000,訴願駁回;勞動部111年度工讀生與部分工時勞工勞動條件專案
勞動部勞工保險局,20231211,20231002,保退二字第11260164521號,國裕開發股份有限公司林鴻道,勞工退休金條例第15條第2項,雇主未依規定覈實申報調整勞工退休金提繳工資。,5000,
台北市,20230704,20230525,府勞動字第11260617281號,國裕開發股份有限公司林鴻道,勞動基準法第32條第2項;勞動基準法第24條第1項;勞動基準法第24條第2項;勞動基準法第36條第2項,延長工作時間超過法令規定;延長工作時間未依規定加給工資;未依法給付休息日工作之工資;採變形工時制度，未依規定安排勞工例假或休息日,300000,
台北市,20241007,20240820,北市勞職字第11360838641號,國裕開發股份有限公司林鴻道,職業安全衛生設施規則第230條第2項暨職業安全衛生法第6條第1項第13款,合梯作為上下設備、站立於頂板作業。,,
