主管機關,公告日期,處分日期,處分字號,事業單位名稱或負責人,違法法規法條,違反法規內容,罰鍰金額,備註說明
台北市,20180903,20180711,北市勞動字第10760025921號,國際維和保全股份有限公司楊俊煌,勞動基準法第21條第1項;勞動基準法第24條第1項,未達基本工資;延長工作時間未依規定加給工資,,
新北市,20200824,20191205,新北府勞檢字第1084285787號,國際維和保全股份有限公司周信福,勞動基準法第30條第6項,出勤紀錄未依規定應逐日記載勞工出勤情形至分鐘,,
台北市,20200703,20200511,北市勞動字第10960294941號,國際維和保全股份有限公司周信福,勞動基準法第32條第2項;勞動基準法第24條第1項,延長工作時間超過法令規定;延長工作時間未依規定加給工資,,
新北市,20210219,20201126,新北府勞檢字第1094800442號,國際維和保全股份有限公司周信福,勞動基準法第35條,繼續工作四小時未有三十分鐘休息,20000,
勞動部勞工保險局,20220711,20220516,保退三字第11160049500號,國際維和保全股份有限公司周信福,勞工退休金條例第15條第2項,雇主未依規定覈實申報調整勞工退休金提繳工資。,5000,
勞動部勞工保險局,20230911,20230710,保退三字第11260075720號,國際維和保全股份有限公司周信福,勞工退休金條例第15條第2項,雇主未依規定覈實申報調整勞工退休金提繳工資。,6000,
勞動部勞工保險局,20240410,20240226,保退一字第11369911025號,國際維和保全股份有限公司周信福,勞工退休金條例第19條第1項,雇主未按時繳納勞工退休金致加徵滯納金。,66156,
勞動部勞工保險局,20240710,20240520,保退三字第11360057840號,國際維和保全股份有限公司周信福,勞工退休金條例第15條第2項,雇主未依規定覈實申報調整勞工退休金提繳工資。,7000,
