主管機關,公告日期,處分日期,處分字號,事業單位名稱或負責人,違法法規法條,違反法規內容,罰鍰金額,備註說明
新竹縣,20171105,20160920,105年府勞資字1050096629號,國靖金屬股份有限公司,勞動基準法第32條第2項,延長工作時間超過法令規定,,
職業安全衛生署,20180524,20180206,勞職授字第1070200507號,國靖金屬股份有限公司,機械設備器具安全標準第4條第1項暨職業安全衛生法第6條第1項,勞工使用之摺床，未設置安全護圍。,,
職業安全衛生署,20190510,20190226,勞職授字第1080200674號,國靖金屬股份有限公司,職業安全衛生設施規則第243條第1項暨職業安全衛生法第6條第1項,"對於鋼架工作台板使用使用電動機械,未於各該電動機具之連接電路上設置適合其規格,具有高敏感度、高速型,能確實動作之防止感電用漏電斷路器。",,
職業安全衛生署,20200210,20191104,勞職授字第1080204647號,國靖金屬股份有限公司,機械設備器具安全標準第4條第2項暨職業安全衛生法第6條第1項,對於摺床未設置安全裝置。,,
職業安全衛生署,20201008,20200722,勞職授字第1090203007號,國靖金屬股份有限公司,機械設備器具安全標準第4條第1項暨職業安全衛生法第6條第1項,"以動力驅動之衝壓機械及剪斷機械,未具有安全護圍、安全模、特定用途之專用衝剪機械或自動衝剪機械",,
