主管機關,公告日期,處分日期,處分字號,事業單位名稱或負責人,違法法規法條,違反法規內容,罰鍰金額,備註說明
台北市,20150505,20150316,府勞職字第10430912202號,垣登工程有限公司,職業安全衛生設施規則第225條第1項暨職業安全衛生法第6條第1項第5款,雇主對於高度2公尺以上之處所進行作業，勞工有墜落之虞者，未以架設施工架或其他方法設置工作台。,,
台北市,20150505,20150316,府勞職字第10430912202號,垣登工程有限公司,職業安全衛生設施規則第225條第1項暨職業安全衛生法第6條第1項第5款,雇主對於高度2公尺以上之處所進行作業，勞工有墜落之虞者，未以架設施工架或其他方法設置工作台。,,
台北市,20150505,20150316,府勞職字第10430912202號,垣登工程有限公司,職業安全衛生設施規則第225條第1項暨職業安全衛生法第6條第1項第5款,雇主對於高度2公尺以上之處所進行作業，勞工有墜落之虞者，未以架設施工架或其他方法設置工作台。,,
台北市,20190403,20190122,北市勞職字第10860006563號,垣登工程有限公司,1.營造安全衛生設施標準第11-1條暨職業安全衛生法第6條第1項第1、3、5款;2.職業安全衛生設施規則第225條第1項暨職業安全衛生法第6條第1項第5款,1.未提供安全帽使正確戴用。;2.2公尺以上作業未設置工作台。,,
台北市,20201005,20200724,北市勞職字第10960861683號,垣登工程有限公司,營造安全衛生設施標準第11-1條暨職業安全衛生法第6條第1項第1、3、5款,未提供安全帽使正確戴用。,,
