主管機關,公告日期,處分日期,處分字號,事業單位名稱或負責人,違法法規法條,違反法規內容,罰鍰金額,備註說明
台南市,20160310,20160223,府勞條字第1050155036號,城邦營造有限公司郭華琪,勞動基準法第36條,每七日中未有一日之休息作為例假;,,
職業安全衛生署,20170603,20170315,勞職授字第1060201120號,城邦營造有限公司,職業安全衛生設施規則第228條、第243條第1項、營造安全衛生設施標準第19條第1項暨職業安全衛生法第6條第1項,對於高度差高過1.5公尺以上之1F移動式施工架，未設置能使勞工安全上下之設備；對於使用對地電壓150伏特以上之水泥砂漿攪拌機，未設置防止感電用漏電斷路器；對於高度2公尺以上之外牆施工架開口部分場所作業，勞工有遭受墜落危險之虞，未設置護欄、護蓋或安全網等防護設備。,,
職業安全衛生署,20201104,20200821,勞職授字第1090203504號,城邦營造有限公司,職業安全衛生設施規則第21條職業安全衛生設施規則第313條第1款營造安全衛生設施標準第5條暨職業安全衛生法第6條第1項,對於勞工工作場所之地板，未保持不致使勞工跌倒、滑倒、踩傷等之安全狀態，或採取必要之預防措施；對於勞工工作場所之採光照明，各工作場所未有充分之光線；對於工作場所暴露之鋼筋，未採取彎曲尖端、加蓋或加裝護套等防護設施。,,
職業安全衛生署,20210301,20201222,勞職授字第1090205627號,城邦營造有限公司,營造安全衛生設施標準第5條營造安全衛生設施標準第19條第1項暨職業安全衛生法第6條第1項,對於工作場所暴露之鋼筋，未採取彎曲尖端、加蓋或加裝護套等防護設施；對於高度2公尺以上之施工架開口部分場所作業，未於該處設置護欄、護蓋或安全網等防護設備。,,
職業安全衛生署,20210501,20210205,勞職授字第1100200684號,城邦營造有限公司,職業安全衛生設施規則第230條第1項第3款營造安全衛生設施標準第5條營造安全衛生設施標準第11條之1營造安全衛生設施標準第19條第1項營造安全衛生設施標準第40條第1項第1款暨職業安全衛生法第6條第1項,對於使用之合梯，兩梯腳間未有金屬等硬質繫材扣牢，腳部未有防滑絕緣腳座套；對於工作場所暴露之鋼筋，未採取彎曲尖端、加蓋或加裝護套等防護設施；對於進入營繕工程工作場所作業人員，未提供適當安全帽，並使其正確戴用；對於高度2公尺以上外牆施工架開口部分場所作業，未該處設置護欄、護蓋或安全網等防護設備；對於高度7公尺以上且立面面積達330平方公尺之施工架之構築，未由所僱之專任工程人員或委由相關執業技師，依結構力學原理妥為設計，置備施工圖說及強度計算書，經簽章確認後，據以執行,,
職業安全衛生署,20220601,20220318,勞職授字第1110201346號,城邦營造有限公司郭華琪,職業安全衛生設施規則第21條職業安全衛生設施規則第243條第1款營造安全衛生設施標準第19條第1項營造安全衛生設施標準第45條第3款暨職業安全衛生法第6條第1項,對於泥作作業工作台，未保持不致使勞工跌倒、滑倒、踩傷、滾落等之安全狀態；使用對地電壓在一百五十伏特以上移動式或攜帶式電動機具（220V砂漿攪拌機），未於各該電動機具設備之連接電路上設置適合其規格，具有高敏感度、高速型，能確實動作之防止感電用漏電斷路器；對於高度2公尺以上施工架開口部分場所作業，未於該處設置護欄、護蓋或安全網等防護設備；為維持施工架之穩定，未在適當之垂直、水平距離處與構造物妥實連接，其間隔在垂直方向以不超過五點五公尺，水平方向以不超過七點五公尺為限,,
職業安全衛生署,20240801,20240606,勞職授字第1130204741號,城邦營造有限公司郭華琪,營造安全衛生設施標準第11條之1營造安全衛生設施標準第19條第1項暨職業安全衛生法第6條第1項,對於進入營繕工程工作場所作業人員，未提供適當安全帽，並使其正確戴用；對於高度2公尺以上之外牆施工架開口部分場所作業，未於該處設置護欄、護蓋或安全網等防護設備。,,林春陽
