主管機關,公告日期,處分日期,處分字號,事業單位名稱或負責人,違法法規法條,違反法規內容,罰鍰金額,備註說明
職業安全衛生署,20151112,20151027,勞職授字第1040203704號,基源營造股份有限公司,營造安全衛生設施標準第19條第1項暨職業安全衛生法第6條第1項,對於高度2公尺以上之開口部分，未設置護欄或安全網，及於外牆施工架工作臺內側未設置交叉拉桿及下拉桿等防護設備。,,
職業安全衛生署,20151112,20151027,勞職授字第1040203704號,基源營造股份有限公司,營造安全衛生設施標準第19條第1項暨職業安全衛生法第6條第1項,對於高度2公尺以上之開口部分，未設置護欄或安全網，及於外牆施工架工作臺內側未設置交叉拉桿及下拉桿等防護設備。,,
職業安全衛生署,20211209,20210906,勞職授字第1100204608號,基源營造股份有限公司,營造安全衛生設施標準第19條第1項暨職業安全衛生法第6條第1項,對於高度2公尺以上之施工架工作臺、樓梯、樓板等場所開口部分，勞工有遭受墜落危險之虞，未於該施工架工作臺設置護欄(內側交叉拉桿及內外側下拉桿)，於該樓梯設置護欄，於該樓板設置設置護欄、護蓋或安全網等防護設備。,,
台中市,20240508,20240430,府授勞檢字第1130111322號,基源營造股份有限公司施銀柱,職業安全衛生法第6條第1項,未符合規定之必要安全衛生設備及措施,,
台中市,20250410,20250331,府授勞檢字第1140080086號,基源營造股份有限公司施銀柱,職業安全衛生法第27條第1項,事業單位與承攬人、再承攬人分別僱用勞工共同作業時，為防止職業災害，原事業單位未採取必要措施,,
