主管機關,公告日期,處分日期,處分字號,事業單位名稱或負責人,違法法規法條,違反法規內容,罰鍰金額,備註說明
新北市,20151211,20151021,新北府勞檢字第10430730621號,士潔服務有限公司,勞動基準法第22條第2項,工資未全額直接給付勞工,,
新北市,20151211,20151021,新北府勞檢字第1043073062號,士潔服務有限公司,勞動基準法第24條,延長工作時間未依規定加給工資,,
新北市,20151211,20151021,新北府勞檢字第10430730621號,士潔服務有限公司,勞動基準法第22條第2項,工資未全額直接給付勞工,,
新北市,20151211,20151021,新北府勞檢字第1043073062號,士潔服務有限公司,勞動基準法第24條,延長工作時間未依規定加給工資,,
新北市,20200221,20191106,新北府勞檢字第10842819601號,士潔服務有限公司,勞動基準法第39條,假日工資未給或於休假日工作未依規定加給工資,,
新北市,20200221,20191106,新北府勞檢字第1084281960號,士潔服務有限公司,勞動基準法第24條,延長工作時間未依規定加給工資,,
