主管機關,公告日期,處分日期,處分字號,事業單位名稱或負責人,違法法規法條,違反法規內容,罰鍰金額,備註說明
職業安全衛生署,20160623,20160512,勞職授字第1050201659號,夏都國際開發股份有限公司,職業安全衛生設施規則第21條、第43條第1項、第106條第1項第4款、第275條第1項第1款暨職業安全衛生法第6條第1項,對於勞工工作場所之通道、地板、階梯，未保持不致使勞工跌倒、滑倒、踩傷等之安全狀態，或採取必要之預防措施；對於機械之原動機、轉軸、齒輪、帶輪、飛輪、傳動輪、傳動帶等有危害勞工之虞之部分，未有護罩、護圍、套胴、跨橋等設備；對於高壓氣體容器，不論盛裝或空容器，使用時，未加以固定；對於電氣設備發電室、變電室、或受電室內之電路附近，不得堆放任何與電路無關之物件等。,,
職業安全衛生署,20190606,20190319,勞職授字第1080201179號,夏都國際開發股份有限公司,職業安全衛生設施規則第250條暨職業安全衛生法第6條第1項,鋼架電焊作業使用之交流電焊機未有自動電擊防止裝置,,
職業安全衛生署,20200504,20200205,勞職授字第1090200257號,夏都國際開發股份有限公司,鍋爐及壓力容器安全規則第14條第1項暨職業安全衛生法第6條第1項,對於鍋爐之操作管理，未僱用專任操作人員，於鍋爐運轉中不得使其從事與鍋爐操作無關之工作。,,
職業安全衛生署,20221001,20220711,勞職授字第1110203843號,夏都國際開發股份有限公司屏東分公司陳協同,職業安全衛生設施規則第21條暨職業安全衛生法第6條第1項,雇主對於勞工工作場所內之客房浴室地板，未保持不致使勞工跌倒之安全狀態，或採取必要之預防措施。,,
台南市,20231110,20231016,南市勞安字第1121324758號,夏都國際開發股份有限公司陳協同,勞動基準法第24條;勞動基準法第30條第6項;勞動基準法第39條,延長工作時間未依規定加給工資。;未逐日記載勞工出勤情形至分鐘為止。;假日工資未給或於休假日工作未依規定加給工資。,150000,
屏東縣,20240705,20240507,屏府勞動資字第11318346800號,夏都國際開發股份有限公司陳協同,勞動基準法第34條第2項,輪班制勞工於更換班次時，雇主未給予輪班勞工適當之休息時間。,50000,
