主管機關,公告日期,處分日期,處分字號,事業單位名稱或負責人,違法法規法條,違反法規內容,罰鍰金額,備註說明
台南市,20191110,20191008,南市勞安字第1081131355號,大坑古厝白馬有限公司楊桂榮,勞動基準法第24條;勞動基準法第30條第6項;勞動基準法第36條,延長工作時間未依規定加給工資;未逐日記載勞工出勤情形至分鐘為止;每七日中未有一日之休息作為例假,,
勞動部勞工保險局,20201210,20201023,保退一字第10969911105號,大坑古厝白馬有限公司楊桂榮,勞工退休金條例第19條第1項,雇主未按時繳納勞工退休金致加徵滯納金。,8588,
台南市,20220905,20220830,南市勞就1110967049B號,大坑古厝白馬有限公司莊主榮,性別工作平等法第13條第2項,雇主於知悉前條性騷擾之情形時，應採取立即有效之糾正及補救措施。,,
職業安全衛生署,20230301,20221214,勞職授字第11102071161號,大坑古厝白馬有限公司莊主榮,職業安全衛生法第37條第2項第3款,事業單位勞動場所發生災害之罹災人數在一人以上，且需住院治療之職業災害時，雇主未於8小時內通報勞動檢查機構。,,
職業安全衛生署,20230301,20221214,勞職授字第1110207116號,大坑古厝白馬有限公司莊主榮,職業安全衛生設施規則第285條暨職業安全衛生法第6條第1項,雇主對於焚化火爐高溫操作場所，未使勞工確實使用防護具。,,
