主管機關,公告日期,處分日期,處分字號,事業單位名稱或負責人,違法法規法條,違反法規內容,罰鍰金額,備註說明
台北市,20181001,20180615,北市勞職字第10760126393號,大穩發企業有限公司,營造安全衛生設施標準第19條第1項暨職業安全衛生法第6條第1項第5款,有墜落危險之處所未設防護設備。,,
台北市,20190502,20190225,北市勞職字第10860105663號,大穩發企業有限公司,營造安全衛生設施標準第19條第1項暨職業安全衛生法第6條第1項第5款,有墜落危險之處所未設防護設備。,,
台北市,20190605,20190319,北市勞職字第10860109671號,大穩發企業有限公司,職業安全衛生設施規則第155條暨職業安全衛生法第6條第1項第4款,對於物料之搬運，未儘量利用機械以代替人力搬運。,,
台北市,20200305,20191211,北市勞職字第10861039903,大穩發企業有限公司,營造安全衛生設施標準第19條第1項暨職業安全衛生法第6條第1項第5款,有墜落危險之處所未設防護設備。,,
桃園市,20190201,20190107,府勞檢字第1080003111號,大穩發企業有限公司彭志展,職業安全衛生設施規則第228條暨職業安全衛生法第6條第1項;營造安全衛生設施標準第41條第1項暨職業安全衛生法第6條第1項;營造安全衛生設施標準第44條暨職業安全衛生法第6條第1項,雇主對勞工於高差超過一．五公尺以上之場所作業時，應設置能使勞工安全上下之設備。;雇主對於懸吊式施工架、懸臂式施工架及高度五公尺以上施工架之組配及拆除(以下簡稱施工架組配)作業，應指派施工架組配作業主管於作業現場辦理下列事項：一、決定作業方法，指揮勞工作業。二、實施檢點，檢查材料、工具、器具等，並汰換其不良品。三、監督勞工確實使用個人防護具。四、確認安全衛生設備及措施之有效狀況。五、其他為維持作業勞工安全衛生所必要之設備及措施。;雇主對於施工架及施工構台應經常予以適當之保養並維持各部分之牢穩。,,
