主管機關,公告日期,處分日期,處分字號,事業單位名稱或負責人,違法法規法條,違反法規內容,罰鍰金額,備註說明
職業安全衛生署,20181009,20180702,勞職授字第1070203299號,天綾實業有限公司,職業安全衛生法第37條第2項,勞動場所發生罹災人數在1人以上，且需住院治療之職業災害，未於8小時內通報勞動檢查機構。,,
職業安全衛生署,20181009,20180702,勞職授字第1070203300號,天綾實業有限公司,職業安全衛生設施規則第43條第1項、第57條第1項暨職業安全衛生法第6條第1項,使勞工從事膠料粉碎機清掃作業時具有捲夾危害之虞，未於作業時確實停止膠料粉碎機運轉，及未於該機械之輸送帶傳動輪處設置護罩、護圍等設備，致發生職業安全衛生法第37條第2項之職業災害。,,
雲林縣,20180911,20180821,府勞動一字第1073415594號,天綾實業有限公司斗六廠,勞動基準法第36條,未有每7日中至少有1日之休息，作為例假日。,,
職業安全衛生署,20191008,20190624,勞職授字第1080202649號,天綾實業有限公司,職業安全衛生設施規則第116條第1項第15款暨職業安全衛生法第6條第1項,使勞工駕駛貨車以倒車方式行駛於廠區道路，有撞擊工作者之虞，未置管制引導人員，致發生職業安全衛生法第37條第2項之職業災害。,,
勞動部勞工保險局,20210412,20210224,保退一字第11069911025號,天綾實業有限公司斗六廠黃彰南,勞工退休金條例第19條第1項,雇主未按時繳納勞工退休金致加徵滯納金。,15959,
職業安全衛生署,20210908,20210507,勞職授字第1100202249號,天綾實業有限公司,職業安全衛生設施規則第57條第1項暨職業安全衛生法第6條第1項,所設儲料桶進行檢查清潔作業時有導致危害勞工之虞，未停止擾動器及輸送螺桿之運轉及送料，致發生職業安全衛生法第37條第2項之職業災害。,,
勞動部勞工保險局,20220810,20220627,保退一字第11169911065號,天綾實業有限公司斗六廠黃彰南,勞工退休金條例第19條第1項,雇主未按時繳納勞工退休金致加徵滯納金。,4203,
勞動部勞工保險局,20221011,20220824,保退一字第11169911085號,天綾實業有限公司斗六廠黃彰南,勞工退休金條例第19條第1項,雇主未按時繳納勞工退休金致加徵滯納金。,10985,
勞動部勞工保險局,20240410,20240226,保退一字第11369911025號,天綾實業有限公司斗六廠黃彰南,勞工退休金條例第19條第1項,雇主未按時繳納勞工退休金致加徵滯納金。,8595,
