主管機關,公告日期,處分日期,處分字號,事業單位名稱或負責人,違法法規法條,違反法規內容,罰鍰金額,備註說明
職業安全衛生署,20211104,20210810,勞職授字第11002041881號,天誠營造股份有限公司,職業安全衛生法第27條第1項第2款、第3款,與承攬人分別僱用勞工共同作業時，未採取工作之連繫與調整之必要措施、未巡視工作場所。,,
職業安全衛生署,20230908,20230619,勞職授字第1120203063號,天誠營造股份有限公司方錦璘,營造安全衛生設施標準第52條暨職業安全衛生法第6條第1項,構築施工架時，有鄰近結構物之周遭或跨越工作走道者，未於其下方設計斜籬及防護網等，以防止物體飛落引起災害。,,
職業安全衛生署,20231107,20230804,勞職授字第1120203698號,天誠營造股份有限公司方錦璘,營造安全衛生設施標準第19條第1項暨職業安全衛生法第6條第1項,對於高度二公尺以上之開口部分、工作臺等場所作業，勞工有遭受墜落危險之虞者，未於該處設置護欄、護蓋或安全網等防護設備。,,
台北市,20240408,20240202,北市勞職字第11360527711號,天誠營造股份有限公司方錦璘,營造安全衛生設施標準第19條第1項暨職業安全衛生法第6條第1項第13款,有墜落危險之處所未設防護設備。,,
職業安全衛生署,20240624,20240408,勞職授字第1130203619A號,天誠營造股份有限公司方錦璘,職業安全衛生法第27條第1項第1款、第2款、第3款、第4款,與承攬人分別僱用勞工共同作業時，未設置協議組織並指定工作場所負責人擔任指揮、監督及協調之工作、未採取工作之連繫與調整之必要措施、未巡視工作場所、未指導及協助相關承攬事業間之安全衛生教育。,,
職業安全衛生署,20240624,20240408,勞職授字第1130203619號,天誠營造股份有限公司方錦璘,營造安全衛生設施標準第11條、第19條第1項暨職業安全衛生法第6條第1項,雇主對於工作場所人員及車輛機械出入口處，未依下列規定辦理：一、事前調查地下埋設物之埋置深度、危害物質，並於評估後採取適當防護措施，以防止車輛機械輾壓而發生危險。二、工作場所出入口應設置方便人員及車輛出入之拉開式大門，作業上無出入必要時應關閉，並標示禁止無關人員擅入工作場所。但車輛機械出入頻繁之場所，必須打開工地大門等時，應置交通引導人員，引導車輛機械出入。三、人員出入口與車輛機械出入口應分隔設置。但設有警告標誌足以防止交通事故發生者不在此限。四、應置管制人員辦理下列事項：（一）管制出入人員，非有適當防護具不得讓其出入。（二）管制、檢查出入之車輛機械，非具有許可文件上記載之要件，不得讓其出入。五、規劃前款第二目車輛機械接受管制所需必要之停車處所，不得影響工作場所外道路之交通。六、維持車輛機械進出有充分視線淨空；雇主對於高度二公尺以上之屋頂、鋼梁、開口部分、階梯、樓梯、坡道、工作臺、擋土牆、擋土支撐、施工構臺、橋梁墩柱及橋梁上部結構、橋臺等場所作業，勞工有遭受墜落危險之虞者，未於該處設置護欄、護蓋或安全網等防護設備。,,
職業安全衛生署,20240810,20240716,勞職授字第1130205398A號,天誠營造股份有限公司方錦璘,職業安全衛生法第26條第1項,以其事業之全部或一部分交付承攬時，未於事前告知該承攬人有關其事業工作環境、危害因素暨職業安全衛生法及有關安全衛生規定應採取之措施。,,
職業安全衛生署,20240810,20240716,勞職授字第1130205398號,天誠營造股份有限公司方錦璘,職業安全衛生法第27條第1項第2款、第3款、第4款,與承攬人分別僱用勞工共同作業時，未採取工作之連繫與調整之必要措施、未巡視工作場所、未指導及協助相關承攬事業間之安全衛生教育。,,
