主管機關,公告日期,處分日期,處分字號,事業單位名稱或負責人,違法法規法條,違反法規內容,罰鍰金額,備註說明
勞動部勞工保險局,20230210,20221227,保退一字第11169911125號,太子電業有限公司侯秉宏,勞工退休金條例第19條第1項,雇主未按時繳納勞工退休金致加徵滯納金。,7326,
勞動部勞工保險局,20231011,20230824,保退一字第11269911085號,太子電業有限公司侯秉宏,勞工退休金條例第19條第1項,雇主未按時繳納勞工退休金致加徵滯納金。,14963,
高雄市,20240306,20240116,高市勞條字第11330337100號,太子電業有限公司侯秉宏,勞動基準法第22條第2項;勞動基準法第32條第2項,工資未全額直接給付勞工;延長工作時間超過法令規定。,40000,
高雄市,20240306,20240116,高市勞條字第11330337100號,太子電業有限公司侯秉宏,勞動基準法第22條第2項;勞動基準法第32條第2項,工資未全額直接給付勞工;延長工作時間超過法令規定。,40000,
高雄市,20240904,20240705,高市勞條字第11335418900號,太子電業有限公司侯秉宏,勞動基準法第80條,拒絕、規避或阻撓勞工檢查員依法執行職務。,30000,
高雄市,20250207,20241204,高市勞條字第11339936200號,太子電業有限公司侯秉宏,勞動基準法第23條第2項;勞動基準法第30條第6項,未依規定置備勞工工資清冊;未逐日記載勞工出勤情形至分鐘為止。,40000,
