主管機關,公告日期,處分日期,處分字號,事業單位名稱或負責人,違法法規法條,違反法規內容,罰鍰金額,備註說明
新北市,20200622,20200420,新北府勞檢字第10947722811號,好麗保全股份有限公司,勞動基準法第36條第1項,勞工每七日中應有二日之休息，其中一日為例假，一日為休息日。,,
新北市,20200622,20200420,新北府勞檢字第1094772281號,好麗保全股份有限公司,勞動基準法第32條第2項,延長工作時間超過法令規定,,
勞動部勞工保險局,20231011,20230809,保退三字第11260109210號,好麗保全股份有限公司戴國強,勞工退休金條例第15條第2項,雇主未依規定覈實申報調整勞工退休金提繳工資。,5000,
桃園市,20230801,20230608,112年府勞條字1120149991號,好麗保全股份有限公司羅鴻正,勞基法第24條第1項,延長工作時間未依規定加給工資,20000,
桃園市,20240603,20240430,113年府勞條字1130056646號,好麗保全股份有限公司戴國強,勞基法第21條第1項,未達基本工資,20000,
