主管機關,公告日期,處分日期,處分字號,事業單位名稱或負責人,違法法規法條,違反法規內容,罰鍰金額,備註說明
台南市,20200310,20200212,南市勞安字第1090117028號,妙吉實業有限公司楊麗琴,勞動基準法第24條;勞動基準法第38條,延長工作時間未依規定加給工資;未依規定給予特別休假,,
台南市,20241110,20241007,南市勞安字第1132141037號,妙吉實業有限公司楊麗琴,勞動基準法第24條;勞動基準法第30條第6項;勞動基準法第38條,未依規定計給勞工延長工作時間工資;未依規定詳實記載勞工出勤情形至分鐘為止;未依規定給予特別休假,60000,
職業安全衛生署,20241009,20240809,勞職授字第1130205634號,妙吉實業有限公司楊麗琴,職業安全衛生設施規則第124條、機械設備器具安全標準第84條第2項第2款、機械設備器具安全標準第95條暨職業安全衛生法第6條第1項,1.堆高機未置備有後扶架者。2.配衡型堆高機之駕駛座未配置防止車輛傾倒時，駕駛者被堆高機壓傷之安全帶、護欄或其他防護設施。3.對於手持研磨機之研磨輪，未設置護罩。,,陳敏舜
職業安全衛生署,20250109,20241114,勞職授字第1130207170A號,妙吉實業有限公司楊麗琴,職業安全衛生法第24條,經中央主管機關指定具危險性設備之操作人員，雇主未僱用經中央主管機關認可之訓練或經技能檢定之合格人員。,,謝俊傑
職業安全衛生署,20250109,20241114,勞職授字第1130207170號,妙吉實業有限公司楊麗琴,職業安全衛生法第16條第1項,雇主對於經中央主管機關指定具有危險性之機械或設備，未經勞動檢查機構或中央主管機關指定之代行檢查機構檢查合格，即予使用。,,謝俊傑
