主管機關,公告日期,處分日期,處分字號,事業單位名稱或負責人,違法法規法條,違反法規內容,罰鍰金額,備註說明
職業安全衛生署,20151215,20151125,勞職授字第1040204038號,宇祥營造股份有限公司,營造安全衛生設施標準第19條第1項暨職業安全衛生法第6條第1項,對於高度2公尺以上之施工架工作臺、樓梯間等開口部分，未於施工架工作臺內側設置交叉拉桿及下拉桿等防護設備，及於該處樓梯間設置護欄或安全網。,,
職業安全衛生署,20160524,20160414,勞職授字第1050201268號,宇祥營造股份有限公司,營造安全衛生設施標準第19條第1項暨職業安全衛生法第6第1項,對於高度2公尺以上之施工架工作臺開口部分，勞工有遭受墜落危險之虞，未設置護欄（交叉拉桿及下拉桿）或安全網等防護設備。,,
職業安全衛生署,20161210,20161021,勞職授字第1050203932號,宇祥營造股份有限公司,營造安全衛生設施標準第19條第1項暨職業安全衛生法第6第1項,對於高度2公尺以上之樓板邊緣開口部分等場所，勞工有遭受墜落危險之虞，未設置護欄等防護設備。,,
台中市,20220410,20220307,府受勞檢字第1110051794號,宇祥營造股份有限公司林毓釗,職業安全衛生法第6條第1項,未符合規定之必要安全衛生設備及措施,,
職業安全衛生署,20220908,20220627,勞職授字第1110203480號,宇祥營造股份有限公司林毓釗,營造安全衛生設施標準第19條第1項暨職業安全衛生法第6條第1項,對於高度2公尺以上之樓梯、樓板及外牆施工架工作臺開口部分，勞工有墜落危險之虞，未於樓梯及樓板開口部分設置護欄，及於施工架工作臺設置護欄(內側交叉拉桿及下拉桿)等防護設備。,,
職業安全衛生署,20230607,20230327,勞職授字第1120201857號,宇祥營造股份有限公司林毓釗,營造安全衛生設施標準第19條第1項暨職業安全衛生法第6條第1項,對於高度2公尺以上之外牆施工架工作臺及開口部分、筏基開口部分等場所作業，勞工有遭受墜落危險之虞，未於施工架工作臺設置護欄(內側交叉拉桿、下拉桿)及於開口部分設置護欄、護蓋或安全網等防護設備。,,
職業安全衛生署,20230810,20230512,勞職授字第1120202456號,宇祥營造股份有限公司林毓釗,營造安全衛生設施標準第19條第1項暨職業安全衛生法第6條第1項,對於高度2公尺以上之外牆施工架工作臺、陽台開口部分、樓梯開口部分作業場所，勞工有遭受墜落危險之虞，未於該處施工架工作臺設置護欄(內側交叉拉桿及內外側下拉桿)及於陽台開口、樓梯部分設置護欄、護蓋或安全網等防護設備。,,
台中市,20240508,20240417,府受勞檢字第1130095514號,宇祥營造股份有限公司林毓釗,職業安全衛生法第6條第1項,未符合規定之必要安全衛生設備及措施,,
