主管機關,公告日期,處分日期,處分字號,事業單位名稱或負責人,違法法規法條,違反法規內容,罰鍰金額,備註說明
新北市,20241018,20240827,新北府勞檢字第1134657721號,安興營造股份有限公司林毓婷,職業安全衛生法第6條第1項,未符合規定之必要安全衛生設備及措施,,
桃園市,20250208,20241204,113年府勞檢字第1130343009號,安興營造股份有限公司林毓婷,營造安全衛生設施標準第5條暨職業安全衛生法第6條第1項；營造安全衛生設施標準第11條之1暨職業安全衛生法第6條第1項；營造安全衛生設施標準第19條第1項暨職業安全衛生法第6條第1項,雇主對於工作場所暴露之鋼筋、鋼材、鐵件、鋁件及其他材料等易生職業災害者，應採取彎曲尖端、加蓋或加裝護套等防護設施。；雇主對於進入營繕工程工作場所作業人員，應提供適當安全帽，並使其正確戴用。；雇主對於高度二公尺以上之屋頂、鋼梁、開口部分、階梯、樓梯、坡道、工作臺、擋土牆、擋土支撐、施工構臺、橋梁墩柱及橋梁上部結構、橋臺等場所作業，勞工有遭受墜落危險之虞者，應於該處設置護欄、護蓋或安全網等防護設備。,,
桃園市,20250208,20241216,113年府勞檢字第11303537821號,安興營造股份有限公司林毓婷,營造安全衛生設施標準第5條暨職業安全衛生法第6條第1項；營造安全衛生設施標準第11條之1暨職業安全衛生法第6條第1項；營造安全衛生設施標準第19條第1項暨職業安全衛生法第6條第1項；,雇主對於工作場所暴露之鋼筋、鋼材、鐵件、鋁件及其他材料等易生職業災害者，應採取彎曲尖端、加蓋或加裝護套等防護設施。；雇主對於進入營繕工程工作場所作業人員，應提供適當安全帽，並使其正確戴用。；雇主對於高度二公尺以上之屋頂、鋼梁、開口部分、階梯、樓梯、坡道、工作臺、擋土牆、擋土支撐、施工構臺、橋梁墩柱及橋梁上部結構、橋臺等場所作業，勞工有遭受墜落危險之虞者，應於該處設置護欄、護蓋或安全網等防護設備。；,,
職業安全衛生署,20240915,20240712,勞職授字第1130205363號,安興營造股份有限公司林毓婷,營造安全衛生設施標準第19條第1項暨職業安全衛生法第6條第1項,對於高度二公尺以上之開口部分、工作臺等場所作業勞工有遭受墜落危險之虞者未於該處設置護欄、護蓋或安全網等防護設備。,,
職業安全衛生署,20241215,20241128,勞職授字第1130207221A號,安興營造股份有限公司林毓婷,職業安全衛生法第27條第1項第3款,與承攬人分別僱用勞工共同作業時，未巡視工作場所。,,罰鍰公告
職業安全衛生署,20241215,20241128,勞職授字第1130207221號,安興營造股份有限公司林毓婷,營造安全衛生設施標準第19條第1項暨職業安全衛生法第6條第1項,對於高度二公尺以上之開口部分、工作臺等場所作業，勞工有遭受墜落危險之虞者，未於該處設置護欄、護蓋或安全網等防護設備。,,罰鍰公告
