主管機關,公告日期,處分日期,處分字號,事業單位名稱或負責人,違法法規法條,違反法規內容,罰鍰金額,備註說明
職業安全衛生署,20190510,20190109,勞職授字第1080200054號,宏尚景觀營造有限公司,職業安全衛生法第49條第1款,發生職業安全衛生法第37條第2項第1款之職業災害。,,
職業安全衛生署,20191008,20190606,勞職授字第1080202273號,宏尚景觀營造有限公司,職業安全衛生設施規則第281條第1項暨職業安全衛生法第6條第1項,使勞工站在高速公路路肩之RC護欄上(站立位置距外側邊坡高差在2公尺以上)，勞工有遭受墜落危險之虞，未使勞工使用安全帶。,,
職業安全衛生署,20210205,20200525,勞職授字第1090202031號,宏尚景觀營造有限公司,職業安全衛生設施規則第21條之1第1項第1款暨職業安全衛生法第6條第1項,對於有車輛出入、使用道路作業、鄰接道路作業或有導致交通事故之虞之工作場所，未於該工作場所設置能使受警告者清晰獲知之交通號誌、標示，致發生職業安全衛生法第37條第2項之職業災害。,,
職業安全衛生署,20230910,20230614,勞職授字第1120203045號,宏尚景觀營造有限公司石承洋,職業安全衛生設施規則第281條第1款、起重升降機具安全規則第38條第1項第1款暨職業安全衛生法第6條第1項,使勞工站於車輛頂部(高度2公尺以上)從事喬木修剪作業，有墜落危害之虞，未使勞工確實使用安全帶；另使用移動式起重機吊掛搭乘設備搭載人員作業，有墜落危險之虞，未依規定搭乘設備及懸掛裝置經中央主管機關認可之專業機構簽認。,,
職業安全衛生署,20231110,20230905,勞職授字第1120204131號,宏尚景觀營造有限公司石承洋,職業安全衛生設施規則第21條之1第2項暨職業安全衛生法第6條第1項,使勞工從事邊坡割草作業(外側路肩短暫性施工)，勞工有被撞危害之虞，未依道路交通主管機關所定之高速公路施工之交通管制守則規定，設置交通管制設施(交通錐，另人員於外側路肩下車作業時，上游須配置移動性緩撞設施戒護)。,,
職業安全衛生署,20240205,20231222,勞職授字第1120205952號,宏尚景觀營造有限公司石承洋,職業安全衛生設施規則第238條暨職業安全衛生法第6條第1項,使勞工於國道外側邊坡處，從事鋸樹作業，對於鋸樹作業有物體飛落之虞，未設置防止樹幹飛落之設備，致發生職業安全衛生法第37條第2項第1款之職業災害。,,
