主管機關,公告日期,處分日期,處分字號,事業單位名稱或負責人,違法法規法條,違反法規內容,罰鍰金額,備註說明
職業安全衛生署,20210104,20201012,勞職授字第10902043362號,宜韋室內裝修股份有限公司,職業安全衛生設施規則第228條、營造安全衛生設施標準第19條第1項暨職業安全衛生法第6條第1項,"對於高差超過1.5公尺以上之場所作業時,未設置能使勞工安全上下之設備;對於高度2公尺以上之開口部分,勞工有遭受墜落危險之虞者,未設置護欄、護蓋或安全網等防護設備。",,
台北市,20220705,20220401,北市勞職字第11160400461號,宜韋室內裝修股份有限公司王純香,職業安全衛生設施規則第41條第3款暨職業安全衛生法第6條第1項1款,堆高機、研磨機等機具未依規定辦理。,,
台北市,20240305,20240116,北市勞職字第11360505311號,宜韋室內裝修股份有限公司王純香,職業安全衛生法第26條第1項;職業安全衛生法第27條第1項第1款、第2款、第3款、第4款,未事前告知該承攬人依規定應採取措施。;原事業單位未採取承攬管理必要措施。,,
台北市,20240305,20240125,北市勞職字第11360518813號,宜韋室內裝修股份有限公司王純香,營造安全衛生設施標準第11-1條暨職業安全衛生法第6條第1項第1款、第3款、第5款,未提供安全帽使正確戴用。,,
高雄市,20250324,20241213,高市勞檢字第11372345400號,宜韋室內裝修股份有限公司王純香,職業安全衛生法第27條第1項第2、3款,與承攬人分別僱用勞工共同作業，惟就電扶梯與柱之樓板從事輕隔間組立作業，具有嚴重危害勞工及發生職業災害之虞之工作場所，未依規定確實巡視；未採積極具體之連繫與調整作為要求承攬人應於該處設置護欄、護蓋或安全網等防護設備。,,
高雄市,20250210,20241213,高市勞檢字第11372345500號,宜韋室內裝修股份有限公司王純香,職業安全衛生法第6條第1項第5款,對於高度2公尺以上之電扶梯與柱之樓板開口，勞工有遭受墜落危險之虞者，未設置護欄、護蓋或安全網等防護設備。,,
