主管機關,公告日期,處分日期,處分字號,事業單位名稱或負責人,違法法規法條,違反法規內容,罰鍰金額,備註說明
勞動部勞工保險局,20201210,20201023,保退一字第10969911105號,家粲企業有限公司彭志展,勞工退休金條例第19條第1項,雇主未按時繳納勞工退休金致加徵滯納金。,6012,
新北市,20210820,20210512,新北府勞檢字第1104724984號,家粲企業有限公司彭志展,職業安全衛生法第6條第1項,未符合規定之必要安全衛生設備及措施,,
新北市,20211015,20210825,新北府勞檢字第1104736020號,家粲企業有限公司彭志展,職業安全衛生法第6條第1項,未符合規定之必要安全衛生設備及措施,,
台北市,20231205,20231003,府勞職字第11260984173號,家粲企業有限公司彭志展,營造安全衛生設施標準第19條第1項暨職業安全衛生法第6條第1項第5款,有墜落危險之處所未設防護設備。,,
台北市,20250205,20241219,北市勞職字第11361212923號,家粲企業有限公司彭志展,職業安全衛生設施規則第281條第1項暨職業安全衛生法第6條第1項第5款,2公尺作業未使用安全帶、帽。,,
