主管機關,公告日期,處分日期,處分字號,事業單位名稱或負責人,違法法規法條,違反法規內容,罰鍰金額,備註說明
新北市,20161208,20160905,新北府勞檢字第10534595001號,家聲實業有限公司,勞動基準法第36條,每七日中未有一日之休息作為例假,,
新北市,20161208,20160905,新北府勞檢字第1053459500號,家聲實業有限公司,勞動基準法第32條第2項,延長工作時間超過法令規定,,
新北市,20161208,20160905,新北府勞檢字第10534595001號,家聲實業有限公司,勞動基準法第36條,每七日中未有一日之休息作為例假,,
新北市,20161208,20160905,新北府勞檢字第1053459500號,家聲實業有限公司,勞動基準法第32條第2項,延長工作時間超過法令規定,,
高雄市,20191024,20190625,高市勞檢字第10871170800號,家聲實業有限公司,職業安全衛生法第37條第2項,勞動場所發生罹災人數在1人以上，且需住院治療之職業災害，雇主未於8小時內通報勞動檢查機構。,,
高雄市,20191024,20190625,高市勞檢字第10871171000號,家聲實業有限公司,職業安全衛生法第6條第1項第13款,對於勞工工作場所之通道、地板或其他勞工踩踏場所，未保持不致使勞工跌倒、滑倒、踩傷、滾落等之安全狀態，或採取必要之預防措施。,,
台南市,20210510,20210408,南市勞安字第1100410163號,家聲實業有限公司李金祥,勞動基準法第23條第1項,工資未定期給付勞工。,20000,
勞動部勞工保險局,20220510,20220321,保退二字第11160026131號,家聲實業有限公司李金祥,勞工退休金條例第15條第2項,雇主未依規定覈實申報調整勞工退休金提繳工資。,5000,
