主管機關,公告日期,處分日期,處分字號,事業單位名稱或負責人,違法法規法條,違反法規內容,罰鍰金額,備註說明
桃園市,20200310,20200115,府勞檢字第1090012447號,富永營造股份有限公司邱暐婷,職業安全衛生設施規則第108條第1款暨職業安全衛生法第6條第1項;職業安全衛生設施規則第108條第4款暨職業安全衛生法第6條第1項;職業安全衛生設施規則第108條第5款暨職業安全衛生法第6條第1項;職業安全衛生設施規則第228條暨職業安全衛生法第6條第1項;營造安全衛生設施標準第19條第2項暨職業安全衛生法第6條第1項,雇主對於高壓氣體之貯存，應依下列規定辦理：一、貯存場所應有適當之警戒標示，禁止煙火接近。二、…。;雇主對於高壓氣體之貯存，應依下列規定辦理：一、…。四、可燃性氣體、有毒性氣體及氧氣之鋼瓶，應分開貯存。五、…。;雇主對於高壓氣體之貯存，應依下列規定辦理：一、…。五、應安穩置放並加固定及裝妥護蓋。六、…。;雇主對勞工於高差超過一．五公尺以上之場所作業時，應設置能使勞工安全上下之設備。;雇主設置前項設備有困難，或因作業之需要臨時將護欄、護蓋或安全網等防護設備拆除者，應採取使勞工使用安全帶等防止墜落致勞工遭受危險之措施。,,
桃園市,20201008,20200811,府勞檢字第1090196018號,富永營造股份有限公司,1.職業安全衛生設施規則第228條暨職業安全衛生法第6條第1項2.營造安全衛生設施標準第19條第1項暨職業安全衛生法第6條第1項3.營造安全衛生設施標準第59條第1款暨職業安全衛生法第6條第1項,1.雇主對勞工於高差超過一．五公尺以上之場所作業時，應設置能使勞工安全上下之設備。2.雇主對於高度二公尺以上之屋頂、鋼樑、開口部分、階梯、樓梯、坡道、工作臺、擋土牆、擋土支撐、施工構臺、橋樑墩柱及橋樑上部結構、橋臺等場所作業，勞工有遭受墜落危險之虞者，應於該處設置護欄、護蓋或安全網等防護設備。3.雇主對於鋼管施工架之設置，應依下列規定辦理：一、使用國家標準CNS4750型式之施工架，應符合國家標準同等以上之規定；其他型式之施工架，其構材之材料抗拉強度、試驗強度及製造，應符合國家標準CNS4750同等以上之規定。二、…。,,
台北市,20210705,20210420,北市勞職字第11060601361號,富永營造股份有限公司,職業安全衛生法第27條第1項,原事業單位未採取承攬管理必要措施。,,
台北市,20220105,20211025,北市勞職字第11061014821號,富永營造股份有限公司李輝民,營造安全衛生設施標準第19條第1項暨職業安全衛生法第6條1項第13款,有墜落危險之處所未設防護設備。,,
桃園市,20210406,20210223,府勞檢字第1100028929號,富永營造股份有限公司邱暐婷,職業安全衛生設施規則第228條暨職業安全衛生法第6條第1項;營造安全衛生設施標準第19條第1項暨職業安全衛生法第6條第1項;營造安全衛生設施標準第21條第2款暨職業安全衛生法第6條第1項;營造安全衛生設施標準第21條第6款暨職業安全衛生法第6條第1項;營造安全衛生設施標準第59條第1項第1款暨職業安全衛生法第6條第1項;營造安全衛生設施標準第59條第1項第4款暨職業安全衛生法第6條第1項,雇主對勞工於高差超過一．五公尺以上之場所作業時，應設置能使勞工安全上下之設備。;雇主對於高度二公尺以上之屋頂、鋼梁、開口部分、階梯、樓梯、坡道、工作臺、擋土牆、擋土支撐、施工構臺、橋梁墩柱及橋梁上部結構、橋臺等場所作業，勞工有遭受墜落危險之虞者，應於該處設置護欄、護蓋或安全網等防護設備。;雇主設置之護蓋，應依下列規定辦理：一、…。二、應以有效方法防止滑溜、掉落、掀出或移動。三、…。;雇主設置之護蓋，應依下列規定辦理：一、…。六、臨時性開口處使用之護蓋，表面漆以黃色並書以警告訊息。;雇主對於鋼管施工架之設置，應依下列規定辦理：一、使用國家標準CNS4750型式之施工架，應符合國家標準同等以上之規定；其他型式之施工架，其構材之材料抗拉強度、試驗強度及製造，應符合國家標準CNS4750同等以上之規定。二、…。;雇主對於鋼管施工架之設置，應依下列規定辦理：一、…。四、構件之連接部分或交叉部分，應以適當之金屬附屬配件確實連接固定，並以適當之斜撐材補強。五、…。,,
桃園市,20211108,20210928,府勞檢字第1100242653號,富永營造股份有限公司李輝民,職業安全衛生設施規則第190條第3款暨職業安全衛生法第6條第1項;職業安全衛生設施規則第230條第1項第3款暨職業安全衛生法第6條第1項;職業安全衛生設施規則第230條第1項第4款暨職業安全衛生法第6條第1項;營造安全衛生設施標準第19條第1項暨職業安全衛生法第6條第1項;營造安全衛生設施標準第32條第1款暨職業安全衛生法第6條第1項;營造安全衛生設施標準第171條暨職業安全衛生法第6條第1項,對於雇主為金屬之熔接、熔斷或加熱等作業所須使用可燃性氣體及氧氣之容器，應依下列規定辦理：一、…。三、容器應直立穩妥放置，防止傾倒危險，並不得撞擊。四、…。;雇主對於使用之合梯，應符合下列規定：一、…。三、梯腳與地面之角度應在七十五度以內，且兩梯腳間有金屬等硬質繫材扣牢，腳部有防滑絕緣腳座套。四、…。;雇主對於使用之合梯，應符合下列規定：一、…。四、有安全之防滑梯面。;雇主對於高度二公尺以上之屋頂、鋼梁、開口部分、階梯、樓梯、坡道、工作臺、擋土牆、擋土支撐、施工構臺、橋梁墩柱及橋梁上部結構、橋臺等場所作業，勞工有遭受墜落危險之虞者，應於該處設置護欄、護蓋或安全網等防護設備。;雇主對於鋼材之儲存，應依下列規定辦理：一、預防傾斜、滾落，必要時應用纜索等加以適當捆紮。二、…。;雇主對於營造工程工作場所應保持環境衛生。寢室、廚房、浴室或廁所應指定專人負責環境衛生之維護，以保持清潔。,,
台北市,20240605,20240412,北市勞職字第11360629171號,富永營造股份有限公司祝泓理,職業安全衛生設施規則第21條暨職業安全衛生法第6條第1項第13款,通道等未保持安全狀態或防跌等預防措施。,,
職業安全衛生署,20250115,20241227,勞職授字第1130208069號,富永營造股份有限公司祝泓理,職業安全衛生設施規則第57條第1項暨職業安全衛生法第6條第1項,雇主對於機械、設備及其相關配件之掃除、上油、檢查、修理或調整有導致危害勞工之虞者，未停止相關機械運轉及送料。為防止他人操作該機械、設備及其相關配件之起動等裝置或誤送料，未採上鎖或設置標示等措施，並設置防止落下物導致危害勞工之安全設備與措施。,,
