主管機關,公告日期,處分日期,處分字號,事業單位名稱或負責人,違法法規法條,違反法規內容,罰鍰金額,備註說明
職業安全衛生署,20160310,20160218,勞職授字第1050200555號,寶慶營造股份有限公司,營造安全衛生設施標準第19條第1項暨職業安全衛生法第6條第1項,對於高度2公尺以上之(外牆施工架工作臺、6樓電梯間等)開口部分作業時，勞工有遭受墜落危險之虞者，未設置交叉拉桿及下拉桿、護欄或安全網等防護設備。,,
台中市,20231010,20230908,府授勞檢字第1120258581號,寶慶營造股份有限公司謝佳修,職業安全衛生法第6條第1項,未符合規定之必要安全衛生設備及措施,,
台中市,20241113,20241004,府授勞檢字第1130280604號,寶慶營造股份有限公司謝佳修,職業安全衛生法第6條第1項,未符合規定之必要安全衛生設備及措施,,
職業安全衛生署,20240905,20240719,勞職授字第1130205495號,寶慶營造股份有限公司謝佳修,營造安全衛生設施標準第19條第1項暨職業安全衛生法第6條第1項,對於高度2公尺以上之戶外梯樓板及樓板邊緣開口部分等場所作業，勞工有墜落危險之虞，未於樓板開口部分設置護欄、護蓋或安全網等防護設備。,,
台中市,20250208,20250108,府授勞檢字第1140002321號,寶慶營造股份有限公司謝佳修,職業安全衛生法第6條第1項,未符合規定之必要安全衛生設備及措施,,
