主管機關,公告日期,處分日期,處分字號,事業單位名稱或負責人,違法法規法條,違反法規內容,罰鍰金額,備註說明
勞動部勞工保險局,20231011,20230824,保退一字第11269911085號,寶錸營造有限公司楊國志,勞工退休金條例第19條第1項,雇主未按時繳納勞工退休金致加徵滯納金。,13948,
新北市,20230818,20230616,新北府勞業字第1121101433號,寶錸營造有限公司楊國志,勞工退休金條例第12條第1項;勞工退休金條例第12條第2項,雇主未依規定標準發給勞工退休金條例工作年資之資遣費。;雇主未依規定於終止勞動契約後30日內發給新制資遣費。,600000,正確金額為100000元
新北市,20230818,20230616,新北府勞業字第1121101433號,寶錸營造有限公司楊國志,勞工退休金條例第12條第1項;勞工退休金條例第12條第2項,雇主未依規定標準發給勞工退休金條例工作年資之資遣費。;雇主未依規定於終止勞動契約後30日內發給新制資遣費。,600000,正確金額為100000元
新北市,20231215,20230918,新北府勞檢字第1124679638號,寶錸營造有限公司楊國志,勞動基準法第30條第5項,未依規定置備勞工出勤紀錄表,45000,
新北市,20231215,20230918,新北府勞檢字第1124679638號,寶錸營造有限公司楊國志,勞動基準法第30條第5項,未依規定置備勞工出勤紀錄表,45000,
新北市,20241018,20240715,新北府勞檢字第1134652471號,寶錸營造有限公司楊國志,職業安全衛生法第6條第1項,未符合規定之必要安全衛生設備及措施,,
