主管機關,公告日期,處分日期,處分字號,事業單位名稱或負責人,違法法規法條,違反法規內容,罰鍰金額,備註說明
職業安全衛生署,20160310,20160219,勞職授字第1050200495號,尚懋科技股份有限公司,營造安全衛生設施標準第19條第1項、第20條第1項暨職業安全衛生法第6條第1項,對於營造工程用之模板、施工架等材料拆除後，未採取拔除或釘入凸出之鐵釘、鐵條等防護措施，未依規定設置之護欄，致發生職業安全衛生法第37條第2項之職業災害。,,
職業安全衛生署,20170210,20161216,勞職授字第1050204814號,尚懋科技股份有限公司,職業安全衛生設施規則第281條第1項暨職業安全衛生法第6條第1項,從事消防工程勘查作業，對於在高度2公尺以上之高處作業，勞工有墜落之虞，未使勞工確實使用安全帶。,,
職業安全衛生署,20160310,20160219,勞職授字第1050200495號,尚懋科技股份有限公司,營造安全衛生設施標準第19條第1項、第20條第1項暨職業安全衛生法第6條第1項,對於營造工程用之模板、施工架等材料拆除後，未採取拔除或釘入凸出之鐵釘、鐵條等防護措施，未依規定設置之護欄，致發生職業安全衛生法第37條第2項之職業災害。,,
職業安全衛生署,20170210,20161216,勞職授字第1050204814號,尚懋科技股份有限公司,職業安全衛生設施規則第281條第1項暨職業安全衛生法第6條第1項,從事消防工程勘查作業，對於在高度2公尺以上之高處作業，勞工有墜落之虞，未使勞工確實使用安全帶。,,
職業安全衛生署,20240205,20231124,勞職授字第1120205519A號,尚懋科技股份有限公司李守文,職業安全衛生法第27條第1項第2款、第3款,與承攬人分別僱用勞工共同作業時，未採取工作之連繫與調整之必要措施、未巡視工作場所。,,
職業安全衛生署,20240205,20231124,勞職授字第1120205519號,尚懋科技股份有限公司李守文,職業安全衛生法第26條第1項,以其事業之全部或一部分交付承攬時，未於事前告知該承攬人有關其事業工作環境、危害因素暨職業安全衛生法及有關安全衛生規定應採取之措施。,,
