主管機關,公告日期,處分日期,處分字號,事業單位名稱或負責人,違法法規法條,違反法規內容,罰鍰金額,備註說明
台北市,20181204,20181025,北市勞動字第10760401151號,岱瑪金誠國際事業股份有限公司陳淑誼,勞動基準法第32條第2項;勞動基準法第49條第1項,延長工作時間超過法令規定;未經工會或勞資會議同意使女工於午後十時至翌晨六時之時間內工作,,
勞動部勞工保險局,20230410,20230222,保退一字第11269911025號,岱瑪金誠國際事業股份有限公司陳淑誼,勞工退休金條例第19條第1項,雇主未按時繳納勞工退休金致加徵滯納金。,26377,
勞動部勞工保險局,20230810,20230626,保退一字第11269911065號,岱瑪金誠國際事業股份有限公司陳淑誼,勞工退休金條例第19條第1項,雇主未按時繳納勞工退休金致加徵滯納金。,15169,
台北市,20230704,20230512,府勞動字第11260086501號,岱瑪金誠國際事業股份有限公司陳淑誼,勞動基準法第22條第2項;勞動基準法第32條第2項;勞動基準法第24條第1項;勞動基準法第36條第1項,工資未依法給付給勞工;延長工作時間超過法令規定;延長工作時間未依規定加給工資;未使勞工每7日中有2日之休息，其中1日為例假，1日為休息日,160000,
勞動部勞工保險局,20250210,20241225,保退一字第11369911125號,岱瑪金誠國際事業股份有限公司陳淑誼,勞工退休金條例第19條第1項,雇主未按時繳納勞工退休金致加徵滯納金。,13660,
