主管機關,公告日期,處分日期,處分字號,事業單位名稱或負責人,違法法規法條,違反法規內容,罰鍰金額,備註說明
台南市,20160910,20160824,府勞條字第1050864207號,岱稜科技股份有限公司蔡國龍,勞動基準法第36條,每七日中未有一日之休息作為例假;,,
職業安全衛生署,20160421,20160310,勞職授字第1050200857號,岱稜科技股份有限公司,職業安全衛生設施規則第57條第1項暨職業安全衛生法第6條第1項,對於機械之掃除、上油、檢查、修理或調整有導致危害勞工之虞者，未停止相關機械運轉及送料。,,
台南市,20160910,20160824,府勞條字第1050864207號,岱稜科技股份有限公司蔡國龍,勞動基準法第36條,每七日中未有一日之休息作為例假;,,
職業安全衛生署,20160421,20160310,勞職授字第1050200857號,岱稜科技股份有限公司,職業安全衛生設施規則第57條第1項暨職業安全衛生法第6條第1項,對於機械之掃除、上油、檢查、修理或調整有導致危害勞工之虞者，未停止相關機械運轉及送料。,,
職業安全衛生署,20190606,20190314,勞職授字第1080201036號,岱稜科技股份有限公司,職業安全衛生設施規則第171條第1項第2款暨職業安全衛生法第6條第1項,雇主對於易引起火災及爆炸危險之場所，未標示嚴禁煙火及禁止無關人員進入，並規定勞工不得使用明火。,,
職業安全衛生署,20190708,20190424,勞職授字第1080201592號,岱稜科技股份有限公司,職業安全衛生設施規則第245條暨職業安全衛生法第6條第1項,對電焊作業使用之焊接柄，未有相當之絕緣耐力及耐熱性。,,
職業安全衛生署,20210104,20201012,勞職授字第1090204325號,岱稜科技股份有限公司蔡國龍,職業安全衛生設施規則第175條第1項第6款暨職業安全衛生法第6條第1項,雇主對於其他有因靜電引起爆炸、火災之虞之化學設備或其附屬設備有因靜電引起爆炸或火災之虞者，未採取接地使用除電劑、加濕、使用不致成為發火源之虞之除電裝置或其他去除靜電之裝置。,,
台南市,20240810,20240718,南市勞安字第1130983174號,岱稜科技股份有限公司蔡國龍,勞動基準法第24條;勞動基準法第30條第6項,延長工作時間未依規定加給工資;未逐日記載勞工出勤情形至分鐘為止。,100000,
