主管機關,公告日期,處分日期,處分字號,事業單位名稱或負責人,違法法規法條,違反法規內容,罰鍰金額,備註說明
職業安全衛生署,20170420,20170224,勞職授字第1060200717號,岳豐科技股份有限公司,職業安全衛生設施規則第241條、第245條暨職業安全衛生法第6條第1項,對於交流電焊機二次測出電位置，勞工於作業中時，有因接觸致發生感電之虞，未設有防止感電絕緣被覆；對於電焊作業使用之焊接柄，未有相當之絕緣耐力。,,
桃園市,20210202,20201223,府勞檢字第10903300241號,岳豐科技股份有限公司葉春榮,職業安全衛生設施規則第290條暨職業安全衛生法第6條第1項,雇主對於從事電氣工作之勞工，應使其使用電工安全帽、絕緣防護具及其他必要之防護器具。,,
桃園市,20210202,20201223,府勞檢字第1090330024號,岳豐科技股份有限公司葉春榮,職業安全衛生法第37條第2項第3款,事業單位勞動場所發生下列職業災害之一者，雇主應於八小時內通報勞動檢查機構：一、…。三、發生災害之罹災人數在一人以上，且需住院治療。四、…。,,
桃園市,20230303,20230109,111年府勞檢字1120006421號,岳豐科技股份有限公司嘉榮投資有限公司,勞基法第43條,雇主未核給勞工婚假、喪假、公傷、病假或事假等應給之假期或假期內應給付之工資,20000,行政救濟中
桃園市,20240702,20240515,113年府勞檢字1130133255號,岳豐科技股份有限公司嘉榮投資有限公司,勞基法第70條,雇主未依規定訂立工作規則或未將工作規則報請當地主管機關核備或未將核備後之工作規則公開揭示之,20000,
