主管機關,公告日期,處分日期,處分字號,事業單位名稱或負責人,違法法規法條,違反法規內容,罰鍰金額,備註說明
台北市,20160518,20160309,北市勞職字第10533220202號,工鼎鋼鐵股份有限公司,營造安全衛生設施標準第19條第1項暨職業安全衛生法第6條第1項第5款。,對於高度2公尺以上之開口部分從事營建施工管理作業，勞工有遭受墜落危險之虞者，未於該處設置護欄、護蓋或安全網等防護設備。,,
職業安全衛生署,20161122,20160920,勞職授字第1050203426號,工鼎鋼鐵股份有限公司,職業安全衛生設施規則第90條暨職業安全衛生法第6條第1項,對於起重機具之吊具，未有確實防止所吊支撐材料脫落之裝置。,,
台北市,20160518,20160309,北市勞職字第10533220202號,工鼎鋼鐵股份有限公司,營造安全衛生設施標準第19條第1項暨職業安全衛生法第6條第1項第5款。,對於高度2公尺以上之開口部分從事營建施工管理作業，勞工有遭受墜落危險之虞者，未於該處設置護欄、護蓋或安全網等防護設備。,,
職業安全衛生署,20161122,20160920,勞職授字第1050203426號,工鼎鋼鐵股份有限公司,職業安全衛生設施規則第90條暨職業安全衛生法第6條第1項,對於起重機具之吊具，未有確實防止所吊支撐材料脫落之裝置。,,
桃園市,20181005,20180816,107年府勞檢字1070201284號,工鼎鋼鐵股份有限公司陳永亮,勞基法第24條,延長工作時間未依規定加給工資,,
職業安全衛生署,20230808,20230515,勞職授字第1120202481A號,工鼎鋼鐵股份有限公司陳永亮,職業安全衛生設施規則第90條暨職業安全衛生法第6條第1項,對於起重機具之吊鉤或吊具，未有防止吊舉中所吊物體脫落之裝置。,,
