主管機關,公告日期,處分日期,處分字號,事業單位名稱或負責人,違法法規法條,違反法規內容,罰鍰金額,備註說明
桃園市,20180308,20180119,107年府勞檢字1070015151號,巧展實業股份有限公司李賢清,勞基法第24條第1項,延長工作時間未依規定加給工資,,
職業安全衛生署,20180808,20180523,勞職授字第1070202571號,巧展實業股份有限公司,職業安全衛生設施規則第56條、第57條第1項暨職業安全衛生法第6條第1項,對於旋轉刃具作業，勞工手指有觸及之虞者，未明確告知並標示勞工不得使用手套、機械之掃除、上油、檢查、修理或調整有導致危害勞工之虞者，未停止相關機械運轉及送料。,,
職業安全衛生署,20180911,20180626,勞職授字第1070203270號,巧展實業股份有限公司,職業安全衛生法第37條第2項,"勞動場所發生罹災人數在1人以上,且需住院治療之職業災害,未於8小時內通報勞動檢查機構。",,
桃園市,20230206,20221228,111年府勞檢字1110361645號,巧展實業股份有限公司李賢清,勞基法第24條第1項,延長工作時間未依規定加給工資,20000,
桃園市,20230208,20221226,府勞檢字第1110356182號,巧展實業股份有限公司李賢清,機械設備器具安全標準第84條第2項第2款暨職業安全衛生法第6條第1項;職業安全衛生設施規則第116條第14款暨職業安全衛生法第6條第1項;職業安全衛生設施規則第126條暨職業安全衛生法第6條第1項;有機溶劑中毒預防規則第25條暨職業安全衛生法第6條第1項;職業安全衛生設施規則第287條暨職業安全衛生法第6條第1項,使用座式操作之堆高機，應符合下列規定：一、…。二、配衡型堆高機及側舉型堆高機之駕駛座，應配置防止車輛傾倒時，駕駛者被堆高機壓傷之安全帶、護欄或其他防護設施。;雇主對於勞動場所作業之車輛機械，應使駕駛者或有關人員負責執行下列事項：一、…。十四、使用座式操作之配衡型堆高機及側舉型堆高機，應使擔任駕駛之勞工確實使用駕駛座安全帶。但駕駛座配置有車輛傾倒時，防止駕駛者被堆高機壓傷之護欄或其他防護設施者，不在此限。十五、…。;雇主對於荷重在一公噸以上之堆高機，應指派經特殊作業安全衛生教育訓練人員操作。;雇主於室內儲藏,,
