主管機關,公告日期,處分日期,處分字號,事業單位名稱或負責人,違法法規法條,違反法規內容,罰鍰金額,備註說明
屏東縣,20200106,20191223,屏府勞動資字第10887171300;10887171301號,帝國保全股份有限公司,勞動基準法第80條;勞動基準法第22條第2項,拒絕、規避或阻撓勞工檢查員依法執行職務;工資未全額給付給勞工。,,
高雄市,20200207,20191211,高市勞條字第10840848800號,帝國保全股份有限公司朱潤堂,勞動基準法第80條,拒絕、規避或阻撓勞工檢查員依法執行職務,,
勞動部勞工保險局,20230612,20230426,保退一字第11269911045號,帝國保全股份有限公司朱潤堂,勞工退休金條例第19條第1項,雇主未按時繳納勞工退休金致加徵滯納金。,108729,
勞動部勞工保險局,20230810,20230626,保退一字第11269911065號,帝國保全股份有限公司朱潤堂,勞工退休金條例第19條第1項,雇主未按時繳納勞工退休金致加徵滯納金。,225574,
勞動部勞工保險局,20231011,20230824,保退一字第11269911085號,帝國保全股份有限公司朱潤堂,勞工退休金條例第19條第1項,雇主未按時繳納勞工退休金致加徵滯納金。,225079,
