主管機關,公告日期,處分日期,處分字號,事業單位名稱或負責人,違法法規法條,違反法規內容,罰鍰金額,備註說明
職業安全衛生署,20190408,20190125,勞職授字第1080200386號,廷鑫興業股份有限公司臺南廠,職業安全衛生設施規則第3條第1項、職業安全衛生設施規則第116條第1項第12款、高壓氣體勞工安全規則第172條暨職業安全衛生法第6條第1項,重油泵之轉軸未有護罩；堆高機於駕駛者離開其位置時，未將原動機熄火及拉手煞車制動；液氧儲槽等消費設備之閥未標示開閉狀況。,,
職業安全衛生署,20220601,20220307,勞職授字第1110201143號,廷鑫興業股份有限公司顏德新,職業安全衛生設施規則第43條第1項暨職業安全衛生法第6條第1項,雇主對於機械之原動機、轉軸、齒輪、帶輪、飛輪、傳動輪、傳動帶等有危害勞工之虞之部分，未有護罩、護圍、套胴、跨橋等設備。,,
職業安全衛生署,20230607,20230309,勞職授字第1120201434號,廷鑫興業股份有限公司台南廠顏德新,職業安全衛生法第6條第1項,氧氣儲槽之閥，未標示開閉狀況。,,
勞動部勞工保險局,20240812,20240625,保退一字第11369911065號,廷鑫興業股份有限公司顏德新,勞工退休金條例第19條第1項,雇主未按時繳納勞工退休金致加徵滯納金。,47469,
勞動部勞工保險局,20241011,20240827,保退一字第11369911085號,廷鑫興業股份有限公司顏德新,勞工退休金條例第19條第1項,雇主未按時繳納勞工退休金致加徵滯納金。,34378,
勞動部勞工保險局,20250210,20241225,保退一字第11369911125號,廷鑫興業股份有限公司顏德新,勞工退休金條例第19條第1項,雇主未按時繳納勞工退休金致加徵滯納金。,95476,
台南市,20240510,20240425,南市勞安字第1130581450號,廷鑫興業股份有限公司顏德新,勞動基準法第22條第2項,工資未全額直接給付勞工。,50000,
