主管機關,公告日期,處分日期,處分字號,事業單位名稱或負責人,違法法規法條,違反法規內容,罰鍰金額,備註說明
高雄市,20160518,20160328,高市勞條字第10532154900號,建暐精密科技股份有限公司,勞動基準法第24條;勞動基準法第32條第2項;勞動基準法第38條;勞動基準法第39條,延長工作時間未依規定加給工資;延長工作時間超過法令規定;未依規定給予特別休假;假日工資未給或於休假日工作未依規定加給工資,,
高雄市,20161019,20160822,高市勞條字第10536379700號,建暐精密科技股份有限公司李聰林,勞動基準法第24條;勞動基準法第32條第2項;勞動基準法第38條;勞動基準法第39條,延長工作時間未依規定加給工資;延長工作時間超過法令規定;未依規定給予特別休假;假日工資未給或於休假日工作未依規定加給工資,,
高雄市,20170619,20170221,高市勞條字第10631053700號,建暐精密科技股份有限公司李聰林,勞動基準法第24條;勞動基準法第39條,延長工作時間未依規定加給工資;假日工資未給或於休假日工作未依規定加給工資,,
高雄市,20180227,20171208,高市勞條字第10639938300號,建暐精密科技股份有限公司,勞動基準法第38條,未依規定給予特別休假,,
高雄市,20220510,20220321,高市勞條字第11131572500號,建暐精密科技股份有限公司李聰林,勞動基準法第24條,延長工作時間未依規定加給工資,50000,
