主管機關,公告日期,處分日期,處分字號,事業單位名稱或負責人,違法法規法條,違反法規內容,罰鍰金額,備註說明
科技部新竹科學園區,20170105,20161117,竹環字第1050032430號,復盛精密工業股份有限公司竹科一廠,勞動基準法第22條第2項,雇主延長勞工工作時間一個月超過46小時,,
職業安全衛生署,20171025,20170714,勞職授字第1060203070號,復盛精密工業股份有限公司,特定化學物質危害預防標準第38條、第50條、第25條、第40條暨職業安全衛生法第6條第1項,蝕刻機局部排氣裝置故障，無法抽氣，因該蝕刻機內有氯化氫，酸氣溢出，未維持局部排氣裝置性能，另製造、處置或使用特定化學物質等之作業場所，未使勞工確實使用適當必要防護具，且其管路未標示該原料及流向，以及輸送對象設備，且對禁止勞工在特定化學物質作業場所吸煙或飲食，未將其意旨揭示於該作業場所之顯明易見之處。,,
科技部新竹科學園區,20170105,20161117,竹環字第1050032430號,復盛精密工業股份有限公司竹科一廠,勞動基準法第22條第2項,雇主延長勞工工作時間一個月超過46小時,,
職業安全衛生署,20171025,20170714,勞職授字第1060203070號,復盛精密工業股份有限公司,特定化學物質危害預防標準第38條、第50條、第25條、第40條暨職業安全衛生法第6條第1項,蝕刻機局部排氣裝置故障，無法抽氣，因該蝕刻機內有氯化氫，酸氣溢出，未維持局部排氣裝置性能，另製造、處置或使用特定化學物質等之作業場所，未使勞工確實使用適當必要防護具，且其管路未標示該原料及流向，以及輸送對象設備，且對禁止勞工在特定化學物質作業場所吸煙或飲食，未將其意旨揭示於該作業場所之顯明易見之處。,,
職業安全衛生署,20221209,20220915,勞職授字第1110205267號,復盛精密工業股份有限公司李亮箴,職業安全衛生設施規則第153條暨職業安全衛生法第6條第1項,對於搬運、堆放或處置物料，未防止倒塌、崩塌或掉落，未採取繩索捆綁、護網、擋樁、限制高度或變更堆積等必要設施，未禁止與作業無關人員進入該等場所。,,
職業安全衛生署,20240520,20240410,勞職授字第1130203737號,復盛精密工業股份有限公司李亮箴,職業安全衛生設施規則第21條暨職業安全衛生法第6條第1項,對於勞工工作場所之通道、地板、階梯、坡道、工作台或其他勞工踩踏場所，未保持不致使勞工跌倒、滑倒、踩傷、滾落等之安全狀態，未採取必要之預防措施。,,
