主管機關,公告日期,處分日期,處分字號,事業單位名稱或負責人,違法法規法條,違反法規內容,罰鍰金額,備註說明
桃園市,20161210,20161107,105年府勞檢字1050270743號,德昌皮革製品股份有限公司白志祥,勞基法第24條,延長工作時間未依規定加給工資,,
桃園市,20170911,20170710,府勞檢字第1060162905號,德昌皮革製品股份有限公司白聖賢,職業安全衛生設施規則第126條暨職業安全衛生法第6條第1項;職業安全衛生設施規則第278條暨職業安全衛生法第6條第1項,雇主對於荷重在一公噸以上之堆高機，應指派經特殊安全衛生教育、訓練人員操作。;雇主對於搬運、置放、使用有刺角物、凸出物、腐蝕性物質、毒性物質或劇毒物質時，應置備適當之手套、圍裙、裹腿、安全鞋、安全帽、防護眼鏡、防毒口罩、安全面罩等並使勞工確實使用。,,
桃園市,20161210,20161107,105年府勞檢字1050270743號,德昌皮革製品股份有限公司白志祥,勞基法第24條,延長工作時間未依規定加給工資,,
桃園市,20170911,20170710,府勞檢字第1060162905號,德昌皮革製品股份有限公司白聖賢,職業安全衛生設施規則第126條暨職業安全衛生法第6條第1項;職業安全衛生設施規則第278條暨職業安全衛生法第6條第1項,雇主對於荷重在一公噸以上之堆高機，應指派經特殊安全衛生教育、訓練人員操作。;雇主對於搬運、置放、使用有刺角物、凸出物、腐蝕性物質、毒性物質或劇毒物質時，應置備適當之手套、圍裙、裹腿、安全鞋、安全帽、防護眼鏡、防毒口罩、安全面罩等並使勞工確實使用。,,
桃園市,20180402,20180227,107年府勞檢字1070045006號,德昌皮革製品股份有限公司白聖賢,勞基法第24條第1項,延長工作時間未依規定加給工資,,
桃園市,20180810,20180607,府勞檢字第1070137978號,德昌皮革製品股份有限公司白志祥,職業安全衛生設施規則第277條第1項第3款暨職業安全衛生法第6條第1項;職業安全衛生設施規則第241條暨職業安全衛生法第6條第1項;職業安全衛生設施規則第245條暨職業安全衛生法第6條第1項;機械設備器具安全標準第104條第1項暨職業安全衛生法第6條第1項,雇主供給勞工使用之個人防護具或防護器具，應依下列規定辦理：一、…。三、防護具或防護器具應準備足夠使用之數量，個人使用之防護具應置備與作業勞工人數相同或以上之數量，並以個人專用為原則。四、…。;雇主對於電氣機具之帶電部分(電熱器之發熱體部分，電焊機之電極部分等，依其使用目的必須露出之帶電部分除外)，如勞工於作業中或通行時，有因接觸(含經由導電體而接觸者，以下同)或接近致發生感電之虞者，應設防止感電之護圍或絕緣被覆。但電氣機具設於配電室、控制室、變電室等被區隔之場所，且禁止電氣作業有關人員以外之人員進入者；或設置於電桿、鐵塔等已隔離之場所，且電氣作業有關人員以外之人員無接近之虞之場所者，不在此限。;雇主對電焊作業使用之焊接柄，應有相當之絕緣耐力及耐熱性。;桌上用研磨機及床式研磨機使用之護罩，應以設置舌板或其他方法，使研磨之必要部分之研磨輪周邊與護罩間之間隙可調整在十毫米以下。,,
