主管機關,公告日期,處分日期,處分字號,事業單位名稱或負責人,違法法規法條,違反法規內容,罰鍰金額,備註說明
台北市,20161111,20160905,北市勞職字第10541686202號,志堅工業有限公司,營造安全衛生設施標準第19條第1項暨職業安全衛生法第6條第1項第5款。,對於高度2公尺以上之開口部分從事作業，未於該處設置護欄、護蓋或安全網等防護設備，使勞工有遭受墜落危險之虞。,,
台北市,20161111,20160905,北市勞職字第10541686202號,志堅工業有限公司,營造安全衛生設施標準第19條第1項暨職業安全衛生法第6條第1項第5款。,對於高度2公尺以上之開口部分從事作業，未於該處設置護欄、護蓋或安全網等防護設備，使勞工有遭受墜落危險之虞。,,
職業安全衛生署,20201210,20200921,勞職授字第1090203970號,志堅工業有限公司,營造安全衛生設施標準第19條第1項暨職業安全衛生法第6條第1項,"對於高度2公尺以上之開口部分,勞工有遭受墜落危險之虞者,未設置護欄、護蓋或安全網等防護設備。",,
職業安全衛生署,20240305,20240117,勞職授字第1120206100號,志堅工業有限公司林宗清,營造安全衛生設施標準第149條之1暨職業安全衛生法第6條第1項,進行鋼構組配作業前，未擬訂鋼構組配作業計畫，及於勞工作業前將鋼構組配作業計畫內容使勞工確實知悉。,,
職業安全衛生署,20240305,20240117,勞職授字第1120206101號,志堅工業有限公司林宗清,職業安全衛生法第26條第2項,承攬人就其承攬之全部或一部分交付再承攬時，承攬人未於事前告知該承攬人有關其事業工作環境、危害因素暨本法及有關安全衛生規定應採取之措施。,,
