主管機關,公告日期,處分日期,處分字號,事業單位名稱或負責人,違法法規法條,違反法規內容,罰鍰金額,備註說明
職業安全衛生署,20180126,20171012,勞職授字第1060204403號,志弦企業有限公司,作業環境監測實施管理辦法第8條第1項第3款暨職業安全衛生法第12條第3項,處置、使用第二種有機溶劑(甲苯)之作業場所，未於該場所每6個月監測其濃度1次以上；處置、使用特定化學物質作業場所，未於該場所每6個月監測其濃度1次以上。,,
職業安全衛生署,20180126,20171012,勞職授字第1060204405號,志弦企業有限公司,特定化學物質危害預防標準第36條暨職業安全衛生法第6條第1項,處置特定化學物質氯化氫溶液數量4公噸，未設置洗眼、緊急沖淋設備。,,
職業安全衛生署,20180605,20180326,勞職授字第1070201266號,志弦企業有限公司,職業安全衛生設施規則第43條第1項暨職業安全衛生法第6條第1項,雇主對於機械之原動機、轉軸、齒輪、帶輪、飛輪、傳動輪、傳動帶等有危害勞工之虞之部分，未有護罩、護圍、套胴、跨橋等設備。,,
職業安全衛生署,20190909,20190626,勞職授字第1080202732號,志弦企業有限公司,機械設備器具安全標準第4條第1項暨職業安全衛生法第6條第1項,以動力驅動之衝壓機械及剪斷機械（以下簡稱衝剪機械），未具有安全護圍、安全模、特定用途之專用衝剪機械或自動衝剪機械（以下簡稱安全護圍等）。,,
職業安全衛生署,20240910,20240701,勞職授字第1130205014號,志弦企業有限公司王龍寶,機械設備器具安全標準第4條第1項第1款暨職業安全衛生法第6條第1項,以動力驅動之衝壓機械及剪斷機械（以下簡稱衝剪機械），未具有安全護圍、安全模、特定用途之專用衝剪機械或自動衝剪機械（以下簡稱安全護圍等）。,,陳敏舜
