主管機關,公告日期,處分日期,處分字號,事業單位名稱或負責人,違法法規法條,違反法規內容,罰鍰金額,備註說明
職業安全衛生署,20240801,20240620,勞職授字第1130204873A號,恆美地產股份有限公司吳任旺,職業安全衛生法第27條第1項,事業單位與承攬人、再承攬人分別僱用勞工共同作業時，為防止職業災害，原事業單位未採取下列必要措施：一、設立協議組織，並指定工作場所負責人，擔任指揮、監督及協調之工作。二、工作之連繫與調整。三、工作場所之巡視。四、相關承攬事業間之安全衛生教育之指導及協助。……。,,黃信章(重傷)
職業安全衛生署,20240801,20240620,勞職授字第1130204873B號,恆美地產股份有限公司吳任旺,營造安全衛生設施標準第17條營造安全衛生設施標準第19條第1項營造安全衛生設施標準第45條第2款營造安全衛生設施標準第48條第1項第2款暨職業安全衛生法第6條第1項,對於高度2公尺以上之工作場所，未訂定墜落災害防止計畫，依風險控制之先後順序規劃，並採取適當墜落災害防止設施；對於高度2公尺以上之開口部分等場所作業，未於該處設置護欄、護蓋或安全網等防護設備；為維持施工架之穩定，施工架未以斜撐材或其他相關設施作適當而充分之支撐；使勞工於高度2公尺以上施工架上從事作業時，工作臺寬度未在40公分以上並舖滿密接之踏板。,,黃信章(重傷)
職業安全衛生署,20240801,20240620,勞職授字第1130204873號,恆美地產股份有限公司吳任旺,職業安全衛生法第26條第1項,事業單位以其事業之全部或一部分交付承攬時，未於事前告知該承攬人有關其事業工作環境、危害因素暨本法及有關安全衛生規定應採取之措施。,,黃信章(重傷)
職業安全衛生署,20241209,20241028,勞職授字第1130206947A號,恆美地產股份有限公司吳任旺,職業安全衛生法第26條第1項,未於事前告知承攬人，對於其承攬工程之有關工作場所環境、危害因素暨職業安全衛生法及有關安全衛生規定應採取之措施。,,黃信章
職業安全衛生署,20241209,20241028,勞職授字第1130206947B號,恆美地產股份有限公司吳任旺,營造安全衛生設施標準第19條第1項暨職業安全衛生法第6條第1項,對於高度4.2公尺之2樓露台開口部分場所作業，未於該處設置護欄、護蓋或安全網等防護設備。,,黃信章
職業安全衛生署,20241209,20241028,勞職授字第1130206947號,恆美地產股份有限公司吳任旺,職業安全衛生法第27條第1項第1、2、3、4款,事業單位與承攬人分別僱用勞工共同作業時，為防止職業災害，原事業單位未採取下列必要措施：一、設立協議組織，並指定工作場所負責人，擔任指揮、監督及協調之工作。二、工作之連繫與調整。三、工作場所之巡視。四、相關承攬事業間之安全衛生教育之指導及協助……。,,黃信章
