主管機關,公告日期,處分日期,處分字號,事業單位名稱或負責人,違法法規法條,違反法規內容,罰鍰金額,備註說明
職業安全衛生署,20151215,20151119,勞職授字第1040203855號,悠活渡假事業股份有限公司,鍋爐及壓力容器安全規則第18條第1項第4款、職業安全衛生設施規則第268條暨職業安全衛生法第6條第1項,對於鍋爐房或鍋爐設置場所，未將鍋爐檢查合格證及鍋爐操作人員資格證件影本揭示於明顯處所;雇主對於600伏特以下之電氣設備前方，未有80公分以上之水平工作空間。,,
職業安全衛生署,20171011,20170724,勞職授字第1060203316號,悠活渡假事業股份有限公司甘錫瀅,職業安全衛生管理辦法第3條第1項暨職業安全衛生法第23條第1項之規定,事業單位未設置職業安全衛生業務主管及管理人員，本署於105年11月30日以勞職南5字第1051044293號函通知改善，嗣經本署於106年7月19日派員實施勞動檢查結果，發現有違反同一規定之情事。,,
勞動部勞工保險局,20211012,20210823,保退一字第11069911085號,悠活渡假事業股份有限公司曾忠正,勞工退休金條例第19條第1項,雇主未按時繳納勞工退休金致加徵滯納金。,227971,
屏東縣,20220908,20220708,屏府勞動資字第11126628800號,悠活渡假事業股份有限公司代表人曾忠正,勞動基準法第32條第2項,延長工作時間超過法令規定。,20000,
職業安全衛生署,20240205,20231113,勞職授字第1120205277A號,悠活渡假事業股份有限公司曾忠正,職業安全衛生法第37條第2項第3款,事業單位勞動場所發生災害之罹災人數在一人以上，且需住院治療之職業災害時，雇主未於8小時內通報勞動檢查機構。,,陳柏融
職業安全衛生署,20240205,20231113,勞職授字第1120205277號,悠活渡假事業股份有限公司曾忠正,職業安全衛生設施規則第21條暨職業安全衛生法第6條第1項,雇主對於勞工工作場所之工作台，未保持不致使勞工跌落之安全狀態。,,陳柏融
