主管機關,公告日期,處分日期,處分字號,事業單位名稱或負責人,違法法規法條,違反法規內容,罰鍰金額,備註說明
台北市,20181204,20181005,北市勞動字第10760400711號,拍手國際企業股份有限公司許善行,勞動基準法第30條第6項,出勤紀錄未逐日記載勞工出勤情形至分鐘為止,,
新北市,20191220,20191028,新北府勞檢字第10842808161號,拍手國際企業股份有限公司,勞動基準法第24條,延長工作時間未依規定加給工資,,
新北市,20191220,20191028,新北府勞檢字第1084280816號,拍手國際企業股份有限公司,勞動基準法第23條第2項,未依規定置備工資清冊,,
桃園市,20200506,20200306,109年府勞檢字1090046734號,拍手國際企業股份有限公司許善行,勞基法第24條第1項,延長工作時間未依規定加給工資,,
勞動部勞工保險局,20210412,20210224,保退一字第11069911025號,拍手國際企業股份有限公司許善行,勞工退休金條例第19條第1項,雇主未按時繳納勞工退休金致加徵滯納金。,519,
勞動部勞工保險局,20210610,20210422,保退一字第11069911045號,拍手國際企業股份有限公司許善行,勞工退休金條例第19條第1項,雇主未按時繳納勞工退休金致加徵滯納金。,201,
