主管機關,公告日期,處分日期,處分字號,事業單位名稱或負責人,違法法規法條,違反法規內容,罰鍰金額,備註說明
職業安全衛生署,20170420,20170218,勞職授字第1060200738號,振合營造事業股份有限公司,職業安全衛生設施規則第228條、營造安全衛生設施標準第5條、第40條第1項第1款、第135條第1項第3款暨職業安全衛生法第6條第1項,對於高差超過1.5公尺以上之場所作業時，未設置能使勞工安全上下之設備；對於工作場所暴露之鋼筋，未採取彎曲或加蓋等防護設施；對於高度5公尺以上施工架之構築即拆除，未事先就預期施工時之最大荷重，依結構力學原理妥為設計，置備施工圖說，並指派所僱之專任工程人員簽章確認強度計算書及施工圖說；可調鋼管支撐於調整高度時，未以制式之金屬附屬配件為之。,,
職業安全衛生署,20180126,20171013,勞職授字第1060204479號,振合營造事業股份有限公司,營造安全衛生設施標準第129條第9款暨職業安全衛生法第6條第1項,對於地面之暴露鋼筋，未採取彎曲、加蓋或加裝護套等防護設施。,,
職業安全衛生署,20200710,20200331,勞職授字第1090201313號,振合營造事業股份有限公司,營造安全衛生設施標準第8條第1款、第11條之1暨職業安全衛生法第6條第1項,對於工作場所周圍，未設適當之固定式圍籬，並於顯著位置裝設警告標示，及對於進入營繕工程工作場所作業人員，未提供適當安全帽，並使其正確戴用。,,
職業安全衛生署,20220201,20211111,勞職授字第1100205797號,振合營造事業股份有限公司,職業安全衛生設施規則第228條營造安全衛生設施標準第11條之1營造安全衛生設施標準第19條第1項營造安全衛生設施標準第59條第1項第4款暨職業安全衛生法第6條第1項,對於勞工於高差超過1.5公尺以上之場所作業時，未設置使勞工安全上下之設備；對於進入營繕工程工作場所作業人員，未提供適當安全帽，並使其正確戴用；對於高度2公尺以上之施工架開口部分場所作業，未於該處設置護欄、護蓋或安全網等防護設備；對於鋼管施工架構件之連接部分，未以適當之金屬附屬配件確實連接固定，,,
職業安全衛生署,20231210,20230927,勞職授字第1120204611號,振合營造事業股份有限公司李銘洲,營造安全衛生設施標準第71條暨職業安全衛生法第6條第1項,對於開挖垂直深度在1.5公尺以上之露天開挖作業，使勞工進入開挖面從事模板等作業時，未設擋土支撐或採取替代方法，經所僱之專任工程人員或委由相關執業技師簽認其安全性者。,,
