主管機關,公告日期,處分日期,處分字號,事業單位名稱或負責人,違法法規法條,違反法規內容,罰鍰金額,備註說明
台南市,20160710,20160624,府勞條字第1050598618號,振宇五金股份有限公司洪國展,勞動基準法第24條,延長工作時間未依規定加給工資;,,
台南市,20160910,20160819,府勞條字第1050852208號,振宇五金股份有限公司洪國展,勞動基準法第32條第2項,延長工作時間超過法令規定;,,
職業安全衛生署,20210706,20210304,勞職授字第1100200757號,振宇五金股份有限公司,職業安全衛生設施規則第227條第1項、第281條第1項暨職業安全衛生法第6條第1項,使勞工從事屋頂（具有採光罩）欲確認屋頂漏水之情形，屋頂距離地面高2公尺以上，具踏穿墜落危害，未設置適當強度且寬度在30公分以上之踏板，於屋架下方可能墜落之範圍，裝設堅固格柵或安全網等防墜設施，及指定屋頂作業主管指揮及監督該作業，並確實使用安全帶、安全帽等防護具，致發生職業安全衛生法第37條第2項之職業災害。,,
台中市,20221105,20220906,府授勞動字第1110229938號,振宇五金股份有限公司曾善,勞動基準法第22條第2項,未全額給付勞工工資,20000,
新北市,20231020,20220713,新北府勞業字第11104595741號,振宇五金股份有限公司曾善,性別平等工作法第13條第2項,雇主於知悉工作場所性騷擾之情形時，未採取立即有效之糾正及補救措施,,
新北市,20231020,20220713,新北府勞業字第1110459574號,振宇五金股份有限公司曾善,性別平等工作法第13條第1項,未訂定性騷擾防治措施、申訴及懲戒辦法，或未在工作場所公開揭示,,
