主管機關,公告日期,處分日期,處分字號,事業單位名稱或負責人,違法法規法條,違反法規內容,罰鍰金額,備註說明
台北市,20180201,20171218,北市勞動字第10639675100號,捌圓餐飲有限公司蕭郁蓉,勞動基準法第24條第1項;勞動基準法第24條第2項,延長工作時間未依規定加給工資;未依法給付休息日工作之工資,,
台北市,20180201,20171218,北市勞動字第10639675100號,捌圓餐飲有限公司蕭郁蓉,勞動基準法第24條第1項;勞動基準法第24條第2項,延長工作時間未依規定加給工資;未依法給付休息日工作之工資,,
台北市,20181106,20180910,北市勞動字第10760398041號,捌圓餐飲有限公司蕭郁蓉,勞動基準法第30條第6項,出勤紀錄未逐日記載勞工出勤情形至分鐘為止,,
台北市,20190401,20190201,北市勞動第10760409481號,捌圓餐飲有限公司蕭郁蓉,勞動基準法第22條第2項;勞動基準法第32條第1項;勞動基準法第39條;勞動基準法第49條第1項;勞動基準法第24條第1項;勞動基準法第36條第1項;勞動基準法第38條第1項,工資未全額給付給勞工;未經工會或勞資會議同意使勞工延長工時假日工資未給或於休假日工作未依規定加給工資;未經工會或勞資會議同意使女工於午後十時至翌晨六時之時間內工作;延長工作時間未依規定加給工資;未使勞工每7日中有2日之休息，其中1日為例假，1日為休息日;未依規定給予特別休假,,
桃園市,20190806,20190610,108年府勞檢字1080133573號,捌圓餐飲有限公司蕭郁蓉,勞基法第80條,拒絕、規避或阻撓勞工檢查員依法執行職務,,
桃園市,20190806,20190610,108年府勞檢字1080133573號,捌圓餐飲有限公司蕭郁蓉,勞基法第80條,拒絕、規避或阻撓勞工檢查員依法執行職務,,
