主管機關,公告日期,處分日期,處分字號,事業單位名稱或負責人,違法法規法條,違反法規內容,罰鍰金額,備註說明
新北市,20200622,20200407,新北府勞檢字第1094770506號,政崴企業有限公司,勞動基準法第30條第6項,出勤紀錄未依規定應逐日記載勞工出勤情形至分鐘,,
新北市,20220819,20220620,新北府勞檢字第11147490081號,政崴企業有限公司林淑花,勞動基準法第30條第6項,出勤紀錄未依規定應逐日記載勞工出勤情形至分鐘,40000,
新北市,20220819,20220620,新北府勞檢字第11147490081號,政崴企業有限公司林淑花,勞動基準法第30條第6項,出勤紀錄未依規定應逐日記載勞工出勤情形至分鐘,40000,
新北市,20220819,20220620,新北府勞檢字第1114749008號,政崴企業有限公司林淑花,勞動基準法第23條第2項,未依規定置備工資清冊,10000,
新北市,20220819,20220620,新北府勞檢字第1114749008號,政崴企業有限公司林淑花,勞動基準法第23條第2項,未依規定置備工資清冊,10000,
勞動部勞工保險局,20231211,20231026,保退一字第11269911105號,政崴企業有限公司林淑花,勞工退休金條例第19條第1項,雇主未按時繳納勞工退休金致加徵滯納金。,285,
