主管機關,公告日期,處分日期,處分字號,事業單位名稱或負責人,違法法規法條,違反法規內容,罰鍰金額,備註說明
雲林縣,20160705,20160506,府勞動一字第1053407491號,敕令金屬工業股份有限公司,勞基法第32條第2項;勞基法第36條,雇主延長勞工之工作時間連同正常工作時間1日超過12小時或1個月超過46小時;勞工每七日中未有一日例假,,
台北市,20170405,20170208,北市勞職字第10631071302號,敕令金屬工業股份有限公司,1.職業安全衛生設施規則第91條暨職業安全衛生法第6條第1項第1款。;2.職業安全衛生設施規則第281條第1項暨職業安全衛生法第6條第1項第5款。,1.對於起重機具之吊鉤或吊具，未設置為防止與吊架或捲揚胴接觸、碰撞，至少保持0.25公尺距離之過捲預防裝置。;2.僱用勞工於高度2公尺以上高處從事作業，勞工有墜落之虞，未使勞工確實使用安全帽、安全帶。,,
雲林縣,20160705,20160506,府勞動一字第1053407491號,敕令金屬工業股份有限公司,勞基法第32條第2項;勞基法第36條,雇主延長勞工之工作時間連同正常工作時間1日超過12小時或1個月超過46小時;勞工每七日中未有一日例假,,
台北市,20170405,20170208,北市勞職字第10631071302號,敕令金屬工業股份有限公司,1.職業安全衛生設施規則第91條暨職業安全衛生法第6條第1項第1款。;2.職業安全衛生設施規則第281條第1項暨職業安全衛生法第6條第1項第5款。,1.對於起重機具之吊鉤或吊具，未設置為防止與吊架或捲揚胴接觸、碰撞，至少保持0.25公尺距離之過捲預防裝置。;2.僱用勞工於高度2公尺以上高處從事作業，勞工有墜落之虞，未使勞工確實使用安全帽、安全帶。,,
雲林縣,20211025,20211007,110年府勞動一字1103424950號,敕令金屬工業股份有限公司陳啟釗,勞基法第23條第2項;勞基法第30條第5項,未備置出勤紀錄及未備工資清冊,110000,
