主管機關,公告日期,處分日期,處分字號,事業單位名稱或負責人,違法法規法條,違反法規內容,罰鍰金額,備註說明
職業安全衛生署,20190211,20181109,勞職授字第10702048612號,新燕企業股份有限公司,起重升降機具安全規則第63條第6款暨職業安全衛生法第6條第1項,"對於起重吊掛作業,吊掛人員在吊籃高舉時,未禁止以手碰觸吊籃,未確認荷物之懸掛有無傾斜、鬆脫等異狀。。",,
職業安全衛生署,20210602,20210317,勞職授字第1100201388號,新燕企業股份有限公司,職業安全衛生設施規則第43條第1項暨職業安全衛生法第6條第1項,對於機械之原動機、轉軸、齒輪、帶輪、飛輪、傳動輪、傳動帶等有危害勞工之虞之部分，未有護罩、護圍、套胴、跨橋等設備。,,
職業安全衛生署,20230508,20230223,勞職授字第11202011121號,新燕企業股份有限公司賴品撰,勞工作業環境監測實施辦法第8條第1項第2款暨職業安全衛生法第12條第3項,粉塵危害預防標準所稱之特定粉塵作業場所，未每六個月監測粉塵濃度一次以上。,,
職業安全衛生署,20230508,20230223,勞職授字第1120201112號,新燕企業股份有限公司賴品撰,粉塵危害預防標準第19條第1項第2款、第21條暨職業安全衛生法第6條第1項,使勞工從事粉塵作業時，預防粉塵危害之必要注意事項，未通告全體有關勞工。未公告粉塵作業場所禁止飲食或吸菸，並揭示於明顯易見之處所。,,
職業安全衛生署,20240108,20231018,勞職授字第1120204905號,新燕企業股份有限公司賴品撰,職業安全衛生設施規則第157條第1款暨職業安全衛生法第6條第1項,未禁止勞工搭乘於因車輛搖動致有墜落之虞之位置。,,
