主管機關,公告日期,處分日期,處分字號,事業單位名稱或負責人,違法法規法條,違反法規內容,罰鍰金額,備註說明
職業安全衛生署,20190805,20190503,勞職授字第1080201820號,新程發營造有限公司,營造安全衛生設施標準第19條第1項職業安全衛生設施規則第228條暨職業安全衛生法第6條第1項,對於高度二公尺以上之2樓板之樓梯口場所作業，未設置護欄、護蓋或安全網等防護設備；勞工於高差1.5公尺以上1樓樓梯場所作業，未設置使勞工安全上下之設備。,,
職業安全衛生署,20190805,20190521,勞職授字第10802019191號,新程發營造有限公司,職業安全衛生法第27條第1項第1、2、3、4款,與承攬人共同作業時，未設置協議組織並指定工作場所負責人擔任指揮、未監督及協調之工作、未採取工作連繫與調整之必要措施、未巡視工作場所、未指導及協助相關承攬事業間之安全衛生教育。,,
職業安全衛生署,20190805,20190521,勞職授字第1080201919號,新程發營造有限公司,職業安全衛生法第26條第1項,以其事業之全部或一部分交付承攬時，未於事前告知該承攬人有關其事業工作環境、危害因素暨本法及有關安全衛生規定應採取之措施。,,
職業安全衛生署,20190805,20190521,勞職授字第1080201975號,新程發營造有限公司,職業安全衛生設施規則第243條營造安全衛生設施標準第19條第1項暨職業安全衛生法第6條第1項,對於使用對地電壓在一百五十伏特以上移動式電動機具(泥漿攪拌器)，未依設置適合其規格，具有高敏感度、高速型，能確實動作之防止感電用漏電斷路器；對於高度二公尺以上之施工架(2、3樓樓板)，未設置護欄。,,
職業安全衛生署,20201208,20200924,勞職授字第1090204046號,新程發營造有限公司,營造安全衛生設施標準第19條第1項營造安全衛生設施標準第45條第3款營造安全衛生設施標準第59條第1款職業安全衛生設施規則第228條暨職業安全衛生法第6條第1項,對於高度2公尺以上之外牆施工架開口部分場所作業，未於該處設置護欄、護蓋或安全網等防護設備；對於設置之外牆施工架，未於垂直5.5公尺、水平7.5公尺內與穩定構造物妥實連接；使用國家標準CNS4750型式之施工架，未符合國家標準同等以上之規定；對於高差1.5公尺以上之外牆施工架場所作業，未設置使勞工安全上下之設備。,,
職業安全衛生署,20230907,20230612,勞職授字第1120202999號,新程發營造有限公司熊挺凱,營造安全衛生設施標準第19條第1項暨職業安全衛生法第6條第1項,對於高度2公尺以上之外牆施工架開口部分等場所作業，未該處設置護欄、護蓋或安全網等防護設備,,
職業安全衛生署,20240710,20240506,勞職授字第1130204025號,新程發營造有限公司熊挺凱,營造安全衛生設施標準第19條第1項營造安全衛生設施標準第45條第3款營造安全衛生設施標準第59條第1項第1款暨職業安全衛生法第6條第1項,對於高度2公尺以上之施工架開口部分、樓梯場所作業，未於該處設置護欄、護蓋或安全網等防護設備；施工架未在適當之垂直、水平距離處與構造物妥實連接；未使用國家標準CNS4750型式之施工架。,,王琮堯
職業安全衛生署,20240710,20240515,勞職授字第1130204422號,新程發營造有限公司熊挺凱,營造安全衛生設施標準第11條之1營造安全衛生設施標準第19條第1項營造安全衛生設施標準第59條第1項第1款職業安全衛生設施規則第228條暨職業安全衛生法第6條第1項,對於進入營繕工程工作場所作業人員，未提供適當安全帽，並使其正確戴用；對於高度2公尺以上之鋼構屋頂、外牆施工架開口部分等場所作業，未於該處設置護欄、護蓋或安全網等防護設備；使用國家標準CNS4750型式之施工架(附工作板橫架)，未符合國家標準同等以上之規定；對勞工於高差超過1.5公尺以上之外牆施工架場所作業時，未設置使勞工安全上下之設備,,沈純如
職業安全衛生署,20250508,20250326,勞職授字第1140251307號,新程發營造有限公司熊挺凱,違反營造安全衛生設施標準第11條之1暨職業安全衛生法第6條第1項,對於進入營繕工程工作場所作業人員，未提供適當安全帽，並使其正確戴用。,,王偉蒼
