主管機關,公告日期,處分日期,處分字號,事業單位名稱或負責人,違法法規法條,違反法規內容,罰鍰金額,備註說明
台北市,20160526,20160303,北市勞動字第10530233700號,施耐德電機股份有限公司孫基康,勞動基準法第24條;勞動基準法第30條第5項;勞動基準法第32條第1項;勞動基準法第32條第2項;勞動基準法第49條第1項,延長工作時間未依規定加給工資;未依規定置備勞工出勤紀錄;延長勞工工作時間未經工會或勞資會議同意;延長工作時間超過法令規定;未經工會或勞資會議同意使女性於午後10時至翌晨6時時間內工作,,
台北市,20160526,20160303,北市勞動字第10530233700號,施耐德電機股份有限公司孫基康,勞動基準法第24條;勞動基準法第30條第5項;勞動基準法第32條第1項;勞動基準法第32條第2項;勞動基準法第49條第1項,延長工作時間未依規定加給工資;未依規定置備勞工出勤紀錄;延長勞工工作時間未經工會或勞資會議同意;延長工作時間超過法令規定;未經工會或勞資會議同意使女性於午後10時至翌晨6時時間內工作,,
台北市,20200401,20200224,北市勞動字第10960083241號,施耐德電機股份有限公司毛莉莉MowLiLi,勞動基準法第30條第6項,出勤紀錄未逐日記載勞工出勤情形至分鐘為止,,勞動部108年度弱勢工作族群勞動條件專案
台北市,20220207,20211229,北市勞動字第11060864441號,施耐德電機股份有限公司張智斌TeohTzePing,勞動基準法第30條第6項;勞動基準法第32條第2項;勞動基準法第36條第1項,出勤紀錄未逐日記載勞工出勤情形至分鐘為止;延長工作時間超過法令規定;未使勞工每7日中有2日之休息，其中1日為例假，1日為休息日,140000,勞動部110年度多次違反勞動法令業者勞動條件專案
台北市,20220805,20220616,北市勞動字第11160280261號,施耐德電機股份有限公司張智斌TeohTzePing,勞動基準法第30條第6項,出勤紀錄未逐日記載勞工出勤情形至分鐘為止,300000,勞動部111年度違反勞動法令事業勞動條件專案
台北市,20230807,20230608,府勞動字第11260091121號,施耐德電機股份有限公司郭念慈,勞動基準法第30條第6項,出勤紀錄未逐日記載勞工出勤情形至分鐘為止,600000,勞動部112年度違反勞動法令事業勞動條件專案
職業安全衛生署,20241105,20240906,勞職授字第1130206145A號,施耐德電機股份有限公司郭念慈,職業安全衛生法第26條第2項,承攬人就其承攬之全部或一部分交付再承攬時，承攬人未於事前告知該承攬人有關其事業工作環境、危害因素暨本法及有關安全衛生規定應採取之措施。,,
