主管機關,公告日期,處分日期,處分字號,事業單位名稱或負責人,違法法規法條,違反法規內容,罰鍰金額,備註說明
職業安全衛生署,20170420,20170224,勞職授字第1060200746號,旭崴營造有限公司,營造安全衛生設施標準第19條第1項、營造安全衛生設施標準第5條暨職業安全衛生法第6條第1項,對於高度2公尺以上之施工架開口部分等場所作業，勞工有遭受墜落危險之虞，未設置護欄、護蓋或安全網等防護設備；工作場所暴露之鋼筋，未採取彎曲尖端、加蓋或加裝護套等防護設施。,,
職業安全衛生署,20170420,20170224,勞職授字第1060200856號,旭崴營造有限公司,營造安全衛生設施標準第19條第1項暨職業安全衛生法第6條第1項,對於高度2公尺以上之施工架開口部分等場所作業，勞工有遭受墜落危險之虞，未設置護欄、護蓋或安全網等防護設備。,,
職業安全衛生署,20170420,20170224,勞職授字第1060200746號,旭崴營造有限公司,營造安全衛生設施標準第19條第1項、營造安全衛生設施標準第5條暨職業安全衛生法第6條第1項,對於高度2公尺以上之施工架開口部分等場所作業，勞工有遭受墜落危險之虞，未設置護欄、護蓋或安全網等防護設備；工作場所暴露之鋼筋，未採取彎曲尖端、加蓋或加裝護套等防護設施。,,
職業安全衛生署,20170420,20170224,勞職授字第1060200856號,旭崴營造有限公司,營造安全衛生設施標準第19條第1項暨職業安全衛生法第6條第1項,對於高度2公尺以上之施工架開口部分等場所作業，勞工有遭受墜落危險之虞，未設置護欄、護蓋或安全網等防護設備。,,
職業安全衛生署,20221101,20220826,勞職授字第11102049631號,旭崴營造有限公司陳江山,職業安全衛生法第27條第1項第1、2、3、4款,事業單位與承攬人分別僱用勞工共同作業時，為防止職業災害，原事業單位應採取下列必要措施：一、設立協議組織，並指定工作場所負責人，擔任指揮、監督及協調之工作。二、工作之連繫與調整。三、工作場所之巡視。四、相關承攬事業間之安全衛生教育之指導及協助。……。,,
職業安全衛生署,20221101,20220826,勞職授字第11102049632號,旭崴營造有限公司陳江山,營造安全衛生設施標準第19條第1項職業安全衛生設施規則第21條暨職業安全衛生法第6條第1項,對於高度2.5公尺之樓梯開口部分場所作業，未於該處設置護欄、護蓋或安全網等防護設備；對於勞工工作場所之坡道、階梯或其他勞工踩踏場所，未保持不致使勞工跌倒、滑倒、踩傷、滾落等之安全狀態，或採取必要之預防措施,,
職業安全衛生署,20221101,20220826,勞職授字第1110204963號,旭崴營造有限公司陳江山,職業安全衛生法第26條第1項,事業單位以其事業之全部或一部分交付承攬時，應於事前告知該承攬人有關其事業工作環境、危害因素暨本法及有關安全衛生規定應採取之措施,,
職業安全衛生署,20241009,20240820,勞職授字第1130205925號,旭崴營造有限公司陳江山,營造安全衛生設施標準第5條營造安全衛生設施標準第11條之1營造安全衛生設施標準第19條第1項暨職業安全衛生法第6條第1項,對於工作場所暴露之鋼筋，未採取彎曲尖端、加蓋或加裝護套等防護設施；對於進入營繕工程工作場所作業人員，未提供適當安全帽，並使其正確戴用；對於高度2公尺以上之外牆施工架開口部分等場所作業，未於該處設置護欄、護蓋或安全網等防護設備,,吳朝琴
職業安全衛生署,20250407,20250226,勞職授字第1140250809號,旭崴營造有限公司陳江山,營造安全衛生設施標準第11條之1營造安全衛生設施標準第19條第1項職業安全衛生設施規則第21條暨職業安全衛生法第6條第1項,對於進入營繕工程工作場所作業人員，未提供適當安全帽，並使其正確戴用；對於高度2公尺以上之外牆施工架開口部分場所作業，未於該處設置護欄、護蓋或安全網等防護設備；對於勞工工作場所之工作台(由合梯與木板組成)，未保持不致使勞工跌倒、滑倒、滾落等之安全狀態(合梯與木板應綁紮固定、板端應突出支撐點),,郭瑞宗
