主管機關,公告日期,處分日期,處分字號,事業單位名稱或負責人,違法法規法條,違反法規內容,罰鍰金額,備註說明
台北市,20180201,20171215,北市勞動字第10639671400號,旭順食品股份有限公司于蕊嘉,勞動基準法第22條第2項;勞動基準法第39條,工資未全額給付給勞工;假日工資未給或於休假日工作未依規定加給工資,,
台北市,20190703,20190501,北市勞動字第10860099881號,旭順食品股份有限公司于蕊嘉,勞動基準法第22條第2項,工資未全額給付給勞工,,
台南市,20191008,20190916,南市勞安字第1081042988號,旭順食品股份有限公司于蕊嘉,勞動基準法第23條第1項;勞動基準法第38條第4項,工資未定期給付勞工;未依規定給予特別休假。,,
勞動部勞工保險局,20231211,20231002,保退三字第11260164881號,旭順食品股份有限公司于蕊嘉,勞工退休金條例第15條第2項,雇主未依規定覈實申報調整勞工退休金提繳工資。,5000,
新北市,20231020,20230814,新北府勞檢字第1124675079號,旭順食品股份有限公司于蕊嘉,勞動基準法第22條第2項,工資未全額直接給付勞工,20000,
高雄市,20231109,20230920,高市勞條字第11237138000號,旭順食品股份有限公司于蕊嘉,勞動基準法第22條第2項,工資未全額直接給付勞工。,20000,
