主管機關,公告日期,處分日期,處分字號,事業單位名稱或負責人,違法法規法條,違反法規內容,罰鍰金額,備註說明
職業安全衛生署,20210309,20201228,勞職授字第1090205777號,明鈴營造有限公司,職業安全衛生設施規則第228條、第281條第1項暨職業安全衛生法第6條第1項,"對勞工於高差超過一．五公尺以上之場所作業時,未設置能使勞工安全上下之設備;對於在高度二公尺以上之高處作業,勞工有墜落之虞者,未使勞工確實使用安全帶、安全帽及其他必要之防護具。",,
職業安全衛生署,20230808,20230509,勞職授字第1120202432號,明鈴營造有限公司丁大明,營造安全衛生設施標準第11條之1暨職業安全衛生法第6條第1項,對於進入營繕工程工作場所作業人員，未提供適當安全帽，並使其正確戴用。,,
勞動部勞工保險局,20240410,20240226,保退一字第11369911025號,明鈴營造有限公司丁大明,勞工退休金條例第19條第1項,雇主未按時繳納勞工退休金致加徵滯納金。,1048,
台北市,20241205,20241017,北市勞職字第11360956181號,明鈴營造有限公司丁大明,職業安全衛生法第27條第1項第1款、第2款、第3款,原事業單位未採取承攬管理必要措施。,,
台北市,20241205,20241029,北市勞職字第11360976401號,明鈴營造有限公司丁大明,營造安全衛生設施標準第19條第1項暨職業安全衛生法第6條第1項第13款,有墜落危險之處所未設防護設備。,,
