主管機關,公告日期,處分日期,處分字號,事業單位名稱或負責人,違法法規法條,違反法規內容,罰鍰金額,備註說明
職業安全衛生署,20170110,20161116,勞職授字第1050204262號,昱程營造有限公司,職業安全衛生法第27條第1項,與承攬人、再承攬人分別僱用勞工共同從事作業時，未確實實施工作場所之巡視；未指導與協助相關承攬事業間之安全衛生教育訓練。,,
職業安全衛生署,20170930,20170601,勞職授字第1060202369號,昱程營造有限公司,職業安全衛生設施規則第225條第1項、第228條及營造安全衛生設施標準第19條第1項暨職業安全衛生法第6條第1項,於距地面高度2公尺以上之施工圍籬拆除作業，勞工有墜落之虞者，未以架設施工架或其他方法設置工作台；對於1樓大廳距地高度1.5公尺以上之施工架工作台，未設置使勞工安全上下之設備；高度2公尺以上之開口邊緣，勞工有遭受墜落危險之虞，未設置護欄、護蓋或安全網等防護設備。,,
職業安全衛生署,20170110,20161116,勞職授字第1050204262號,昱程營造有限公司,職業安全衛生法第27條第1項,與承攬人、再承攬人分別僱用勞工共同從事作業時，未確實實施工作場所之巡視；未指導與協助相關承攬事業間之安全衛生教育訓練。,,
職業安全衛生署,20170930,20170601,勞職授字第1060202369號,昱程營造有限公司,職業安全衛生設施規則第225條第1項、第228條及營造安全衛生設施標準第19條第1項暨職業安全衛生法第6條第1項,於距地面高度2公尺以上之施工圍籬拆除作業，勞工有墜落之虞者，未以架設施工架或其他方法設置工作台；對於1樓大廳距地高度1.5公尺以上之施工架工作台，未設置使勞工安全上下之設備；高度2公尺以上之開口邊緣，勞工有遭受墜落危險之虞，未設置護欄、護蓋或安全網等防護設備。,,
新北市,20250421,20250122,新北府勞檢字第1144661700號,昱程營造有限公司連家慶,職業安全衛生法第6條第1項,未符合規定之必要安全衛生設備及措施,,
