主管機關,公告日期,處分日期,處分字號,事業單位名稱或負責人,違法法規法條,違反法規內容,罰鍰金額,備註說明
桃園市,20180709,20180531,107年府勞條字1070129277號,景山貨櫃股份有限公司盧廷景,勞基法第36條第1項,每七日中未有二日之休息作為例假及休息日,,
高雄市,20190130,20181203,高市勞條字第10739298900號,景山貨櫃股份有限公司盧廷景,勞動基準法第32條第2項;勞動基準法第34條第2項,延長工作時間超過法令規定;晝夜輪班制更換工作班次未依規定給予休息,,
勞動部勞工保險局,20220610,20220426,保退三字第11110100202號,景山貨櫃股份有限公司盧廷景,勞工退休金條例第15條第2項,雇主未依規定覈實申報調整勞工退休金提繳工資。,5000,
高雄市,20221208,20221025,高市勞條字第11137833800號,景山貨櫃股份有限公司盧廷景,勞動基準法第34條第2項;勞動基準法第36條,晝夜輪班制更換工作班次未依規定給予休息;每七日中未有一日之休息作為例假,40000,
高雄市,20231109,20230911,高市勞條字第11236943400號,景山貨櫃股份有限公司盧廷景,勞動基準法第36條;勞動基準法第38條,每七日中未有一日之休息作為例假;未依規定給予特別休假。,60000,
