主管機關,公告日期,處分日期,處分字號,事業單位名稱或負責人,違法法規法條,違反法規內容,罰鍰金額,備註說明
勞動部勞工保險局,20231011,20230814,保退二字第11260109421號,曜泓國際有限公司廖佳琦,勞工退休金條例第15條第2項,雇主未依規定覈實申報調整勞工退休金提繳工資。,5000,
新北市,20231215,20230922,新北府勞檢字第11246802221號,曜泓國際有限公司廖佳琦,勞動基準法第38條第4項,勞工之特別休假，因年度終結或契約終止而未休之日數，雇主應發給工資,20000,
新北市,20231215,20230922,新北府勞檢字第11246802221號,曜泓國際有限公司廖佳琦,勞動基準法第38條第4項,勞工之特別休假，因年度終結或契約終止而未休之日數，雇主應發給工資,20000,
新北市,20231215,20230922,新北府勞檢字第1124680222號,曜泓國際有限公司廖佳琦,勞動基準法第30條第5項,未依規定置備勞工出勤紀錄表,90000,
新北市,20231215,20230922,新北府勞檢字第1124680222號,曜泓國際有限公司廖佳琦,勞動基準法第30條第5項,未依規定置備勞工出勤紀錄表,90000,
