主管機關,公告日期,處分日期,處分字號,事業單位名稱或負責人,違法法規法條,違反法規內容,罰鍰金額,備註說明
職業安全衛生署,20180704,20180417,勞職授字第1070201518號,朝盛鋼鐵有限公司,職業安全衛生法第16條第1項,對於中央主管機關指定具有危險性機械或設備，未經檢查合格不得使用。,,
職業安全衛生署,20180704,20180417,勞職授字第1070201522號,朝盛鋼鐵有限公司,職業安全衛生法第24條,吊升荷重3公噸以上之固定式起重機，未僱用經中央主管機關認可之訓練或經技能檢定之合格人員充任之,,
職業安全衛生署,20180704,20180417,勞職授字第1070201523號,朝盛鋼鐵有限公司,職業安全衛生設施規則第90條暨職業安全衛生法第6條第1項之規定,固定式起重機吊鉤未有防止吊舉中所吊物體脫落之裝置,,
職業安全衛生署,20200207,20191121,勞職授字第1080204930號,朝盛鋼鐵有限公司,機械設備器具安全標準第84條暨職業安全衛生法第6條第1項,配衡型堆高機及側舉型堆高機之駕駛座，未配置防止車輛傾倒時，駕駛者被堆高機壓傷之安全帶、護欄或其他防護設施。,,
職業安全衛生署,20220601,20220314,勞職授字第11102012331號,朝盛鋼鐵有限公司蔡朝養,職業安全衛生設施規則第90條職業安全衛生法第6條第1項,對於起重機具之吊鉤或吊具，未有防止吊舉中所吊物體脫落之裝置。,,
職業安全衛生署,20220601,20220314,勞職授字第1110201233號,朝盛鋼鐵有限公司蔡朝養,職業安全衛生法第16條第1項,對於經中央主管機關指定具有危險性之機械或設備，未經勞動檢查機構或中央主管機關指定之代行檢查機構檢查合格即使用。,,
職業安全衛生署,20230410,20230216,勞職授字11202009121號,朝盛鋼鐵有限公司蔡寶珠,職業安全衛生法第24條,越南籍移工陳OO未經中央主管機關認可之訓練或經技能檢定，即操作3公噸以上固定式起重機（編號：213FL01744）。,,
職業安全衛生署,20230410,20230216,勞職授字1120200912號,朝盛鋼鐵有限公司蔡寶珠,職業安全衛生設施規則第90條暨職業安全衛生法第6條第1項,雇主對於起重機具之吊鉤或吊具未有防止吊舉中所吊物體脫落之裝置（3座固定式起重機及2座移動式起重機其防止吊舉中所吊物體脫落之裝置以鐵絲固定使其失原有功能）。,,
