主管機關,公告日期,處分日期,處分字號,事業單位名稱或負責人,違法法規法條,違反法規內容,罰鍰金額,備註說明
台北市,20180302,20180126,北市勞動字第10639740600號,東京都環保服務股份有限公司吉田裕幸,勞動基準法第32條第2項;勞動基準法第37條;勞動基準法第24條第1項;勞動基準法第24條第2項;勞動基準法第38條第4項,延長工作時間超過法令規定;依規定應放假之日未予休假;延長工作時間未依規定加給工資;未依法給付休息日工作之工資;勞工之特別休假，因年度終結或契約終止而未休之日數，雇主未發給工資,,第一審行政訴訟，原告之訴駁回(原處分維持)
台北市,20181003,20180830,北市勞動字第10760394931號,東京都環保服務股份有限公司吉田裕幸,勞動基準法第22條第2項,工資未全額給付給勞工,,訴願駁回
台北市,20181106,20180926,北市勞動字第10760397421號,東京都環保服務股份有限公司吉田裕幸,勞動基準法第30條第5項,未依規定置備勞工出勤紀錄,,訴願駁回
台北市,20180302,20180126,北市勞動字第10639740600號,東京都環保服務股份有限公司吉田裕幸,勞動基準法第32條第2項;勞動基準法第37條;勞動基準法第24條第1項;勞動基準法第24條第2項;勞動基準法第38條第4項,延長工作時間超過法令規定;依規定應放假之日未予休假;延長工作時間未依規定加給工資;未依法給付休息日工作之工資;勞工之特別休假，因年度終結或契約終止而未休之日數，雇主未發給工資,,第一審行政訴訟，原告之訴駁回(原處分維持)
台北市,20181003,20180830,北市勞動字第10760394931號,東京都環保服務股份有限公司吉田裕幸,勞動基準法第22條第2項,工資未全額給付給勞工,,訴願駁回
台北市,20181106,20180926,北市勞動字第10760397421號,東京都環保服務股份有限公司吉田裕幸,勞動基準法第30條第5項,未依規定置備勞工出勤紀錄,,訴願駁回
台北市,20190401,20190218,北市勞動第10760409351號,東京都環保服務股份有限公司吉田裕幸,勞動基準法第16條第3項;勞動基準法第38條第4項,未依法給付預告期間之工資;勞工之特別休假，因年度終結或契約終止而未休之日數，雇主未發給工資,,訴願駁回
台北市,20220406,20220224,北市勞動字第11160040921號,東京都環保服務股份有限公司奥田実,勞動基準法第39條;勞動基準法第24條第2項,假日工資未給或於休假日工作未依規定加給工資;未依法給付休息日工作之工資,70000,
