主管機關,公告日期,處分日期,處分字號,事業單位名稱或負責人,違法法規法條,違反法規內容,罰鍰金額,備註說明
桃園市,20170911,20170728,府勞檢字第10601795973號,東宥工程有限公司鄭家宜,起重升降機具安全規則第35條第2項第2款暨職業安全衛生法第6條第1項,雇主對於前項但書所定防止墜落措施，應辦理事項如下：一、…。二、使勞工佩戴安全帶或安全索。三、…。,,
職業安全衛生署,20171121,20170821,勞職授字第1060203670號,東宥工程有限公司,起重升降機具安全規則第30條暨職業安全衛生法第6條第1項,對於移動式起重機在其作業範圍有地盤軟弱等情形，致其有翻倒之虞者，未依規定，不得使用移動式起重機從事作業或在使用起重機下方鋪設具有充分強度及足夠面積之鐵板或墊料等，可防止其翻倒者。,,
桃園市,20170911,20170728,府勞檢字第10601795973號,東宥工程有限公司鄭家宜,起重升降機具安全規則第35條第2項第2款暨職業安全衛生法第6條第1項,雇主對於前項但書所定防止墜落措施，應辦理事項如下：一、…。二、使勞工佩戴安全帶或安全索。三、…。,,
職業安全衛生署,20171121,20170821,勞職授字第1060203670號,東宥工程有限公司,起重升降機具安全規則第30條暨職業安全衛生法第6條第1項,對於移動式起重機在其作業範圍有地盤軟弱等情形，致其有翻倒之虞者，未依規定，不得使用移動式起重機從事作業或在使用起重機下方鋪設具有充分強度及足夠面積之鐵板或墊料等，可防止其翻倒者。,,
勞動部勞工保險局,20201012,20200821,保退一字第10969911085號,東宥工程有限公司鄭家妘,勞工退休金條例第19條第1項,雇主未按時繳納勞工退休金致加徵滯納金。,9575,
