主管機關,公告日期,處分日期,處分字號,事業單位名稱或負責人,違法法規法條,違反法規內容,罰鍰金額,備註說明
桃園市,20160206,20160125,105年府勞條字1050009387號,東億物流有限公司萱野勝重,勞基法第24條,延長工作時間未依規定加給工資,,
職業安全衛生署,20160421,20160302,勞職授字第1050200666號,東億物流有限公司,職業安全衛生設施規則第43條第1項、第243條第1項及機械設備器具安全標準第118條暨職業安全衛生法第6條第1項,使用對地電壓在220伏特之切割研磨機，未於帶輪下緣裝設護罩，未裝設漏電斷路器，未清楚標示有關事項(製造年月、無負荷回轉速率、適用之研磨輪之直徑、厚度及孔徑、研磨輪之回轉方向、護罩適用之研磨輪之最高使用周速度、厚度、直徑)。,,
桃園市,20160206,20160125,105年府勞條字1050009387號,東億物流有限公司萱野勝重,勞基法第24條,延長工作時間未依規定加給工資,,
職業安全衛生署,20160421,20160302,勞職授字第1050200666號,東億物流有限公司,職業安全衛生設施規則第43條第1項、第243條第1項及機械設備器具安全標準第118條暨職業安全衛生法第6條第1項,使用對地電壓在220伏特之切割研磨機，未於帶輪下緣裝設護罩，未裝設漏電斷路器，未清楚標示有關事項(製造年月、無負荷回轉速率、適用之研磨輪之直徑、厚度及孔徑、研磨輪之回轉方向、護罩適用之研磨輪之最高使用周速度、厚度、直徑)。,,
桃園市,20190110,20181121,府勞檢字第1070288347號,東億物流有限公司萱野勝重,職業安全衛生設施規則第90條暨職業安全衛生法第6條第1項,雇主對於起重機具之吊鉤或吊具，應有防止吊舉中所吊物體脫落之裝置。,,
