主管機關,公告日期,處分日期,處分字號,事業單位名稱或負責人,違法法規法條,違反法規內容,罰鍰金額,備註說明
宜蘭縣,20170110,20161216,府勞資字第1050177980號,東和食品工業股份有限公司,勞基法第39條,休假日工作工資未加倍發給,,
宜蘭縣,20180307,20180102,府勞資字第1060197138號,東和食品工業股份有限公司,勞動基準法第32條第2項,延長工時超過法定上限,,
宜蘭縣,20180509,20180331,府勞資字第1070036869號,東和食品工業股份有限公司,勞動基準法第32條第2項,延長工時超過法定上限,,
宜蘭縣,20190110,20181122,府勞資字第1070166983號,東和食品工業股份有限公司,勞動基準法第24條;勞動基準法第32條第2項;勞動基準法第36條第1項,延長工作時間未依規定加給工資;延長工時超過法定上限;違反每七日中至少應有二日之休息,,
職業安全衛生署,20180808,20180502,勞職授字第1070201217號,東和食品工業股份有限公司,職業安全衛生設施規則第90條;機械設備器具安全標準第76條暨職業安全衛生法第6條第1項,設置之固定式起重機之吊鉤未有防止吊舉物脫落之裝置;堆高機之方向指示燈損壞。,,
職業安全衛生署,20181210,20180925,勞職授字第1070204573號,東和食品工業股份有限公司,職業安全衛生管理辦法第12條之2第1項暨職業安全衛生法第23條第2項,"未建立職業安全衛生管理系統,經通知限期改善,屆期未改善。",,
勞動部勞工保險局,20210910,20210705,保退三字第11060080370號,東和食品工業股份有限公司吳天賜,勞工退休金條例第15條第2項,雇主未依規定覈實申報調整勞工退休金提繳工資。,5000,
