主管機關,公告日期,處分日期,處分字號,事業單位名稱或負責人,違法法規法條,違反法規內容,罰鍰金額,備註說明
職業安全衛生署,20170313,20170103,勞職授字第1050204772號,東億工程股份有限公司,職業安全衛生設施規則第281條第2項暨職業安全衛生法第6條第1項,對於高度2公尺以上之施工架工作臺從事拆架作業，勞工有遭受墜落危險之虞，未採取使勞工確實使用背負式安全帶及捲揚式防墜器等防止墜落。,,
台北市,20190102,20181015,北市勞職字第10760811963號,東億工程股份有限公司,營造安全衛生設施標準第19條第1項暨職業安全衛生法第6條第1項第5款,有墜落危險之處所未設防護設備。,,
職業安全衛生署,20190308,20181219,勞職授字第1070205650號,東億工程股份有限公司,營造安全衛生設施標準第40條第1項暨職業安全衛生法第6條第1項,"對於拆除工程其所設施工架,未置備施工圖說。",,
職業安全衛生署,20200512,20200203,勞職授字第1090200308號,東億工程股份有限公司,營造安全衛生設施標準第40條暨職業安全衛生法第6條第1項,對於高度5公尺以上之施工架之構築，未建立按施工圖說施作之查驗機制(現場構築與經簽認之圖說不符)，有變更設計時，其強度計算書及施工圖說未重新製作。,,
職業安全衛生署,20220808,20220606,勞職授字第11102029521號,東億工程股份有限公司許蓮池,缺氧症預防規則第27條暨職業安全衛生法第6條第1項,使勞工從事缺氧危險作業時，未置備空氣呼吸器等呼吸防護具、梯子、安全帶或救生索等設備，供勞工緊急避難或救援人員使用。,,
職業安全衛生署,20240905,20240708,勞職授字第1130205147號,東億工程股份有限公司許蓮池,職業安全衛生法第37條第1項、第2項,勞動場所發生罹災人數在1人以上，且需住院治療之職業災害，未於8小時內通報勞動檢查機構，亦未將工作場所發生職業災害實施調查、分析及作成紀錄。,,
