主管機關,公告日期,處分日期,處分字號,事業單位名稱或負責人,違法法規法條,違反法規內容,罰鍰金額,備註說明
台北市,20210401,20210104,北市勞職字第10961258683號,王東南即東揚工程行,職業安全衛生法第6條第1項+營造安全衛生設施標準第11-1條,未提供安全帽使正確戴用。,,
台北市,20210401,20210111,北市勞職字第10961258943號,王東南即東揚工程行,職業安全衛生法第6條第1項+職業安全衛生設施規則第230條第1項,合梯未符合規定。,,
台北市,20210604,20210318,北市勞職字第11060573355號,王東南即東揚工程行,職業安全衛生法第6條第1項+營造安全衛生設施標準第11-1條,未提供安全帽使正確戴用。,,
台北市,20211203,20210901,北市勞職字第11060944883號,王東南即東揚工程行,營造安全衛生設施標準第11-1條暨職業安全衛生法第6條第1項第1、3、5款,未提供安全帽使正確戴用。,,
台北市,20230206,20221207,北市勞職字第11161183993號,王東南即東揚工程行,營造安全衛生設施標準第133條第1項第1款、第2款、第3款、第4款、第5款暨職業安全衛生法第6條第1項,模板支撐作業未指派作業主管辦理規定事項。,,
新北市,20220617,20220330,新北府勞檢字第1114738940號,王東南即東揚工程行,職業安全衛生法第6條第1項,未符合規定之必要安全衛生設備及措施,,
新北市,20240621,20230525,新北府勞檢字第1124665619號,王東南即東揚工程行,勞動基準法第59條,未依規定給與職業災害補償,20000,
