主管機關,公告日期,處分日期,處分字號,事業單位名稱或負責人,違法法規法條,違反法規內容,罰鍰金額,備註說明
台北市,20181204,20181008,北市勞動字第10760398361號,東聯化學股份有限公司徐旭東,勞動基準法第32條第1項,未經工會或勞資會議同意使勞工延長工時,,勞動部107年度指定適用勞動基準法例假等彈性放寬之行業專案
台北市,20181204,20181008,北市勞動字第10760398361號,東聯化學股份有限公司徐旭東,勞動基準法第32條第1項,未經工會或勞資會議同意使勞工延長工時,,勞動部107年度指定適用勞動基準法例假等彈性放寬之行業專案
高雄市,20211102,20210416,高市勞檢字第11070695000號,東聯化學股份有限公司,職業安全衛生法第6條第1項第3款,對於化學設備及其附屬設備，為防止因爆炸、火災、洩漏等造成勞工之危害，未保持溫度計、壓力計或其他計測裝置於正常操作功能；高壓氣體之貯存，未安穩置放並加固定及裝妥護蓋。,,
高雄市,20211102,20210428,高市勞檢字第11070784400號,東聯化學股份有限公司,職業安全衛生法第6條第1項第1款,工場防爆阻止盒、接線盒多處失效；抗泡劑輸送管未有旋塞；氮氣管線標示脫落，無法辨識。,,
高雄市,20240416,20240220,高市勞檢字第11370304400號,東聯化學股份有限公司徐旭東,職業安全衛生法第6條第1項第3、6、13款,對於氣體工場工作梯梯面寬度不足，固定梯梯腳斷裂，且液氧蒸發補出器管線壓力錶故障，高壓氣體鋼瓶儲放區周圍置放雜物，反應區RTO爐及氯乙烷鋼瓶儲存區之防爆電氣設備失效；另於EOG工場環氧乙烷儲槽未塗以紅色字體說明儲槽內氣體名稱，P-406及408馬達之接地線未確實。,,
高雄市,20250210,20241203,高市勞檢字第11372233100號,東聯化學股份有限公司徐旭東,職業安全衛生法第6條第1項第5款,對勞工於高差超過1.5公尺以上之場所從事排水溝清溝作業，未設置適當安全上下之設備。,,
