主管機關,公告日期,處分日期,處分字號,事業單位名稱或負責人,違法法規法條,違反法規內容,罰鍰金額,備註說明
台北市,20180615,20180419,北市勞職字第10732322902號,柏固工程有限公司,職業安全衛生設施規則第41條第5款暨職業安全衛生法第6條第1項第1款。,對於使用研磨機未有安全防護設備。,,
台北市,20181001,20180704,北市勞職字第10760184293號,柏固工程有限公司,營造安全衛生設施標準第133條第1項第1、2、3、4、5款暨職業安全衛生法第6條第1項第5款,模板支撐作業未指派作業主管辦理規定事項。,,
台北市,20221005,20220804,北市勞職字第11160789363號,柏固工程有限公司黃柏燁,營造安全衛生設施標準第11-1條暨職業安全衛生法第6條第1項第1、3、5款,未提供安全帽使正確戴用。,,
台北市,20221205,20221021,北市勞職字第11161084923號,柏固工程有限公司黃柏燁,營造安全衛生設施標準第11-1條暨職業安全衛生法第6條第1項第1、3、5款;職業安全衛生設施規則第230條第2項暨職業安全衛生法第6條1項第5款,未提供安全帽使正確戴用。;合梯作為上下設備、站立於頂板作業。,,
台北市,20230206,20221227,北市勞職字第11161209351號,柏固工程有限公司黃柏燁,營造安全衛生設施標準第46條第1項第2款暨職業安全衛生法第6條第1項第5款,施工架上物料運送、儲存及荷重分配未依規定辦理。,,
台北市,20230405,20230202,府勞職字第11260524461號,柏固工程有限公司黃柏燁,職業安全衛生設施規則第41條第3款暨職業安全衛生法第6條第1項第1款,堆高機、研磨機等機具未依規定辦理。,,
台北市,20230405,20230218,府勞職字第11260540041號,柏固工程有限公司黃柏燁,職業安全衛生設施規則第43條第1項暨職業安全衛生法第6條第1項第1款,機械傳動裝置未設護罩等設備。,,
