主管機關,公告日期,處分日期,處分字號,事業單位名稱或負責人,違法法規法條,違反法規內容,罰鍰金額,備註說明
新北市,20160823,20150714,新北府勞檢字第10430624881號,棉品實業股份有限公司,勞動基準法第32條第2項,延長工作時間超過法令規定,,
新北市,20160823,20150714,新北府勞檢字第1043062488號,棉品實業股份有限公司,勞動基準法第24條,延長工作時間未依規定加給工資,,
新北市,20171215,20161226,新北府勞檢字第1053474328號,棉品實業股份有限公司,勞動基準法第24條,延長工作時間未依規定加給工資,,
新北市,20170817,20170519,新北府勞檢字第1063566850號,棉品實業股份有限公司,勞動基準法第37條,依規定應放假之日未予休假,,
桃園市,20210708,20210512,110年府勞檢字11001115801號,棉品實業股份有限公司洪清峯,勞基法第24條第1項,延長工作時間超過法令規定,20000,
桃園市,20210708,20210512,110年府勞檢字11001115802號,棉品實業股份有限公司洪清峯,勞基法第38條第4項,未發給因年度終結或契約終止特休未休日數之工資,20000,
桃園市,20210708,20210512,110年府勞檢字1100111580號,棉品實業股份有限公司洪清峯,勞基法第23條第1項,延長工作時間超過法令規定,20000,
