主管機關,公告日期,處分日期,處分字號,事業單位名稱或負責人,違法法規法條,違反法規內容,罰鍰金額,備註說明
桃園市,20190305,20181221,府勞條字第1070318507號,橡樹工業材料股份有限公司田嶋達也,性別工作平等法第13條第2項,職場性騷擾防治,,無
桃園市,20200207,20191223,108年府勞檢字1080320866號,橡樹工業材料股份有限公司田嶋達也TatsuyaTajima,勞基法第55條第3項,雇主未依法定之期限發給勞工退休金,,
桃園市,20201117,20200930,府勞檢字第1090248646號,橡樹工業材料股份有限公司権藤義宣,職業安全衛生設施規則第57條第3項暨職業安全衛生法第6條第1項,第一項工作必須在運轉狀態下施行者，雇主應於危險之部分設置護罩、護圍等安全設施或使用不致危及勞工身體之足夠長度之作業用具。對連續送料生產機組等，其部分單元停機有困難，且危險部分無法設置護罩或護圍者，雇主應設置具有安全機能設計之裝置，或採取必要安全措施及書面確認作業方式之安全性，並指派現場主管在場監督。,,
桃園市,20211006,20210809,110年府勞檢字1100198050號,橡樹工業材料股份有限公司権藤義宣,勞基法第43條,雇主未核給勞工婚假、喪假、公傷、病假或事假等應給之假期或假期內應給付之工資,20000,
桃園市,20221206,20221007,111年府勞條字1110266431號,橡樹工業材料股份有限公司権藤義宣,勞基法第32條第2項,延長工作時間超過法令規定,50000,
