主管機關,公告日期,處分日期,處分字號,事業單位名稱或負責人,違法法規法條,違反法規內容,罰鍰金額,備註說明
台北市,20181001,20180709,北市勞職字第10760391721號,欣豐設計有限公司,職業安全衛生法第27條第1項第1、2、3款,原事業單位未採取承攬管理必要措施。,,
台北市,20191105,20190830,北市勞職字第10860817131號,欣豐設計有限公司,職業安全衛生法第27條第1項第1、2、3款,原事業單位未採取承攬管理必要措施。,,
台北市,20181001,20180709,北市勞職字第10760391721號,欣豐設計有限公司,職業安全衛生法第27條第1項第1、2、3款,原事業單位未採取承攬管理必要措施。,,
台北市,20191105,20190830,北市勞職字第10860817131號,欣豐設計有限公司,職業安全衛生法第27條第1項第1、2、3款,原事業單位未採取承攬管理必要措施。,,
新北市,20250421,20250224,新北府勞檢字第11446650001號,欣豐設計有限公司陳韋志,勞動基準法第32條第2項,延長工作時間超過法令規定,20000,
新北市,20250421,20250224,新北府勞檢字第1144665000號,欣豐設計有限公司陳韋志,勞動基準法第24條,延長工作時間未依規定加給工資,20000,
