主管機關,公告日期,處分日期,處分字號,事業單位名稱或負責人,違法法規法條,違反法規內容,罰鍰金額,備註說明
新北市,20160823,20151105,新北府勞檢字第10430745681號,永欣鋁業股份有限公司,勞動基準法第24條,延長工作時間未依規定加給工資,,
新北市,20160823,20151105,新北府勞檢字第1043074568號,永欣鋁業股份有限公司,勞動基準法第22條第2項,工資未全額直接給付勞工,,
台北市,20171101,20170906,北市勞職字第10637614402號,永欣鋁業股份有限公司,營造安全衛生設施標準第11條之1暨職業安全衛生法第6條第1項第1、3、5款。,對於進入工作場所作業人員，未提供適當安全帽，並使其正確戴用。,,
新北市,20160823,20151105,新北府勞檢字第10430745681號,永欣鋁業股份有限公司,勞動基準法第24條,延長工作時間未依規定加給工資,,
新北市,20160823,20151105,新北府勞檢字第1043074568號,永欣鋁業股份有限公司,勞動基準法第22條第2項,工資未全額直接給付勞工,,
台北市,20171101,20170906,北市勞職字第10637614402號,永欣鋁業股份有限公司,營造安全衛生設施標準第11條之1暨職業安全衛生法第6條第1項第1、3、5款。,對於進入工作場所作業人員，未提供適當安全帽，並使其正確戴用。,,
台北市,20210705,20210427,北市勞職字第11060631145號,永欣鋁業股份有限公司,職業安全衛生法第6條第1項+營造安全衛生設施標準第11-1條,未提供安全帽使正確戴用。,,
桃園市,20220802,20220609,111年府勞檢字1110150925號,永欣鋁業股份有限公司林要然,勞基法第22條第2項,工資未全額直接給付勞工,20000,
桃園市,20220615,20220421,府勞檢字第1110103768號,永欣鋁業股份有限公司林要然,職業安全衛生設施規則第224條第1項暨職業安全衛生法第6條第1項;職業安全衛生設施規則第228條暨職業安全衛生法第6條第1項,雇主對於高度在二公尺以上之工作場所邊緣及開口部分，勞工有遭受墜落危險之虞者，應設有適當強度之護欄、護蓋等防護設備。;雇主對勞工於高差超過一．五公尺以上之場所作業時，應設置能使勞工安全上下之設備。,,
