主管機關,公告日期,處分日期,處分字號,事業單位名稱或負責人,違法法規法條,違反法規內容,罰鍰金額,備註說明
新北市,20160823,20160511,新北府勞檢字第10534442361號,永盛加油站有限公司,勞動基準法第36條,每七日中未有一日之休息作為例假,,
新北市,20160823,20160511,新北府勞檢字第1053444236號,永盛加油站有限公司,勞動基準法第32條第2項,延長工作時間超過法令規定,,
新北市,20200622,20200327,新北府勞檢字第10947696501號,永盛加油站有限公司,勞動基準法第36條第1項,勞工每七日中應有二日之休息，其中一日為例假，一日為休息日。,,
新北市,20200622,20200327,新北府勞檢字第1094769650號,永盛加油站有限公司,勞動基準法第24條,延長工作時間未依規定加給工資,,
勞動部勞工保險局,20220711,20220530,保退二字第11160056100號,永盛加油站有限公司范光隆,勞工退休金條例第15條第2項,雇主未依規定覈實申報調整勞工退休金提繳工資。,5000,
新北市,20231020,20230717,新北府勞檢字第11246719141號,永盛加油站有限公司范光隆,勞動基準法第24條,延長工作時間未依規定加給工資,40000,
新北市,20231020,20230717,新北府勞檢字第11246719141號,永盛加油站有限公司范光隆,勞動基準法第24條,延長工作時間未依規定加給工資,40000,
新北市,20231020,20230717,新北府勞檢字第1124671914號,永盛加油站有限公司范光隆,勞動基準法第22條第2項,工資未全額直接給付勞工,20000,
新北市,20231020,20230717,新北府勞檢字第1124671914號,永盛加油站有限公司范光隆,勞動基準法第22條第2項,工資未全額直接給付勞工,20000,
