主管機關,公告日期,處分日期,處分字號,事業單位名稱或負責人,違法法規法條,違反法規內容,罰鍰金額,備註說明
台北市,20160729,20151113,府勞動字第10435588000號,沙露德醫藥有限公司楊雅絲,勞動基準法第22條第2項;勞動基準法第30條第5項,工資未全額給付給勞工;未依規定置備勞工出勤紀錄,,
台北市,20160729,20151113,府勞動字第10435588000號,沙露德醫藥有限公司楊雅絲,勞動基準法第22條第2項;勞動基準法第30條第5項,工資未全額給付給勞工;未依規定置備勞工出勤紀錄,,
台北市,20160729,20151113,府勞動字第10435588000號,沙露德醫藥有限公司楊雅絲,勞動基準法第22條第2項;勞動基準法第30條第5項,工資未全額給付給勞工;未依規定置備勞工出勤紀錄,,
加工出口區管理處,20191203,20191024,經加四勞字第1080105915號,沙露德醫藥有限公司,勞基法第21條第1項,工資總額低於基本工資,,
勞動部勞工保險局,20211210,20211025,保退一字第11069911105號,沙露德醫藥有限公司楊雅絲,勞工退休金條例第19條第1項,雇主未按時繳納勞工退休金致加徵滯納金。,3240,
