主管機關,公告日期,處分日期,處分字號,事業單位名稱或負責人,違法法規法條,違反法規內容,罰鍰金額,備註說明
台北市,20160729,20160506,北市勞動字第10533747400號,泰和清潔事業有限公司吳榮發,勞動基準法第32條第1項;勞動基準法第36條,延長勞工工作時間未經工會或勞資會議同意;每七日中未有一日之休息作為例假,,
台北市,20160729,20160506,北市勞動字第10533747400號,泰和清潔事業有限公司吳榮發,勞動基準法第32條第1項;勞動基準法第36條,延長勞工工作時間未經工會或勞資會議同意;每七日中未有一日之休息作為例假,,
勞動部勞工保險局,20210810,20210603,保退二字第11060057500號,泰和清潔事業有限公司吳榮發,勞工退休金條例第15條第2項,雇主未依規定覈實申報調整勞工退休金提繳工資。,5000,
台北市,20210505,20210318,北市勞動字第11060049831號,泰和清潔事業有限公司吳榮發,勞動基準法第59條第2款,未依規定補償職災勞工原領工資補償,20000,
台北市,20210401,20210113,北市勞職字第10961793461號,泰和清潔事業有限公司,職業安全衛生法第22條第1項+勞工健康保護規則第3條第2項,未依規定配置護理人員。,,
高雄市,20210407,20210218,高市勞條字第11030595700號,泰和清潔事業有限公司吳榮發,勞動基準法第21條第1項;勞動基準法第38條;勞動基準法第39條,未達基本工資;未依規定給予特別休假;假日工資未給或於休假日工作未依規定加給工資,60000,
勞動部勞工保險局,20230710,20230524,保退二字第11260056490號,泰和清潔事業有限公司吳榮發,勞工退休金條例第15條第2項,雇主未依規定覈實申報調整勞工退休金提繳工資。,5000,
新北市,20230818,20230605,新北府勞檢字第1124667456號,泰和清潔事業有限公司吳榮發,勞動基準法第32條第2項,延長工作時間超過法令規定,40000,
勞動部勞工保險局,20240812,20240613,保退二字第11360071600號,泰和清潔事業有限公司吳榮發,勞工退休金條例第15條第2項,雇主未依規定覈實申報調整勞工退休金提繳工資。,6000,
