主管機關,公告日期,處分日期,處分字號,事業單位名稱或負責人,違法法規法條,違反法規內容,罰鍰金額,備註說明
台南市,20191110,20191017,南市勞安字第1081193393號,泰慶皮革塑膠工業股份有限公司楊正,勞動基準法第59條,未依規定給予勞工職業災害補償。,,
台南市,20190910,20190812,府勞安字第1080889382號,泰慶皮革塑膠工業股份有限公司楊正,勞動基準法第24條第1項;勞動基準法第32條第2項,延長工作時間未依規定加給工資;延長工作時間超過法令規定。,,
職業安全衛生署,20191204,20190918,勞職授字第10802039791號,泰慶皮革塑膠工業股份有限公司,職業安全衛生法第37條第2項第3款,事業單位勞動場所發生發生災害之罹災人數在一人以上，且需住院治療之職業災害時，雇主未於8小時內通報勞動檢查機構,,
職業安全衛生署,20191204,20190918,勞職授字第1080203979號,泰慶皮革塑膠工業股份有限公司,職業安全衛生設施規則第287條暨職業安全衛生法第6條第1項,雇主對於勞工有暴露於高溫、低溫、非游離輻射線、生物病原體、有害氣體、蒸氣、粉塵或其他有害物之虞者，未置備安全衛生防護具。,,
職業安全衛生署,20231107,20230817,勞職授字第1120203872號,泰慶皮革塑膠工業股份有限公司楊正,職業安全衛生設施規則第43條第1項暨職業安全衛生法第6條第1項,對於伸展機輸送膠輪之捲入處，未設置護罩、護圍等防護設施,,
職業安全衛生署,20240710,20240514,勞職授字第1130204398號,泰慶皮革塑膠工業股份有限公司楊正,職業安全衛生設施規則第43條第1項、同規則第224條第1項暨職業安全衛生法第6條第1項,雇主對於機械之原動機、轉軸、齒輪、帶輪、飛輪、傳動輪、傳動帶等有危害勞工之虞之部分，未有護罩、護圍、套胴、跨橋等設備；雇主對於高度在二公尺以上之工作場所邊緣及開口部分，勞工有遭受墜落危險之虞者，未設有適當強度之護欄、護蓋等防護設備。,,王瑞甫
