主管機關,公告日期,處分日期,處分字號,事業單位名稱或負責人,違法法規法條,違反法規內容,罰鍰金額,備註說明
台北市,20140805,20140515,府勞動字第10331947800號,泰翔公寓大廈管理維護股份有限公司,勞動基準法第30條第1項;勞動基準法第30條第5項;勞動基準法第39條,正常工作時間超過法令規定;未依規定置備勞工出勤紀錄表;假日工資未給或於休假日工作未依規定加給工資,,
新北市,20180221,20171103,新北府勞檢字第10635865461號,泰翔公寓大廈管理維護股份有限公司,勞動基準法第30條第6項,出勤紀錄未依規定應逐日記載勞工出勤情形至分鐘,,
新北市,20180221,20171103,新北府勞檢字第10635865462號,泰翔公寓大廈管理維護股份有限公司,勞動基準法第39條,假日工資未給或於休假日工作未依規定加倍發給,,
新北市,20180221,20171103,新北府勞檢字第1063586546號,泰翔公寓大廈管理維護股份有限公司,勞動基準法第24條,延長工作時間未依規定加給工資,,
新北市,20201221,20190815,新北府勞檢字第1084270940號,泰翔公寓大廈管理維護股份有限公司蕭德銘,勞動基準法第24條,延長工作時間未依規定加給工資,,
