主管機關,公告日期,處分日期,處分字號,事業單位名稱或負責人,違法法規法條,違反法規內容,罰鍰金額,備註說明
新北市,20160823,20160204,新北府勞檢字第10534336501號,湘鄉食品有限公司,勞動基準法第32條第2項,延長工作時間超過法令規定,,
新北市,20160823,20160204,新北府勞檢字第1053433650號,湘鄉食品有限公司,勞動基準法第24條,延長工作時間未依規定加給工資,,
新北市,20210820,20210505,新北府勞檢字第1104724174號,湘鄉食品有限公司陳茂棖,勞動基準法第59條第4款,未計給勞工因職業災害致死之喪葬費及死亡補償,40000,
新北市,20210820,20210505,新北府勞檢字第1104724174號,湘鄉食品有限公司陳茂棖,勞動基準法第59條第4款,未計給勞工因職業災害致死之喪葬費及死亡補償,40000,
新北市,20220415,20220112,新北府勞檢字第1114730207號,湘鄉食品有限公司陳茂棖,職業安全衛生法第6條第1項,未符合規定之必要安全衛生設備及措施,,
新北市,20240621,20240416,新北府勞檢字第1134640706號,湘鄉食品有限公司陳茂棖,職業安全衛生法第6條第1項,未符合規定之必要安全衛生設備及措施,,
