主管機關,公告日期,處分日期,處分字號,事業單位名稱或負責人,違法法規法條,違反法規內容,罰鍰金額,備註說明
新北市,20211217,20210924,新北府勞檢字第1104739959號,漢威聯合股份有限公司潘志強,勞動基準法第30條第6項,出勤紀錄未依規定應逐日記載勞工出勤情形至分鐘,20000,
台北市,20220805,20220505,北市勞職字第11160450641號,漢威聯合股份有限公司潘志強,職業安全衛生法第26條第1項;職業安全衛生法第27條第1項第1、2、3、4款,未事前告知該承攬人依規定應採取措施。;原事業單位未採取承攬管理必要措施。,,
新北市,20220415,20220117,新北府勞檢字第1114731013號,漢威聯合股份有限公司潘志強,職業安全衛生法第23條第1項,未訂定職業安全衛生管理計畫，並設置安全衛生組織、人員，實施安全衛生管理及自動檢查,,
新北市,20220617,20220331,新北府勞檢字第1114739360號,漢威聯合股份有限公司潘志強,勞動基準法第30條第6項,出勤紀錄未依規定應逐日記載勞工出勤情形至分鐘,40000,
新北市,20230612,20230410,新北府勞檢字第1124660055號,漢威聯合股份有限公司潘志強,勞動基準法第30條第6項,出勤紀錄未依規定應逐日記載勞工出勤情形至分鐘,80000,
