主管機關,公告日期,處分日期,處分字號,事業單位名稱或負責人,違法法規法條,違反法規內容,罰鍰金額,備註說明
職業安全衛生署,20190710,20190307,勞職授字第1080200844號,煒翰實業有限公司,營造安全衛生設施標準第19條第2項暨職業安全衛生法第6條第1項,使勞工於高度2公尺以上水平支撐從事鋼構組配作業，勞工有遭受墜落危險之虞，未設置安全母索使勞工使用安全帶等防止勞工遭受墜落危險等措施。,,
職業安全衛生署,20191008,20190612,勞職授字第1080202456號,煒翰實業有限公司,營造安全衛生設施標準第39條暨職業安全衛生法第6條第1項,對於高度2公尺以上之水平支撐抗衝擊梁拆除作業工作場所，勞工有遭受墜落危險之虞者，未設置適當施工架工作臺。,,
職業安全衛生署,20200610,20200206,勞職授字第1090200414號,煒翰實業有限公司,營造安全衛生設施標準第19條第2項暨職業安全衛生法第6條第1項,使勞工於高度2公尺以上之安全支撐從事鋼構組配作業，勞工有遭受墜落危險之虞，未使勞工確實使用安全帶等防止勞工遭受墜落危險之措施。,,
職業安全衛生署,20200910,20200506,勞職授字第1090201886號,煒翰實業有限公司,職業安全衛生設施規則第241條、第250條暨職業安全衛生法第6條第1項,對於使用中之交流電焊機二次側接線端子之帶電部分裸露未設絕緣披覆，並將自動電擊防止裝置測試鍵以金屬物固定使其失去電擊防止效能，勞工於作業中或通行時，有因接觸或接近致發生感電之虞，未於該交流電焊機二次側接線端子帶電部分設防止感電之護圍或絕緣被覆及設置有效之自動電擊防止裝置。,,
台中市,20240410,20240321,府授勞檢字第1130069769號,煒翰實業有限公司鄭瑞良,職業安全衛生法第6條第1項,未符合規定之必要安全衛生設備及措施,,
職業安全衛生署,20250505,20250317,勞職授字第1140251166號,煒翰實業有限公司鄭瑞良,營造安全衛生設施標準第11條之1暨職業安全衛生法第6條第1項,對於進入營繕工程工作場所之作業勞工，未提供適當安全帽並使其正確戴用。,,
職業安全衛生署,20250505,20250321,勞職授字第1140251201A號,煒翰實業有限公司鄭瑞良,營造安全衛生設施標準第19條暨職業安全衛生法第6條第1項,對於高度2公尺以上之施工構台開口部分等，勞工有遭受墜落危險之虞，未於該處設置安全網或採勞工使用安全帶措施。,,
