主管機關,公告日期,處分日期,處分字號,事業單位名稱或負責人,違法法規法條,違反法規內容,罰鍰金額,備註說明
職業安全衛生署,20210111,20201005,勞職授字第1090204288號,物格股份有限公司,職業安全衛生設施規則第127條、機械設備器具安全標準第84條第2項第2款暨職業安全衛生法第6條第1項,所設堆高機從事搬運作業具有傾倒危險之部分，未依規定不得超過該機械所能承受之最大荷重，另對於堆高機傾倒時具有墜落、壓傷危險之部分，未依規定配置安全帶，致發生職業安全衛生法第37條第2項之職業災害。,,
職業安全衛生署,20210111,20201005,勞職授字第1090204292號,物格股份有限公司,職業安全衛生法第37條第2項,勞動場所發生罹災人數在1人以上，且需住院治療之職業災害，未於8小時內通報勞動檢查機構。,,
職業安全衛生署,20220510,20220302,勞職授字第1110200936號,物格股份有限公司翁存義,職業安全衛生法第24條,所設吊升荷重3公噸以上之固定式起重機，係屬中央主管機關指定具有危險性之機械，其操作人員未經中央主管機關認可之訓練或經技能檢定合格即行操作。,,
職業安全衛生署,20221110,20220817,勞職授字第1110204668號,物格股份有限公司翁存義,職業安全衛生設施規則第153條暨職業安全衛生法第6條第1項,對於堆放或處置物料，為防止倒塌、崩塌或掉落，未採取繩索捆綁、護網、擋樁、限制高度或變更堆積等必要設施，並禁止與作業無關人員進入該等場所。,,
職業安全衛生署,20241205,20240930,勞職授字第1130206464號,物格股份有限公司翁存義,起重升降機具安全規則第63條第1項第6、9款暨職業安全衛生法第6條第1項,使勞工操作固定式起重機從事型鋼吊掛作業，有被碰撞危害之虞，未依規定當荷物(型鋼)起吊離地後，不得以手碰觸荷物，並確認荷物之放置場所決定荷物排列、放置及堆疊方法。,,
