主管機關,公告日期,處分日期,處分字號,事業單位名稱或負責人,違法法規法條,違反法規內容,罰鍰金額,備註說明
職業安全衛生署,20170420,20170224,勞職授字第1060200920號,瑋瓏營造有限公司,營造安全衛生設施標準第19條第1項暨職業安全衛生法第6第1項,對於高度2公尺以上之外牆施工架工作臺等場所，勞工有遭受墜落危險之虞，未設置內、外側下拉桿、內側交叉拉桿等防護設備。,,
職業安全衛生署,20170420,20170224,勞職授字第1060200920號,瑋瓏營造有限公司,營造安全衛生設施標準第19條第1項暨職業安全衛生法第6第1項,對於高度2公尺以上之外牆施工架工作臺等場所，勞工有遭受墜落危險之虞，未設置內、外側下拉桿、內側交叉拉桿等防護設備。,,
職業安全衛生署,20211209,20210913,勞職授字第1100204841號,瑋瓏營造有限公司,營造安全衛生設施標準第19條第1項暨職業安全衛生法第6條第1項,對於高度2公尺以上之外牆施工架工作臺開口部分，勞工有遭受墜落危險之虞，未於該開口部分設置護欄(內側交叉拉桿及下拉桿)或防墜網等防護設備。,,
職業安全衛生署,20240605,20240422,勞職授字第1130203958號,瑋瓏營造有限公司陳孟瓏,營造安全衛生設施標準第19條第1項暨職業安全衛生法第6條第1項,對於高度2公尺以上之施工架工作臺、樓梯及管道等處開口部分等場所，勞工有遭受墜落危險之虞，未於施工架工作臺設置護欄(內側交叉拉桿及內、外側下拉桿)，及於樓梯、管道等處開口部分設置護欄。,,
職業安全衛生署,20240605,20240418,勞職授字第1130203961號,瑋瓏營造有限公司陳孟瓏,營造安全衛生設施標準第19條第1項暨職業安全衛生法第6條第1項,對於高度2公尺以上之樓板邊緣及電梯井開口部分及外牆施工架工作臺，勞工有遭受墜落危險之虞，未於樓板邊緣及電梯井開口部分設置護欄、護蓋或安全網等防護設備及於施工架工作臺設置護欄（內側交叉拉桿及下拉桿）等防護設備。,,
職業安全衛生署,20240605,20240419,勞職授字第1130204000號,瑋瓏營造有限公司陳孟瓏,營造安全衛生設施標準第19條第1項、職業安全衛生設施規則第241條、第243條第3款暨職業安全衛生法第6條第1項,對於高度2公尺以上之樓梯、陽臺、施工架工作臺等場所開口部分，未於該樓梯設置護欄，於該陽臺設置護欄、護蓋或安全網等防護設備，於該施工架工作臺設置護欄(內外側交叉拉桿、下拉桿)，對於建築工程臨時用電設備及該設備帶電部分，未於該臨時用電設備設防止感電之護圍或絕緣被覆及於電路上設置適合其規格，具有高敏感度、高速型，能確實動作之防止感電用漏電斷路器。,,
職業安全衛生署,20240701,20240426,勞職授字第1130204077號,瑋瓏營造有限公司陳孟瓏,營造安全衛生設施標準第19條第1項、第45條第3款、第59條第1項第4款暨職業安全衛生法第6條第1項,對於高度2公尺以上之施工架工作臺、樓梯及陽台開口部分，勞工有遭受墜落危險之虞者，未於施工架工作臺設置護欄（內側交叉拉桿及內、外側下拉桿），於樓梯及陽台開口部分設置護欄、護蓋或安全網等防護設備，對於外牆鋼管施工架，未與構造物妥實連接並在立架連接部分以適當之金屬附屬配件確實連接固定。,,
職業安全衛生署,20250505,20250324,勞職授字第1140251253A號,瑋瓏營造有限公司陳孟瓏,職業安全衛生法第27條第1項第1、2、3、4款,與承攬人共同作業時，未設置協議組織並指定工作場所負責人擔任指揮、監督及協調之工作、未採取工作連繫與調整之必要措施、未巡視工作場所、未指導及協助相關承攬事業間之安全衛生教育。,,
職業安全衛生署,20250505,20250324,勞職授字第1140251253號,瑋瓏營造有限公司陳孟瓏,職業安全衛生法第26條第1項,以其事業之全部或一部分交付承攬時，未於事前告知該承攬人有關其事業工作環境、危害因素暨本法及有關安全衛生規定應採取之措施。,,
