主管機關,公告日期,處分日期,處分字號,事業單位名稱或負責人,違法法規法條,違反法規內容,罰鍰金額,備註說明
台南市,20180910,20180814,府勞檢字第1070862150號,瑚嗡科技股份有限公司王國信,勞動基準法第30條第3項;勞動基準法第32條第2項,依政府機關辦公日曆表出勤不符法定要件;延長工作時間超過法令規定。,,
台南市,20190110,20181210,府勞檢字第1071356036號,瑚嗡科技股份有限公司王國信,勞動基準法第22條第2項,工資未全額直接給付勞工。,,
台南市,20180910,20180814,府勞檢字第1070862150號,瑚嗡科技股份有限公司王國信,勞動基準法第30條第3項;勞動基準法第32條第2項,依政府機關辦公日曆表出勤不符法定要件;延長工作時間超過法令規定。,,
台南市,20190110,20181210,府勞檢字第1071356036號,瑚嗡科技股份有限公司王國信,勞動基準法第22條第2項,工資未全額直接給付勞工。,,
台南市,20191110,20191023,南市勞安字第1081202371號,瑚嗡科技股份有限公司王國信,勞動基準法第22條第2項,工資未全額直接給付勞工。,,
