主管機關,公告日期,處分日期,處分字號,事業單位名稱或負責人,違法法規法條,違反法規內容,罰鍰金額,備註說明
桃園市,20221109,20220912,府勞檢字第1110256080號,瑞創光電股份有限公司王建焜,職業安全衛生設施規則第196條第2款暨職業安全衛生法第6條第1項;職業安全衛生設施規則第196條第3款暨職業安全衛生法第6條第1項;特定化學物質危害預防標準第37條第1項暨職業安全衛生法第6條第1項,雇主對於化學設備或其配管，為防止危險物洩漏或操作錯誤而引起爆炸、火災之危險，應依下列規定辦理：一、…。二、操作化學設備或其配管之閥、旋塞、控制開關、按鈕等，應保持良好性能，標示其開關方向，必要時並以顏色、形狀等標明其使用狀態。三、…。;雇主對於化學設備或其配管，為防止危險物洩漏或操作錯誤而引起爆炸、火災之危險，應依下列規定辦理：一、…。三、為防止供料錯誤，造成危險，應於勞工易見之位置標示其原料、材料、種類、供料對象及其他必要事項。;雇主使勞工從事特定化學物質之作業時，應指定現場主管擔任特定化學物質作業主管，實際從事監督作業。,,
勞動部勞工保險局,20231011,20230824,保退一字第11269911085號,瑞創光電股份有限公司王建焜,勞工退休金條例第19條第1項,雇主未按時繳納勞工退休金致加徵滯納金。,105424,
勞動部勞工保險局,20231211,20231026,保退一字第11269911105號,瑞創光電股份有限公司王建焜,勞工退休金條例第19條第1項,雇主未按時繳納勞工退休金致加徵滯納金。,207293,
勞動部勞工保險局,20240215,20231221,保退一字第11269911125號,瑞創光電股份有限公司王建焜,勞工退休金條例第19條第1項,雇主未按時繳納勞工退休金致加徵滯納金。,133727,
桃園市,20230906,20230712,112年府勞檢字1120188611號,瑞創光電股份有限公司王建焜,勞基法第22條第2項,工資未全額直接給付勞工,20000,
