主管機關,公告日期,處分日期,處分字號,事業單位名稱或負責人,違法法規法條,違反法規內容,罰鍰金額,備註說明
台南市,20160310,20160127,府勞條字第1050099636號,登榮塑膠企業股份有限公司蔡雪馨,勞動基準法第24條;勞動基準法第32條第2項,延長工作時間未依規定加給工資;延長工作時間超過法令規定;,,
台南市,20161010,20160922,府勞條字第1050959635號,登榮塑膠企業股份有限公司蔡雪馨,勞動基準法第32條第2項;勞動基準法第36條,延長工作時間超過法令規定;每七日中未有一日之休息作為例假;,,
台南市,20160310,20160127,府勞條字第1050099636號,登榮塑膠企業股份有限公司蔡雪馨,勞動基準法第24條;勞動基準法第32條第2項,延長工作時間未依規定加給工資;延長工作時間超過法令規定;,,
台南市,20161010,20160922,府勞條字第1050959635號,登榮塑膠企業股份有限公司蔡雪馨,勞動基準法第32條第2項;勞動基準法第36條,延長工作時間超過法令規定;每七日中未有一日之休息作為例假;,,
台南市,20220810,20220725,南市勞安字第1110880440號,登榮塑膠企業股份有限公司蔡雪馨,勞動基準法第21條第1項,未達基本工資,20000,
