主管機關,公告日期,處分日期,處分字號,事業單位名稱或負責人,違法法規法條,違反法規內容,罰鍰金額,備註說明
新北市,20170218,20161230,新北府勞檢字第10534749451號,皇室吉利堡有限公司,勞動基準法第32條第2項,延長工作時間超過法令規定,,
新北市,20170218,20161230,新北府勞檢字第10534749452號,皇室吉利堡有限公司,勞動基準法第38條,未依規定給予特別休假,,
新北市,20170218,20161230,新北府勞檢字第10534749453號,皇室吉利堡有限公司,勞動基準法第39條,假日工資未給或於休假日工作未依規定加倍發給,,
新北市,20170218,20161230,新北府勞檢字第1053474945號,皇室吉利堡有限公司,勞動基準法第24條,延長工作時間未依規定加給工資,,
新北市,20190816,20190520,新北府勞檢字第10842583311號,皇室吉利堡有限公司,勞動基準法第24條,延長工作時間未依規定加給工資,,
新北市,20190816,20190520,新北府勞檢字第10842583312號,皇室吉利堡有限公司,勞動基準法第32條第2項,延長工作時間超過法令規定,,
新北市,20190816,20190520,新北府勞檢字第10842583313號,皇室吉利堡有限公司,勞動基準法第38條第5項,未將特別休假天數及未休之日數發給工資記載於勞工工資清冊,,
新北市,20190816,20190520,新北府勞檢字第1084258331號,皇室吉利堡有限公司,勞動基準法第23條第1項,工資未定期給付勞工,,
