主管機關,公告日期,處分日期,處分字號,事業單位名稱或負責人,違法法規法條,違反法規內容,罰鍰金額,備註說明
職業安全衛生署,20190910,20190625,勞職授字第1080202564號,盛世營造股份有限公司,營造安全衛生設施標準第19條第1項、第63條第2項、第73條第1項暨職業安全衛生法第6條第1項,"對於高度2公尺以上之工地西南側通道開口部分作業場所,勞工有遭受墜落危險之虞者,未於該處設置護欄等防護設備;對於擬訂之開挖計畫,其怪手機具種類及土壓監測系統等內容未有詳述;對於工地西南側擋土支撐之構築,其橫檔背土未緊密回填。",,
職業安全衛生署,20191008,20190705,勞職授字第1080202743號,盛世營造股份有限公司,營造安全衛生設施標準第20條暨職業安全衛生法第6條第1項,"對於高度2公尺以上之施工構台作業場所,勞工有墜落之虞者,未架設符合規定之護欄(未設置腳趾板)。",,
職業安全衛生署,20210409,20210120,勞職授字第1100200256號,盛世營造股份有限公司,營造安全衛生設施標準第19條第1項暨職業安全衛生法第6條第1項,"對於高度二公尺以上之屋頂、鋼樑、開口部分、階梯、樓梯、坡道、工作臺、擋土牆、擋土支撐、施工構臺、橋樑墩柱及橋樑上部結構、橋臺等場所作業,勞工有遭受墜落危險之虞者,未於該處設置護欄、護蓋或安全網等防護設備。",,
職業安全衛生署,20221209,20220919,勞職授字第11102052761號,盛世營造股份有限公司韓俊傑,職業安全衛生法第26條第1項,以其事業之全部或一部分交付承攬時，未於事前告知該承攬人有關其事業工作環境、危害因素暨職業安全衛生法及有關安全衛生規定應採取之措施。,,
職業安全衛生署,20221209,20220919,勞職授字第1110205276號,盛世營造股份有限公司韓俊傑,職業安全衛生法第27條第1項第1款、第4款,與承攬人分別僱用勞工共同作業時，未設置協議組織並指定工作場所負責人擔任指揮、監督及協調之工作、未指導及協助相關承攬事業間之安全衛生教育。,,
職業安全衛生署,20240624,20240422,勞職授字第1130203938號,盛世營造股份有限公司韓俊傑,營造安全衛生設施標準第19條第1項、第40條第1項第1款暨職業安全衛生法第6條第1項,雇主對於高度二公尺以上之屋頂、鋼梁、開口部分、階梯、樓梯、坡道、工作臺、擋土牆、擋土支撐、施工構臺、橋梁墩柱及橋梁上部結構、橋臺等場所作業，勞工有遭受墜落危險之虞者，未於該處設置護欄、護蓋或安全網等防護設備；雇主對於施工構臺、懸吊式施工架、懸臂式施工架、高度七公尺以上且立面面積達三百三十平方公尺之施工架、高度七公尺以上之吊料平臺、升降機直井工作臺、鋼構橋橋面板下方工作臺或其他類似工作臺等之構築及拆除，未依下列規定辦理：一、事先就預期施工時之最大荷重，應由所僱之專任工程人員或委由相關執業技師，依結構力學原理妥為設計，置備施工圖說及強度計算書，經簽章確認後，據以執行。…。,,
