主管機關,公告日期,處分日期,處分字號,事業單位名稱或負責人,違法法規法條,違反法規內容,罰鍰金額,備註說明
新北市,20190816,20190624,新北府勞檢字第1084263914號,盛源精密工業股份有限公司,勞動基準法第24條,延長工作時間未依規定加給工資,,
新北市,20200221,20191216,新北府勞檢字第10842866381號,盛源精密工業股份有限公司,勞動基準法第32條第2項,延長工作時間超過法令規定,,
新北市,20200221,20191216,新北府勞檢字第10842866382號,盛源精密工業股份有限公司,勞動基準法第36條第1項,每七日中未有一日之休息作為例假,,
新北市,20200221,20191216,新北府勞檢字第1084286638號,盛源精密工業股份有限公司,勞動基準法第24條,延長工作時間未依規定加給工資,,
勞動部勞工保險局,20221212,20221019,保退三字第11160146150號,盛源精密工業股份有限公司王復華,勞工退休金條例第15條第2項,雇主未依規定覈實申報調整勞工退休金提繳工資。,5000,
新北市,20221216,20221026,新北府勞檢字第11147655061號,盛源精密工業股份有限公司王復華,勞動基準法第24條,延長工作時間未依規定加給工資,80000,
新北市,20230217,20221026,新北府勞檢字第1114765506號,盛源精密工業股份有限公司王復華,勞動基準法第23條第1項,工資未定期給付勞工或未提供勞工工資各項目計算方式明細,20000,
