主管機關,公告日期,處分日期,處分字號,事業單位名稱或負責人,違法法規法條,違反法規內容,罰鍰金額,備註說明
新北市,20171215,20170918,新北府勞檢字第10635815451號,祐鼎工程股份有限公司,勞動基準法第32條第2項,延長工作時間超過法令規定,,
新北市,20171215,20170918,新北府勞檢字第1063581545號,祐鼎工程股份有限公司,勞動基準法第22條第2項,工資未全額直接給付勞工,,
新北市,20171215,20170918,新北府勞檢字第10635815451號,祐鼎工程股份有限公司,勞動基準法第32條第2項,延長工作時間超過法令規定,,
新北市,20171215,20170918,新北府勞檢字第1063581545號,祐鼎工程股份有限公司,勞動基準法第22條第2項,工資未全額直接給付勞工,,
職業安全衛生署,20210309,20201209,勞職授字第1090205468號,祐鼎工程股份有限公司,職業安全衛生設施規則第225條第1項暨職業安全衛生法第6條第1項,"對於在高度二公尺以上之處所進行作業,勞工有墜落之虞者,未以架設施工架或其他方法設置工作台。",,
