主管機關,公告日期,處分日期,處分字號,事業單位名稱或負責人,違法法規法條,違反法規內容,罰鍰金額,備註說明
高雄市,20160818,20160512,高市勞條字第10533248800號,神通資訊科技股份有限公司,勞動基準法第30條第6項;勞動基準法第32條第2項,出勤紀錄未記載至分鐘為止;延長工作時間超過法令規定,,
台北市,20171101,20170912,北市勞職字第10638784900號,神通資訊科技股份有限公司,職業安全衛生設施規則第324條之3第1項第4款暨職業安全衛生法第6條第2項第3款。,對於預防勞工執行職務，因他人行為致遭受身體或精神上不法侵害，應採取相關暴力預防措施，做成執行紀錄並留存三年，未依規定建構行為規範。,,
職業安全衛生署,20191106,20190805,勞職授字第10802030871號,神通資訊科技股份有限公司,職業安全衛生法第27條第1項,"與承攬人分別僱用勞工共同作業時,未設置協議組織並指定工作場所負責人擔任指揮、未監督及協調之工作、未採取工作之連繫與調整之必要措施、未巡視工作場所、未指導及協助相關承攬事業間之安全衛生教育。",,
職業安全衛生署,20191106,20190805,勞職授字第1080203087號,神通資訊科技股份有限公司,職業安全衛生法第26條第1項,"事業單位以其事業之全部或一部分交付承攬時,未於事前告知該承攬人有關其事業工作環境、危害因素暨本法及有關安全衛生規定應採取之措施。",,
台北市,20201105,20200907,北市勞動字第10960387221號,神通資訊科技股份有限公司蘇亮,勞動基準法第24條第1項,延長工作時間未依規定加給工資,20000,
