主管機關,公告日期,處分日期,處分字號,事業單位名稱或負責人,違法法規法條,違反法規內容,罰鍰金額,備註說明
職業安全衛生署,20160217,20160126,勞職授字第1050200157號,祥發金屬工業股份有限公司,機械設備器具安全標準第4條第1項、職業安全衛生設施規則第72條第1款暨職業安全衛生法第6條第1項,所設衝壓機械未具有安全護圍、未指定作業管理人員負責執行檢查衝壓機械及其安全裝置。,,
桃園市,20170510,20170316,府勞檢字第1060059689號,祥發金屬工業股份有限公司謝時化,職業安全衛生設施規則第57條第1項暨職業安全衛生法第6條第1項;機械設備器具安全標準第4條第3項暨職業安全衛生法第6條第1項,對於機械之掃除、上油、檢查、修理或調整有導致危害勞工之虞者，未停止相關機械運轉及送料。為防止他人操作該機械之起動等裝置或誤送料，未採上鎖或設置標示等措施，並設置防止落下物導致危害勞工之安全設備與措施。;第一項衝剪機械之原動機、齒輪、轉軸、傳動輪、傳動帶及其他構件，有引起危害之虞者，未設置護罩、護圍、套胴、圍柵、護網、遮板或其他防止接觸危險點之適當防護物。,,
職業安全衛生署,20160217,20160126,勞職授字第1050200157號,祥發金屬工業股份有限公司,機械設備器具安全標準第4條第1項、職業安全衛生設施規則第72條第1款暨職業安全衛生法第6條第1項,所設衝壓機械未具有安全護圍、未指定作業管理人員負責執行檢查衝壓機械及其安全裝置。,,
桃園市,20170510,20170316,府勞檢字第1060059689號,祥發金屬工業股份有限公司謝時化,職業安全衛生設施規則第57條第1項暨職業安全衛生法第6條第1項;機械設備器具安全標準第4條第3項暨職業安全衛生法第6條第1項,對於機械之掃除、上油、檢查、修理或調整有導致危害勞工之虞者，未停止相關機械運轉及送料。為防止他人操作該機械之起動等裝置或誤送料，未採上鎖或設置標示等措施，並設置防止落下物導致危害勞工之安全設備與措施。;第一項衝剪機械之原動機、齒輪、轉軸、傳動輪、傳動帶及其他構件，有引起危害之虞者，未設置護罩、護圍、套胴、圍柵、護網、遮板或其他防止接觸危險點之適當防護物。,,
勞動部勞工保險局,20210910,20210707,保退三字第11060086430號,祥發金屬工業股份有限公司電著塗裝廠謝時化,勞工退休金條例第15條第2項,雇主未依規定覈實申報調整勞工退休金提繳工資。,5000,
