主管機關,公告日期,處分日期,處分字號,事業單位名稱或負責人,違法法規法條,違反法規內容,罰鍰金額,備註說明
台北市,20180423,20180222,北市勞職字第10731154604號,福君綜合工程有限公司,職業安全衛生設施規則第230條第1項第3款暨職業安全衛生法第6條第1項第5款。,使用未符合規定之合梯。,,
台北市,20181001,20180713,北市勞職字第10760412351號,福君綜合工程有限公司,職業安全衛生設施規則第225條第1項暨職業安全衛生法第6條第1項第5款,2公尺以上作業未設置工作台。,,
台北市,20190308,20181218,北市勞職字第10760742011號,福君綜合工程有限公司,職業安全衛生設施規則第225條第1項暨職業安全衛生法第6條第1項第5款,2公尺以上作業未設置工作台。,,
台北市,20200401,20200102,北市勞職字第10861107251號,福君綜合工程有限公司,營造安全衛生設施標準第11-1條暨職業安全衛生法第6條第1項第1、3、5款,未提供安全帽使正確戴用。,,
台北市,20200505,20200220,北市勞職字第10960070571號,福君綜合工程有限公司,職業安全衛生法第27條第1項第1、2、3款,原事業單位未採取承攬管理必要措施。,,
