主管機關,公告日期,處分日期,處分字號,事業單位名稱或負責人,違法法規法條,違反法規內容,罰鍰金額,備註說明
宜蘭縣,20190710,20190502,府勞資字第1080054691號,福泉鋼業股份有限公司,勞動基準法第21條第1項;勞動基準法第24條第1項;勞動基準法第32條第2項,未達基本工資;延長工作時間未依規定加給工資;延長工時超過法定上限,,
宜蘭縣,20220105,20211227,府勞資字第1100171932號,福泉鋼業股份有限公司陳正賢,勞動基準法第24條第2項;勞動基準法第70條,休息日出勤工作未依規定加給工資;未依法訂立工作規則，報請主管機關核備後並公開揭示之,70000,多次違反勞動法令事業勞動條件專案檢查
宜蘭縣,20220906,20220718,府勞資字第1110088243號,福泉鋼業股份有限公司陳正賢,勞動基準法第24條,延長工作時間未依規定加給工資,50000,多次違反勞動法令事業勞動條件專案檢查
新北市,20221216,20221019,新北府勞檢字第1114764829號,福泉鋼業股份有限公司陳正賢,職業安全衛生法第6條第1項,未符合規定之必要安全衛生設備及措施,,
新北市,20240816,20240603,新北府勞檢字第11346469031號,福泉鋼業股份有限公司陳正賢,勞動基準法第38條,未依規定給予特別休假,20000,
新北市,20240816,20240603,新北府勞檢字第1134646903號,福泉鋼業股份有限公司陳正賢,勞動基準法第24條,延長工作時間未依規定加給工資,50000,
職業安全衛生署,20241115,20241008,勞職授字第1130206651號,福泉鋼業股份有限公司陳正賢,職業安全衛生法第37條第2項第3款,勞動場所發生罹災人數在一人以上，且需住院治療之職業災害，未於八小時內通報勞動檢查機構。,,職業災害
