主管機關,公告日期,處分日期,處分字號,事業單位名稱或負責人,違法法規法條,違反法規內容,罰鍰金額,備註說明
台北市,20181101,20180830,北市勞職字第10760557903號,福麟系統整合股份有限公司,職業安全衛生設施規則第225條第1項暨職業安全衛生法第6條第1項第5款,2公尺以上作業未設置工作台。,,
台北市,20240705,20240530,北市勞職字第11360711485號,福麟系統整合股份有限公司吳東明,職業安全衛生設施規則第41條第5款暨職業安全衛生法第6條第1項第1款,堆高機、研磨機等機具未依規定辦理。,,
台北市,20181101,20180830,北市勞職字第10760557903號,福麟系統整合股份有限公司,職業安全衛生設施規則第225條第1項暨職業安全衛生法第6條第1項第5款,2公尺以上作業未設置工作台。,,
台北市,20240705,20240530,北市勞職字第11360711485號,福麟系統整合股份有限公司吳東明,職業安全衛生設施規則第41條第5款暨職業安全衛生法第6條第1項第1款,堆高機、研磨機等機具未依規定辦理。,,
台北市,20250407,20250207,北市勞職字第11460512417號,福麟系統整合股份有限公司吳東明,職業安全衛生設施規則第225條第1項暨職業安全衛生法第6條第1項第5款,2公尺以上作業未設置工作台。,,
