主管機關,公告日期,處分日期,處分字號,事業單位名稱或負責人,違法法規法條,違反法規內容,罰鍰金額,備註說明
新北市,20170606,20170307,新北府勞檢字第10635572191號,禾馥科技股份有限公司,勞動基準法第39條,假日工資未給或於休假日工作未依規定加倍發給,,
新北市,20170606,20170307,新北府勞檢字第1063557219號,禾馥科技股份有限公司,勞動基準法第24條,延長工作時間未依規定加給工資,,
新北市,20170606,20170307,新北府勞檢字第10635572191號,禾馥科技股份有限公司,勞動基準法第39條,假日工資未給或於休假日工作未依規定加倍發給,,
新北市,20170606,20170307,新北府勞檢字第1063557219號,禾馥科技股份有限公司,勞動基準法第24條,延長工作時間未依規定加給工資,,
新北市,20230818,20230608,新北府勞檢字第11246674971號,禾馥科技股份有限公司林毓曄,勞動基準法第24條,延長工作時間未依規定加給工資,20000,
新北市,20230818,20230608,新北府勞檢字第11246674972號,禾馥科技股份有限公司林毓曄,勞動基準法第32條第2項,延長工作時間超過法令規定,20000,
新北市,20230818,20230608,新北府勞檢字第11246674973號,禾馥科技股份有限公司林毓曄,勞動基準法第39條,假日工資未給或於休假日工作未依規定加給工資,20000,
新北市,20230818,20230608,新北府勞檢字第1124667497號,禾馥科技股份有限公司林毓曄,勞動基準法第23條第2項,未依規定置備工資清冊,20000,
