主管機關,公告日期,處分日期,處分字號,事業單位名稱或負責人,違法法規法條,違反法規內容,罰鍰金額,備註說明
高雄市,20161223,20161007,高市勞條字第10537997800號,竑榮實業股份有限公司楊芳銘,勞動基準法第24條;勞動基準法第32條第2項;勞動基準法第36條,延長工作時間未依規定加給工資;延長工作時間超過法令規定;每七日中未有一日之休息作為例假,,
高雄市,20161223,20161007,高市勞條字第10537997800號,竑榮實業股份有限公司楊芳銘,勞動基準法第24條;勞動基準法第32條第2項;勞動基準法第36條,延長工作時間未依規定加給工資;延長工作時間超過法令規定;每七日中未有一日之休息作為例假,,
台南市,20190610,20190510,府勞檢字第1080528958號,竑榮實業股份有限公司楊芳銘,勞動基準法第38條,未依規定給予特別休假,,
勞動部勞工保險局,20220210,20211213,保退三字第11060198700號,竑榮實業股份有限公司楊芳銘,勞工退休金條例第15條第2項,雇主未依規定覈實申報調整勞工退休金提繳工資。,5000,
高雄市,20240108,20231115,高市勞條字第11238754900號,竑榮實業股份有限公司楊芳銘,勞動基準法第32條第2項,延長工作時間超過法令規定。,50000,
