主管機關,公告日期,處分日期,處分字號,事業單位名稱或負責人,違法法規法條,違反法規內容,罰鍰金額,備註說明
新北市,20170606,20170331,新北府勞檢字第1063561043號,精晟興業股份有限公司,勞動基準法第38條,未依規定給予特別休假,,
新北市,20220218,20211229,新北府勞檢字第11047513191號,精晟興業股份有限公司林源章,勞動基準法第30條第6項,出勤紀錄未依規定應逐日記載勞工出勤情形至分鐘,20000,
新北市,20220218,20211229,新北府勞檢字第11047513192號,精晟興業股份有限公司林源章,勞動基準法第32條第2項,延長工作時間超過法令規定,20000,
新北市,20220218,20211229,新北府勞檢字第11047513193號,精晟興業股份有限公司林源章,勞動基準法第36條第1項,勞工每七日中應有二日之休息，其中一日為例假，一日為休息日,20000,
新北市,20220218,20211229,新北府勞檢字第1104751319號,精晟興業股份有限公司林源章,勞動基準法第21條第1項,未達基本工資,20000,
