主管機關,公告日期,處分日期,處分字號,事業單位名稱或負責人,違法法規法條,違反法規內容,罰鍰金額,備註說明
新北市,20171215,20171012,新北府勞檢字第1063583930號,糕盛有限公司,勞動基準法第30條第6項,出勤紀錄未依規定應逐日記載勞工出勤情形至分鐘,,
新北市,20190816,20190514,新北府勞檢字第1084258268號,糕盛有限公司,勞動基準法第32條第2項,延長工作時間超過法令規定,,
新北市,20221216,20220920,新北府勞檢字第1114760542號,糕盛有限公司吳月雲,職業安全衛生法第23條第1項,未訂定職業安全衛生管理計畫，並設置安全衛生組織、人員，實施安全衛生管理及自動檢查,,
新北市,20240419,20240220,新北府勞檢字第1134634437號,糕盛有限公司吳月雲,職業安全衛生法第23條第1項,未訂定職業安全衛生管理計畫，並設置安全衛生組織、人員，實施安全衛生管理及自動檢查,,
新北市,20240419,20240220,新北府勞檢字第1134634439號,糕盛有限公司吳月雲,職業安全衛生法第6條第1項,未符合規定之必要安全衛生設備及措施,,
