主管機關,公告日期,處分日期,處分字號,事業單位名稱或負責人,違法法規法條,違反法規內容,罰鍰金額,備註說明
職業安全衛生署,20220501,20220223,勞職授字第1110200848號,統冠營造股份有限公司竇國誠,職業安全衛生設施規則第128條之1第6款職業安全衛生設施規則第228條職業安全衛生設施規則第281條第1項營造安全衛生設施標準第19條第1項暨職業安全衛生法第6條第1項,對於使用高空工作車之作業（以高空工作車作為3樓鋼梁（高度9公尺）場所勞工上下之使用），使高空工作車為主要用途以外之用途；對於13.2公尺屋頂及4.7公尺雨遮之鋼梁場所，未設置能使勞工安全上下之設備；對於在高度2公尺以上之鋼梁高處作業，未使勞工確實使用安全帶；高差2公尺以上鋼梁(13.2公尺屋頂及4.7公尺雨遮)、施工架開口部分(上下設備)等場所作業，未於該處設置護欄、護蓋或安全網等防護設備,,
職業安全衛生署,20220801,20220522,勞職授字第1110202749號,統冠營造股份有限公司竇國誠,營造安全衛生設施標準第20條第1款暨職業安全衛生法第6條第1項,對於高度2公尺以上之2樓（4.75公尺）、3樓（8.55公尺）樓版及樓梯（2座）所設之護欄（以安全母索作為護欄設備），未設置具90公分以上之上欄杆、中間欄杆或等效設備、腳趾板及杆柱等構材。,,
職業安全衛生署,20230607,20230316,勞職授字第11202013061號,統冠營造股份有限公司竇國誠,職業安全衛生法第27條第1項第1、2、3、4款,事業單位與承攬人分別僱用勞工共同作業時，為防止職業災害，原事業單位未採取下列必要措施：一、設置協議組織，並指定工作場所負責人，擔任指揮、監督及協調之工作。二、工作之連繫與調整。三、工作場所之巡視。四、相關承攬事業間之安全衛生教育之指導及協助。,,
職業安全衛生署,20230607,20230316,勞職授字第1120201306號,統冠營造股份有限公司竇國誠,營造安全衛生設施標準第19條第1項暨職業安全衛生法第6條第1項,對於高度2公尺以上之施工架開口部分場所作業，應於該處設置護欄、護蓋或安全網等防護設備,,
職業安全衛生署,20240710,20240515,勞職授字第1130204414號,統冠營造股份有限公司竇國誠,營造安全衛生設施標準第19條第1項暨職業安全衛生法第6條第2項,對於高度2公尺以上之外牆施工架開口部分等場所作業，未於該處設置護欄、護蓋或安全網等防護設備,,林麗雲
