主管機關,公告日期,處分日期,處分字號,事業單位名稱或負責人,違法法規法條,違反法規內容,罰鍰金額,備註說明
勞動部勞工保險局,20220210,20211206,保退二字第11060195820號,綠地環保事業股份有限公司歐子兢,勞工退休金條例第15條第2項,雇主未依規定覈實申報調整勞工退休金提繳工資。,5000,
新竹市,20220107,20211125,府勞動字第1100176684號,綠地環保事業股份有限公司歐子競,勞基法第70條,工作規則未依規定報請主管機關核備並公告揭示。,20000,人力供應暨複合支援服務業勞動條件專案檢查
桃園市,20211207,20211008,110年府勞檢字1100258955號,綠地環保事業股份有限公司歐子兢,勞基法第36條第1項,每7日中未有2日之休息作為例假及休息日,20000,
國家科學及技術委員會新竹科學園區,20220905,20220715,竹環字第1110023283號,綠地環保事業股份有限公司歐子兢,勞動基準法第38條第4項,終止勞動契約時未結算特別休假工資,20000,
勞動部勞工保險局,20230810,20230629,保退二字第11260072080號,綠地環保事業股份有限公司歐子兢,勞工退休金條例第15條第2項,雇主未依規定覈實申報調整勞工退休金提繳工資。,5000,
勞動部勞工保險局,20240710,20240520,保退二字第11360058120號,綠地環保事業股份有限公司歐子兢,勞工退休金條例第15條第2項,雇主未依規定覈實申報調整勞工退休金提繳工資。,6000,
台中市,20250305,20241213,府授勞動字第1130362151號,綠地環保事業股份有限公司歐子兢,勞動基準法第56條第2項,未足額提撥勞工退休準備金,90000,
新竹市,20241210,20241115,府勞動字第1130178685號,綠地環保事業股份有限公司歐子兢,勞基法第24條第1項,延長工時未依法令規定倍率計算加給工資(亦未補休),20000,
