主管機關,公告日期,處分日期,處分字號,事業單位名稱或負責人,違法法規法條,違反法規內容,罰鍰金額,備註說明
宜蘭縣,20161110,20160920,府勞資字第1050140213號,美德向邦股份有限公司,勞基法第32條第2項;勞基法第36條,延長工時超過法定上限;勞工未每七日中至少有一日之休假作為例假,,
職業安全衛生署,20191008,20190703,勞職授字第1080202675號,美德向邦股份有限公司,職業安全衛生法第37條第2項,"勞動場所發生罹災人數在1人以上,且需住院治療之職業災害,未於8小時內通報勞動檢查機構。",,
苗栗縣,20201110,20201007,府勞資字第1090460096號,美德向邦股份有限公司陳素甜,勞動基準法第36條第2項,依第三十條第二項規定變更正常工作時間者，勞工每七日中至少應有一日之例假，每二週內之例假及休息日至少應有四日。,20000,
台北市,20220602,20220420,北市勞動字第11160043571號,美德向邦股份有限公司陳素甜,勞動基準法第30條第6項;勞動基準法第32條第2項,出勤紀錄未逐日記載勞工出勤情形至分鐘為止;延長工作時間超過法令規定,70000,
台南市,20231010,20230831,南市勞安字第1121123902號,美德向邦股份有限公司陳素甜,勞動基準法第30條第6項,未逐日記載勞工出勤情形至分鐘為止,20000,
苗栗縣,20240910,20240801,府勞資字第1130165143號,美德向邦股份有限公司陳素甜,勞動基準法第32條第2項,延長工時超過法定上限,20000,
