主管機關,公告日期,處分日期,處分字號,事業單位名稱或負責人,違法法規法條,違反法規內容,罰鍰金額,備註說明
職業安全衛生署,20170313,20170105,勞職授字第1050205126號,美達食品工業股份有限公司,職業安全衛生法第49條第1款,使勞工從事電線回推作業時，使用堆高機及6層棧板將勞工舉升至距地高約255公分處，勞工有墜落之虞，未採取防止勞工墜落措施，未架設施工架或設置工作台供勞工使用，致發生職業安全衛生法第37條第2項之職業災害。,,
職業安全衛生署,20170313,20170105,勞職授字第1050205126號,美達食品工業股份有限公司,職業安全衛生法第49條第1款,使勞工從事電線回推作業時，使用堆高機及6層棧板將勞工舉升至距地高約255公分處，勞工有墜落之虞，未採取防止勞工墜落措施，未架設施工架或設置工作台供勞工使用，致發生職業安全衛生法第37條第2項之職業災害。,,
職業安全衛生署,20210610,20210225,勞職授字第1100200927號,美達食品工業股份有限公司,職業安全衛生設施規則第224條第1項暨職業安全衛生法第6條第1項,對於高度2公尺以上之作業平台，勞工有遭受墜落危險之虞者，未設有適當強度之護欄等防護設備。,,
雲林縣,20230825,20230808,112年府勞動一字1123420969號,美達食品工業股份有限公司陳寬博,勞基法第21條第1項;勞基法第24條第1項;勞基法第32條第2項;勞基法第59條第2款,未達基本工資;雇主未依規定給付延長工時工資;延長勞工之工作時間超過法令規定;未依規定給付職災補償費用,80000,
雲林縣,20231124,20231026,112年府勞動一字1123428267號,美達食品工業股份有限公司陳寬博,勞基法第59條第2款,職災醫療期間未按原領工資數額予以核發,20000,
職業安全衛生署,20240805,20240626,勞職授字第1130205028號,美達食品工業股份有限公司陳寬博,職業安全衛生設施規則第22條第2項暨職業安全衛生法第6條第1項,設置之殺菌用高溫爐(第一種壓力容器)，有使勞工接觸其高溫熱表面引起灼燙傷之虞，未設置警示標誌、適當之隔熱等必要之安全設施。,,
