主管機關,公告日期,處分日期,處分字號,事業單位名稱或負責人,違法法規法條,違反法規內容,罰鍰金額,備註說明
勞動部勞工保險局,20250210,20241225,保退一字第11369911125號,羱禾營造有限公司陳耀廷,勞工退休金條例第19條第1項,雇主未按時繳納勞工退休金致加徵滯納金。,22192,
台北市,20241205,20241009,北市勞職字第11360949251號,羱禾營造有限公司陳耀廷,營造安全衛生設施標準第19條第1項暨職業安全衛生法第6條第1項第13款;職業安全衛生設施規則第228條暨職業安全衛生法第6條第1項第13款,有墜落危險之處所未設防護設備。;未設置安全上下之設備。,,
台北市,20241205,20241023,北市勞職字第11360968521號,羱禾營造有限公司陳耀廷,營造安全衛生設施標準第35條暨職業安全衛生法第6條第1項第13款,磚、瓦等未置於穩固平坦處，高度超過1.8公尺。,,
台北市,20250106,20241114,北市勞職字第11361006941號,羱禾營造有限公司陳耀廷,營造安全衛生設施標準第19條第1項暨職業安全衛生法第6條第1項第13款,有墜落危險之處所未設防護設備。,,
台北市,20250205,20241211,北市勞職字第11361204271號,羱禾營造有限公司陳耀廷,營造安全衛生設施標準第19條第1項暨職業安全衛生法第6條第1項第13款,有墜落危險之處所未設防護設備。,,
台北市,20250305,20250110,北市勞職字第11361246811號,羱禾營造有限公司陳耀廷,營造安全衛生設施標準第5條暨職業安全衛生法第6條第1項第13款;營造安全衛生設施標準第11-1條暨職業安全衛生法第6條第1項第1款、第3款、第5款;營造安全衛生設施標準第19條第1項暨職業安全衛生法第6條第1項第13款;營造安全衛生設施標準第129條第8款暨職業安全衛生法第6條第1項第13款;職業安全衛生設施規則第243條第1項第3款暨職業安全衛生法第6條第1項,暴露鋼筋等材料未採取防護設施。;未提供安全帽使正確戴用。;有墜落危險之處所未設防護設備。;鋼筋混凝土作業未依規定辦理。;未依規定裝設漏電斷路器。,,
