主管機關,公告日期,處分日期,處分字號,事業單位名稱或負責人,違法法規法條,違反法規內容,罰鍰金額,備註說明
新北市,20170419,20170113,新北府勞資字第1060037303號,羲澍實業股份有限公司,勞動基準法第30條第6項,出勤紀錄未依規定應逐日記載勞工出勤情形至分鐘,,
職業安全衛生署,20170626,20170418,勞職授字第10602017362號,羲澍實業股份有限公司,職業安全衛生設施規則90條、第92條第1項暨職業安全衛生法第6條第1項,橋式起重機具之吊具（吊架），未有防止吊掛物脫落之裝置；對於起重機具之運轉，未採取防止吊掛物通過人員上方及人員進入吊掛物下方之設備或措施。,,
職業安全衛生署,20191008,20190723,勞職授字第1080202776號,羲澍實業股份有限公司,職業安全衛生設施規則第224條第1項、第228條暨職業安全衛生法第6條第1項,"對於所雇勞工於貨櫃拖車（高差2公尺以上）開口處作業時未設置符合規定之護欄、護蓋、安全網或佩掛安全帶等防墜措施,又使勞工以堆高機作為上下之設備。",,
職業安全衛生署,20210602,20210330,勞職授字第1100201546號,羲澍實業股份有限公司,職業安全衛生設施規則第116條第15款暨職業安全衛生法第6條第1項,對於勞動場所作業之車輛機械，未使駕駛者或有關人員負責執行，於車輛機械之作業或移動，有撞擊工作者之虞時，置管制引導人員。,,
基隆市,20220310,20220106,基府社關罰貳1100280318,羲澍實業股份有限公司王宇宏,勞基法第34條第2項;勞基法第36條第1項,更換班次時，未至少有連續11小時之休息時間;每7日中未排定有2日休息作為例假及休息日。,40000,
職業安全衛生署,20240423,20221220,勞職授字第11102055881號,羲澍實業股份有限公司王宇宏,碼頭裝卸安全衛生設施標準第44條暨職業安全衛生法第6條第1項,貨艙、甲板或陸上裝卸作業時，未禁止勞工進入吊舉物下方及其他有發生危害之虞之區域。,,
職業安全衛生署,20250315,20250214,勞職授字第1140250284B號,羲澍實業股份有限公司王宇宏,碼頭裝卸安全衛生設施標準第44條、第64條第1項第3款暨職業安全衛生法第6條第1項,貨艙、甲板或陸上裝卸作業時，雇主未禁止勞工進入吊舉物下方及其他有發生危害之虞之區域；雇主於總噸位在五百公噸以上之船舶，使用起重裝置從事船舶貨物之裝載、卸載或搬移等作業時，未指派船舶裝卸作業主管辦理下列事項：一、…三、與周邊作業者間之連絡及調整。,,職業災害
