主管機關,公告日期,處分日期,處分字號,事業單位名稱或負責人,違法法規法條,違反法規內容,罰鍰金額,備註說明
職業安全衛生署,20151112,20151016,勞職授字第1040203479號,聚巨豐企業股份有限公司,職業安全衛生設施規則第43條第1項暨職業安全衛生法第6條第1項,對滾牙機械之傳動轉軸及傳動皮帶輪等有危害勞工之虞之部分，未依規定設置護罩、護圍等設備。,,
職業安全衛生署,20151112,20151016,勞職授字第1040203480號,聚巨豐企業股份有限公司,勞工作業環境監測實施辦法第7條第1項第3款暨職業安全衛生法第12條第3項,勞工噪音暴露工作日8小時日時量平均音壓級85分貝以上之作業場所(如成型組及滾牙組)，未於每6個月監測噪音1次以上。,,
台南市,20160510,20160419,府勞條字第1050195508號,聚巨豐企業股份有限公司張璞稜,勞動基準法第24條;勞動基準法第32條第2項,延長工作時間未依規定加給工資;延長工作時間超過法令規定;,,
職業安全衛生署,20170420,20170208,勞職授字第1060200474號,聚巨豐企業股份有限公司,職業安全衛生設施規則第57條第1項暨職業安全衛生法第6條第1項,對於攻牙機之修理有導致危害勞工之虞，未停止相關機械運轉及送料。,,
職業安全衛生署,20231005,20230706,勞職授字第1120203271號,聚巨豐企業股份有限公司張璞稜,職業安全衛生設施規則第224條第1項、機械設備器具安全標準第4條第1項及同標準第4條第3項暨職業安全衛生法第6條第1項,雇主對於高度在二公尺以上之工作場所邊緣，勞工有遭受墜落危險之虞者，未設有適當強度之護欄、護蓋等防護設備;以動力驅動之衝壓機械及剪斷機械，未具有安全護圍、安全模、特定用途之專用衝剪機械或自動衝剪機械;前項之之原動機、齒輪、轉軸、傳動輪、傳動帶及其他構件，有引起危害之虞者，未設置護罩、護圍、套胴、圍柵、護網、遮板或其他防止接觸危險點之適當防護物,,
職業安全衛生署,20250109,20241126,勞職授字第1130207450號,聚巨豐企業股份有限公司張璞稜,職業安全衛生設施規則第83條項、同規則第250條暨職業安全衛生法第6條第1項,雇主對於扇風機之葉片，有危害勞工之虞者，未設護網或護圍等設備；對勞工於良導體機器設備內之狹小空間，或於鋼架等致有觸及高導電性接地物之虞之場所，作業時所使用之交流電焊機，未有自動電擊防止裝置。,,謝盈杰
