主管機關,公告日期,處分日期,處分字號,事業單位名稱或負責人,違法法規法條,違反法規內容,罰鍰金額,備註說明
台北市,20180801,20180606,北市勞動字第10760023121號,聯合利華股份有限公司何盈德,勞動基準法第30條第6項,出勤紀錄未逐日記載勞工出勤情形至分鐘為止,,
台北市,20181003,20180829,北市勞動字第10760434371號,聯合利華股份有限公司何盈德,勞動基準法第32條第2項;勞動基準法第49條第1項;勞動基準法第36條第1項,延長工作時間超過法令規定;未經工會或勞資會議同意使女工於午後10時至翌晨6時之時間內工作;未使勞工每7日中有2日之休息，其中1日為例假，1日為休息日,,訴願駁回
台北市,20180801,20180606,北市勞動字第10760023121號,聯合利華股份有限公司何盈德,勞動基準法第30條第6項,出勤紀錄未逐日記載勞工出勤情形至分鐘為止,,
台北市,20181003,20180829,北市勞動字第10760434371號,聯合利華股份有限公司何盈德,勞動基準法第32條第2項;勞動基準法第49條第1項;勞動基準法第36條第1項,延長工作時間超過法令規定;未經工會或勞資會議同意使女工於午後10時至翌晨6時之時間內工作;未使勞工每7日中有2日之休息，其中1日為例假，1日為休息日,,訴願駁回
新竹縣,20190505,20190122,107年府勞資字1073915930號,聯合利華股份有限公司,勞基法第24條第1項;勞基法第32條第2項,雇主延長勞工工作時間者，其延長工作時間之工資，依下列標準加給：一、延長工作時間在二小時以內者，按平...;延長工作時間超過法令規定,,
