主管機關,公告日期,處分日期,處分字號,事業單位名稱或負責人,違法法規法條,違反法規內容,罰鍰金額,備註說明
台北市,20160714,20160509,北市勞職字第10534134504號,聯懿金屬股份有限公司,營造安全衛生設施標準第11條之1暨職業安全衛生法第6條第1項第1、3、5款。,僱用勞工進入營繕場所從事作業，對於進入營繕工程工作場所作業人員，未提供適當安全帽，並使其正確戴用。,,
台北市,20200305,20191226,北市勞職字第10861069033,聯懿金屬股份有限公司,職業安全衛生設施規則第230條第1項第3款暨職業安全衛生法第6條第1項第5款,合梯未符合規定。,,
台北市,20200703,20200417,北市勞職字第10960514243號,聯懿金屬股份有限公司,職業安全衛生設施規則第41條第5款暨職業安全衛生法第6條第1項第1款,堆高機、研磨機等機具未依規定辦理。,,
桃園市,20200707,20200513,109年府勞檢字10901121161號,聯懿金屬股份有限公司張鴻聯,勞基法第32條第2項,延長工作時間超過法令規定,,
桃園市,20200707,20200513,109年府勞檢字1090112116號,聯懿金屬股份有限公司張鴻聯,勞基法第24條第1項,延長工作時間未依規定加給工資,,
新北市,20220617,20220419,新北府勞檢字第11147414081號,聯懿金屬股份有限公司張鴻聯,職業安全衛生法第6條第1項,未符合規定之必要安全衛生設備及措施,,
桃園市,20230204,20221209,府勞條字第1110341946號,聯懿金屬股份有限公司,勞工退休金條例第13條第1項,雇主未繼續按月提撥勞工退休準備金。,20000,
職業安全衛生署,20220409,20220105,勞職授字第11002061073號,聯懿金屬股份有限公司張鴻聯,營造安全衛生設施標準第19條暨職業安全衛生法第6條第1項,對於高度二公尺以上之開口部分、工作臺等場所作業，勞工有遭受墜落危險之虞者，未於該處設置護欄、護蓋或安全網等防護設備。設置前項設備有困難時，未採取使勞工使用安全帶等防止墜落措施。,,
台北市,20240408,20240220,北市勞職字第11360538023號,聯懿金屬股份有限公司張鴻聯,營造安全衛生設施標準第11-1條暨職業安全衛生法第6條第1項第1款、第3款、第5款,未提供安全帽使正確戴用。,,
