主管機關,公告日期,處分日期,處分字號,事業單位名稱或負責人,違法法規法條,違反法規內容,罰鍰金額,備註說明
台北市,20151214,20151012,府勞動字第10435833500號,臺北農產運銷股份有限公司莊龍彥,勞動基準法第32條第2項,延長工作時間超過法令規定,,
台北市,20170126,20161130,北市勞動字第10542751200號,臺北農產運銷股份有限公司陳益宗,勞動基準法第24條,延長工作時間未依規定加給工資,,
台北市,20180801,20180619,北市勞動字第10760023611號,臺北農產運銷股份有限公司陳景峻,勞動基準法第39條;勞動基準法第24條第1項;勞動基準法第24條第2項;勞動基準法第36條第1項,假日工資未給或於休假日工作未依規定加給工資;延長工作時間未依規定加給工資;未依法給付休息日工作之工資;未使勞工每7日中有2日之休息，其中1日為例假，1日為休息日,,
台北市,20180702,20180530,北市勞資字第10760265772號,臺北農產運銷股份有限公司陳景峻,勞動基準法第56條第2項,未依法足額提撥勞工退休準備金,,
台北市,20191005,20190802,北市勞資字第10860002662號,臺北農產運銷股份有限公司黃向羣,勞動基準法第56條第2項,雇主應於每年年底，為次一年度預估成就退休要件勞工在次年3月底前於專戶足額提撥退休金。,,
台北市,20210205,20201201,北市勞資字第10961083141號,臺北農產運銷股份有限公司黃向羣,勞動基準法第56條第2項,雇主應於每年年底，為次一年度預估成就退休要件勞工在次年3月底前於專戶足額提撥退休金,210000,
台北市,20210505,20210220,北市勞職字第11060527481號,臺北農產運銷股份有限公司,職業安全衛生法第23條第1項+職業安全衛生管理辦法第3條第1項,未設置管理人員。,,
