主管機關,公告日期,處分日期,處分字號,事業單位名稱或負責人,違法法規法條,違反法規內容,罰鍰金額,備註說明
職業安全衛生署,20150917,20150807,勞職授字第1040202792號,臺鍍科技股份有限公司台南廠,職業安全衛生設施規則第90條暨職業安全衛生法第6條第1項,對於起重機具之吊鉤，未有防止吊舉中所吊物體脫落之裝置。,,
職業安全衛生署,20150917,20150807,勞職授字第1040202793號,臺鍍科技股份有限公司台南廠,職業安全衛生法第16條第1項,設置高壓氣體特定設備2座(逾期)，係屬中央主管機關指定具有危險性之設備，未經勞動檢查機構或中央主管機關指定之代行檢查機構再檢查合格即予使用。,,
台南市,20161210,20161121,府勞條字第1051186360號,臺鍍科技股份有限公司蕭秀清,勞動基準法第32條第2項;勞動基準法第36條,延長工作時間超過法令規定;每七日中未有一日之休息作為例假;,,
桃園市,20180110,20171128,府勞檢字第1060286414號,臺鍍科技股份有限公司蕭秀清,職業安全衛生設施規則第153條暨職業安全衛生法第6條第1項,雇主對於堆置物料，為防止倒塌、崩塌或掉落，應採取繩索捆綁、護網、擋樁、限制高度或變更堆積等必要設施，並禁止與作業無關人員進入該等場所。,,
職業安全衛生署,20181009,20180718,勞職授字第1070203812號,臺鍍科技股份有限公司,機械設備器具安全標準第95條暨職業安全衛生法第6條第1項,內圓研磨機以外之研磨輪，未設置護罩，並具有第九十六條至第一百零四條所定之性能，。,,
桃園市,20190705,20190526,府勞檢字第1080124527號,臺鍍科技股份有限公司蕭秀清,特定化學物質危害預防標準第36條暨職業安全衛生法第6條第1項;職業安全衛生設施規則第285條暨職業安全衛生法第6條第1項;特定化學物質危害預防標準第50條暨職業安全衛生法第6條第1項;工業用機器人危害預防標準第21條第1項第1款暨職業安全衛生法第6條第1項,雇主使勞工從事製造、處置或使用特定化學物質時，應設置洗眼、沐浴、漱口、更衣及洗衣等設備。但丙類第一種物質或丁類物質之作業場所並應設置緊急沖淋設備。;雇主對於熔礦爐、熔鐵爐、玻璃熔解爐、或其他高溫操作場所，為防止爆炸或高熱物飛出，除應有適當防護裝置及置備適當之防護具外，並使勞工確實使用。;雇主對製造、處置或使用特定化學物質之作業場所，應依下列規定置備與同一工作時間作業勞工人數相同數量以上之適當必要防護具，並保持其性能及清潔，使勞工確實使用。一、為防止勞工於該作業場所吸入該物質之氣體、蒸氣或粉塵引起之健康危害，應置備必要之呼吸用防護具。二、為防止勞工於該作業場所接觸該物質等引起皮膚障害或由皮膚吸收引起健康危害，應置備必要之不浸透性防護衣、防護手套、防護鞋及塗敷劑等。三、為防止特定化學物質對視機能之影響，應置備必要之防護眼鏡。;雇主於機器人可動範圍之外側，依下列規定設置圍柵或護圍：一、出入口以外之處所，應使工作者不易進入可動範圍內。二、…。,,
職業安全衛生署,20211101,20210817,勞職授字第11002041813號,臺鍍科技股份有限公司,職業安全衛生法第26條第1項,事業單位以其事業之全部或一部分交付承攬時，未於事前告知該承攬人有關其事業工作環境、危害因素暨本法及有關安全衛生規定應採取之措施。,,
台南市,20220910,20220824,南市勞安字第1111048486號,臺鍍科技股份有限公司蕭秀清,勞動基準法第32條第2項,延長工作時間超過法令規定,20000,
職業安全衛生署,20221101,20220817,勞職授字第1110204516號,臺鍍科技股份有限公司蕭秀清,職業安全衛生設施規則第116條第14款及職業安全衛生設施規則第241條暨職業安全衛生法第6條第1項,使用座式操作之配衡型堆高機及側舉型堆高機，未使擔任駕駛之勞工確實使用駕駛座安全帶；雇主對於電氣機具之帶電部分，如勞工於作業中或通行時，有因接觸或接近致發生感電之虞者，未設防止感電之護圍或絕緣被覆。,,
