主管機關,公告日期,處分日期,處分字號,事業單位名稱或負責人,違法法規法條,違反法規內容,罰鍰金額,備註說明
台北市,20171101,20170928,北市勞職字第10639994600號,興成營造有限公司,營造安全衛生設施標準第69條第1項第4款暨職業安全衛生法第6條第1項第1款。,對於以機械從事作業，未嚴禁操作人員以外之勞工進入營建用機械之操作半徑範圍內。,,
台北市,20181101,20180803,北市勞職字第10760433821號,興成營造有限公司,職業安全衛生設施規則第21-2條第1項第2款暨職業安全衛生法第6條第1項第1款,對於使用道路作業之工作場所，為防止車輛突入等引起之危害，未依相關規定辦理。,,
台北市,20171101,20170928,北市勞職字第10639994600號,興成營造有限公司,營造安全衛生設施標準第69條第1項第4款暨職業安全衛生法第6條第1項第1款。,對於以機械從事作業，未嚴禁操作人員以外之勞工進入營建用機械之操作半徑範圍內。,,
台北市,20181101,20180803,北市勞職字第10760433821號,興成營造有限公司,職業安全衛生設施規則第21-2條第1項第2款暨職業安全衛生法第6條第1項第1款,對於使用道路作業之工作場所，為防止車輛突入等引起之危害，未依相關規定辦理。,,
台北市,20201105,20200826,北市勞職字第10960909281號,興成營造有限公司,營造安全衛生設施標準第11-1條暨職業安全衛生法第6條第1項第1、3、5款,未提供安全帽使正確戴用。,,
台北市,20210903,20210607,北市勞職字第11060676571號,興成營造有限公司,職業安全衛生法第6條第1項+營造安全衛生設施標準第11-1條,未提供安全帽使正確戴用。,,
台北市,20210903,20210611,北市勞職字第11060685191號,興成營造有限公司,職業安全衛生法第6條第1項+營造安全衛生設施標準第11-1條,未提供安全帽使正確戴用。,,
