主管機關,公告日期,處分日期,處分字號,事業單位名稱或負責人,違法法規法條,違反法規內容,罰鍰金額,備註說明
台北市,20211203,20210901,北市勞職字第11060827411號,興澤營造股份有限公司,營造安全衛生設施標準第19條第1項暨職業安全衛生法第6條1項第13款,有墜落危險之處所未設防護設備。,,
台北市,20220105,20211027,北市勞職字第11061122581號,興澤營造股份有限公司吳志剛,營造安全衛生設施標準第19條第1項暨職業安全衛生法第6條1項第13款;職業安全衛生設施規則第228條暨職業安全衛生法第6條第1項第13款,有墜落危險之處所未設防護設備。;未設置安全上下之設備。,,
台北市,20220207,20211101,北市勞職字第11061166151號,興澤營造股份有限公司吳志剛,職業安全衛生法第27條第1項第2、3款,原事業單位未採取承攬管理必要措施。,,
台北市,20220805,20220526,北市勞職字第11160591411號,興澤營造股份有限公司吳志剛,營造安全衛生設施標準第19條第1項暨職業安全衛生法第6條1項第13款,有墜落危險之處所未設防護設備。,,
台北市,20230405,20230204,府勞職字第11260513671號,興澤營造股份有限公司吳志剛,營造安全衛生設施標準第11-1條暨職業安全衛生法第6條第1項第1款、第3款、第5款;營造安全衛生設施標準第19條第1項暨職業安全衛生法第6條第1項第13款,未提供安全帽使正確戴用。;有墜落危險之處所未設防護設備。,,
新北市,20230612,20230315,新北府勞檢字第1124656891號,興澤營造股份有限公司吳志剛,職業安全衛生法第6條第1項,未符合規定之必要安全衛生設備及措施,,
新北市,20240223,20231106,新北府勞檢字第1124685223號,興澤營造股份有限公司吳志剛,職業安全衛生法第6條第1項,未符合規定之必要安全衛生設備及措施,,
桃園市,20240808,20240607,113年府勞檢字第1130154891號,興澤營造股份有限公司吳志剛,職業安全衛生設施規則第230條第1項第3款暨職業安全衛生法第6條第1項；職業安全衛生設施規則第230條第1項第4款暨職業安全衛生法第6條第1項；職業安全衛生設施規則第281條第1項暨職業安全衛生法第6條第1項；營造安全衛生設施標準第11條之1暨職業安全衛生法第6條第1項；營造安全衛生設施標準第19條第1項暨職業安全衛生法第6條第1項；營造安全衛生設施標準第40條第1項第1款暨職業安全衛生法第6條第1項；營造安全衛生設施標準第59條第1項第4款暨職業安全衛生法第6條第1項；機械設備器具安全標準第60條第1款暨職業安全衛生法第6條第1項；機械設備器具安全標準第60條第2款暨職業安全衛生法第6條第1項,雇主對於使用之合梯，應符合下列規定：一、…。三、梯腳與地面之角度應在七十五度以內，且兩梯腳間有金屬等硬質繫材扣牢，腳部有防滑絕緣腳座套。四、…。；雇主對於使用之合梯，應符合下列規定：一、…。四、有安全之防滑梯面。；雇主對於在高度二公尺以上之高處作業，勞工有墜落之虞者，應使勞工確實使用安全帶、安全帽及其他必要之防護具，但經雇主採安全網等措施者，不在此限。；雇主對於進入營繕工程工作場所作業人員，應提供適當安全帽，並使其正確戴用。；雇主對於高度二公尺以上之屋頂、鋼梁、開口部分、階梯、樓梯、坡道、工作臺、擋土牆、擋土支撐、施工構臺、橋梁墩柱及橋梁上部結構、橋臺等場所作業，勞工有遭受墜落危險之虞者，應於該處設置護欄、護蓋或安全網等防護設備。；雇主對於施工構臺、懸吊式施工架、懸臂式施工架、高度五公尺以上施工架、高度五公尺以上之吊料平臺、升降機直井工作臺、鋼構橋橋面板下方工作臺或其他類似工作臺等之構築及拆除，應依下列規定辦理：一、事先就預期施工時之最大荷重，依結構力學原理妥為設計，置備施工圖說，並指派所僱之專任工程人員簽章確認強度計算書及施工圖說。…。二、…。；圓盤鋸應設置下列安全裝置：一、圓盤鋸之反撥預防裝置(以下簡稱反撥預防裝置)。但橫鋸用圓盤鋸或因反撥不致引起危害者，不在此限。二、…。；圓盤鋸應設置下列安全裝置：一、…。二、圓盤鋸之鋸齒接觸預防裝置(以下簡稱鋸齒接觸預防裝置)。但製材用圓盤鋸及設有自動輸送裝置者，不在此限。,,
