主管機關,公告日期,處分日期,處分字號,事業單位名稱或負責人,違法法規法條,違反法規內容,罰鍰金額,備註說明
台北市,20160714,20160523,北市勞職字第10534275500號,興陽工程股份有限公司,1.職業安全衛生設施規則第228條暨職業安全衛生法第6條第1項第5款。;2.營造安全衛生設施標準第19條第1項暨職業安全衛生法第6條第1項第5款。,1.對勞工於高差超過1.5公尺以上之場所作業時，未設置使勞工安全上下之設備。;2.對於高度2公尺以上之開口部分從事作業，未於該處設置護欄、護蓋或安全網等防護設備，使勞工有遭受墜落危險之虞。,,
台北市,20160714,20160523,北市勞職字第10534275500號,興陽工程股份有限公司,1.職業安全衛生設施規則第228條暨職業安全衛生法第6條第1項第5款。;2.營造安全衛生設施標準第19條第1項暨職業安全衛生法第6條第1項第5款。,1.對勞工於高差超過1.5公尺以上之場所作業時，未設置使勞工安全上下之設備。;2.對於高度2公尺以上之開口部分從事作業，未於該處設置護欄、護蓋或安全網等防護設備，使勞工有遭受墜落危險之虞。,,
台北市,20211105,20210825,北市勞職字第11060806871號,興陽工程股份有限公司,營造安全衛生設施標準第11-1條暨職業安全衛生法第6條第1項第1、3、5款,未提供安全帽使正確戴用。,,
台北市,20221104,20220919,北市勞職字第11161036715號,興陽工程股份有限公司高陳敬,職業安全衛生設施規則第41條第5款暨職業安全衛生法第6條第1項1款,堆高機、研磨機等機具未依規定辦理。,,
台北市,20241007,20240801,北市勞職字第11360802485號,興陽工程股份有限公司高陳敬,職業安全衛生法第27條第1項第1款、第2款、第3款,原事業單位未採取承攬管理必要措施。,,
