主管機關,公告日期,處分日期,處分字號,事業單位名稱或負責人,違法法規法條,違反法規內容,罰鍰金額,備註說明
新北市,20160823,20140825,北府勞條字第10315367661號,芸妮有限公司,勞動基準法第30條第5項,未依規定置備勞工出勤紀錄表,,
新北市,20160823,20140825,北府勞條字第1031536766號,芸妮有限公司,勞動基準法第22條第2項,工資未全額直接給付勞工,,
新北市,20161012,20160726,新北府勞檢字第1053454042號,芸妮有限公司,勞動基準法第23條第2項,未依規定置備工資清冊,,
新北市,20161012,20160816,新北府勞檢字第1053457132號,芸妮有限公司,勞動基準法第24條,延長工作時間未依規定加給工資,,
台北市,20180702,20180523,北市勞動字第10732230400號,芸妮有限公司蕭碧月,勞動基準法第36條第2項,採變形工時制度，未依規定安排勞工例假或休息日,,
新北市,20190416,20190115,新北府勞檢字第1084240810號,芸妮有限公司,勞動基準法第30條第6項,出勤紀錄未依規定應逐日記載勞工出勤情形至分鐘,,
新北市,20201021,20200723,新北府勞檢字第1094785358號,芸妮有限公司蕭碧月,勞動基準法第30條第6項,出勤紀錄未依規定應逐日記載勞工出勤情形至分鐘,40000,
新北市,20201021,20200723,新北府勞檢字第1094785358號,芸妮有限公司蕭碧月,勞動基準法第30條第6項,出勤紀錄未依規定應逐日記載勞工出勤情形至分鐘,40000,
