主管機關,公告日期,處分日期,處分字號,事業單位名稱或負責人,違法法規法條,違反法規內容,罰鍰金額,備註說明
職業安全衛生署,20170901,20170519,勞職授字第1060202279號,茂原營造有限公司,營造安全衛生設施標準第19條第1項暨職業安全衛生法第6條第1項,對於高度2公尺以上之樓梯開口部分等場所作業，勞工有遭受墜落危險之虞，未於該處設置護欄、護蓋或安全網等防護設備。,,
職業安全衛生署,20170901,20170519,勞職授字第1060202279號,茂原營造有限公司,營造安全衛生設施標準第19條第1項暨職業安全衛生法第6條第1項,對於高度2公尺以上之樓梯開口部分等場所作業，勞工有遭受墜落危險之虞，未於該處設置護欄、護蓋或安全網等防護設備。,,
職業安全衛生署,20190110,20181005,勞職授字第1070204898號,茂原營造有限公司,營造安全衛生設施標準第11條之1暨職業安全衛生法第6條第1項,對於進入營繕工程工作場所作業人員，未提供適當安全帽，並使其正確戴用,,
高雄市,20211007,20210811,高市勞條字第11035915100號,茂原營造有限公司蘇金貴,勞動基準法第22條第2項;勞動基準法第23條第2項勞動基準法勞動基準法勞動基準法,工資未全額直接給付勞工;未依規定置備勞工工資清冊,40000,
高雄市,20211007,20210811,高市勞條字第11035915100號,茂原營造有限公司蘇金貴,勞動基準法第22條第2項;勞動基準法第23條第2項勞動基準法勞動基準法勞動基準法,工資未全額直接給付勞工;未依規定置備勞工工資清冊,40000,
