主管機關,公告日期,處分日期,處分字號,事業單位名稱或負責人,違法法規法條,違反法規內容,罰鍰金額,備註說明
加工出口區管理處,20230905,20230823,經加高四字第1120101475號,華東科技股份有限公司焦佑衡,勞動基準法第38條第2項,勞工之特別休假期日未由勞工自行排定,20000,
加工出口區管理處,20230901,20230823,經加高四字第1120101475號,華東科技股份有限公司焦佑衡,性別工作平等法第21條第1項,未依法給足正常工時10小時勞工生理假時數,,
產業園區管理局,20240510,20240419,經園高環字第1130101023號,華東科技股份有限公司焦佑衡,特定化學物質危害預防標準第23調暨職業安全衛生法第6條第1項,處置丙類第一種或丁類物質，合計在一百公升以上時，未置備該物質等漏洩時能迅速告知有關人員之警報用器具及除卻危害之必要藥劑、器具等設施。,,
產業園區管理局,20240603,20240529,經園高環字第1130101394號,華東科技股份有限公司焦佑衡,勞動基準法第24條第1項;勞動基準法第32條第2項;勞動基準法第35條,延長工作時間未依規定加給工資;延長工作時間超過法令規定;使勞工繼續工作4小時未有至少30分鐘之休息,140000,
產業園區管理局,20241204,20241114,經園高環字第1130103047號,華東科技股份有限公司焦佑衡,勞動基準法第24條第1項;勞動基準法第24條第2項,未依規定給付工作日加班費;未依規定給付休息日加班費,100000,
