主管機關,公告日期,處分日期,處分字號,事業單位名稱或負責人,違法法規法條,違反法規內容,罰鍰金額,備註說明
台南市,20160210,20160107,府勞條字第1050032276號,華美光學科技股份有限公司陳志銘,勞動基準法第32條第2項,延長工作時間超過法令規定;,,
職業安全衛生署,20160623,20160427,勞職授字第1050201432號,華美光學科技股份有限公司,有機溶劑中毒預防規則第25條第1項第1款暨職業安全衛生法第6條第1項,廠內噴漆區於室內儲藏有機溶劑或其混存物(油漆)時，未使用備有栓蓋之堅固容器，以免有機溶劑或其混存物之溢出、漏洩、滲洩或擴散。,,
台南市,20170610,20170511,府勞條字第1060453822號,華美光學科技股份有限公司陳志銘,勞動基準法第32條第2項,延長工作時間超過法令規定,,
職業安全衛生署,20220601,20220304,勞職授字第1110201079號,華美光學科技股份有限公司陳志銘,機械設備器具安全標準第95條；職業安全衛生設施規則第104條第1項暨職業安全衛生法第6條第1項,內圓研磨機以外之研磨輪，未設置護罩，並具有第九十六條至第一百零四條所定之性能；桌上用研磨機及床式研磨機使用之護罩，未以設置舌板或其他方法，使研磨之必要部分之研磨輪周邊與護罩間之間隙可調整在十毫米以下。,,
職業安全衛生署,20240910,20240701,勞職授字第1130204964A號,華美光學科技股份有限公司陳志銘,職業安全衛生法第27條第1項,事業單位與承攬人分別僱用勞工共同作業時，為防止職業災害，原事業單位未採取下列必要措施：一、設置協議組織，並指定工作場所負責人，擔任指揮、監督及協調之工作。二、工作之連繫與調整。三、工作場所之巡視。,,謝俊傑
職業安全衛生署,20240910,20240701,勞職授字第1130204964號,華美光學科技股份有限公司陳志銘,職業安全衛生法第26條第1項,事業單位以其事業之全部或一部分交付承攬時，未於事前告知該承攬人有關其事業工作環境、危害因素暨本法及有關安全衛生規定應採取之措施。,,謝俊傑
