主管機關,公告日期,處分日期,處分字號,事業單位名稱或負責人,違法法規法條,違反法規內容,罰鍰金額,備註說明
台北市,20230705,20230503,府勞職字第11260651341號,萬松營造股份有限公司鄭有文,營造安全衛生設施標準第19條第1項暨職業安全衛生法第6條第1項第13款,有墜落危險之處所未設防護設備。,,
台北市,20240305,20240105,北市勞職字第11261237031號,萬松營造股份有限公司鄭有文,營造安全衛生設施標準第19條第1項暨職業安全衛生法第6條第1項第13款;職業安全衛生設施規則第228條暨職業安全衛生法第6條第1項第13款,有墜落危險之處所未設防護設備。;未設置安全上下之設備。,,
台北市,20230705,20230503,府勞職字第11260651341號,萬松營造股份有限公司鄭有文,營造安全衛生設施標準第19條第1項暨職業安全衛生法第6條第1項第13款,有墜落危險之處所未設防護設備。,,
台北市,20240305,20240105,北市勞職字第11261237031號,萬松營造股份有限公司鄭有文,營造安全衛生設施標準第19條第1項暨職業安全衛生法第6條第1項第13款;職業安全衛生設施規則第228條暨職業安全衛生法第6條第1項第13款,有墜落危險之處所未設防護設備。;未設置安全上下之設備。,,
新北市,20250421,20250227,新北府勞檢字第1144665344號,萬松營造股份有限公司鄭有文,職業安全衛生法第6條第1項,未符合規定之必要安全衛生設備及措施,,
