主管機關,公告日期,處分日期,處分字號,事業單位名稱或負責人,違法法規法條,違反法規內容,罰鍰金額,備註說明
台南市,20160110,20151130,府勞條字第1041166501號,葉信工業股份有限公司薛佳文,勞動基準法第32條第2項;勞動基準法第70條,延長工作時間超過法令規定;工作規則未依規定報備並公告揭示;,,
台南市,20200110,20191213,南市勞安字第1081423231號,葉信工業股份有限公司薛佳文,勞動基準法第35條,繼續工作四小時未有三十分鐘休息。,,
台南市,20190310,20190211,府勞檢字第1080145316號,葉信工業股份有限公司薛佳文,勞動基準法第24條;勞動基準法第30條第6項,延長工作時間未依規定加給工資;未逐日記載勞工出勤情形至分鐘為止,,
職業安全衛生署,20210601,20210331,勞職授字第1100201664號,葉信工業股份有限公司,職業安全衛生設施規則第243條第1項暨職業安全衛生法第6條第1項,雇主未於各該電動機具設備之連接電路上設置適合其規格，具有高敏感度、高速型，能確實動作之防止感電用漏電斷路器：使用對地電壓在一百五十伏特以上移動式或攜帶式電動機具。,,
職業安全衛生署,20230907,20230619,勞職授字第1120203043號,葉信工業股份有限公司薛佳文,職業安全衛生設施規則第57條第1項、職業安全衛生設施規則第82條第1項暨職業安全衛生法第6條第1項,對於機械之掃除、上油、檢查、修理或調整有導致危害勞工之虞者，未停止相關機械運轉及送料；對於射出成型機、鑄鋼造形機、打模機、橡膠加硫成型機、輪胎成型機及其他加壓成型之機械等，有危害勞工之虞者，未設置安全門、雙手操作式安全裝置、感應式安全裝置或其他安全裝置。,,
職業安全衛生署,20240607,20240418,勞職授字第1130203665A號,葉信工業股份有限公司薛佳文,職業安全衛生法第37條第2項第3款,事業單位勞動場所發生下列職業災害之一者，雇主未於八小時內通報勞動檢查機構：一、...三、發生災害之罹災人數在一人以上，且需住院治療。...。,,謝俊傑
職業安全衛生署,20240607,20240418,勞職授字第1130203665號,葉信工業股份有限公司薛佳文,職業安全衛生設施規則第57條第1項暨職業安全衛生法第6條第1項,對於衝剪機械鋁屑掃除作業，未停止相關機械運轉及送料。,,謝俊傑
職業安全衛生署,20240607,20240429,勞職授字第1130204080號,葉信工業股份有限公司薛佳文,職業安全衛生設施規則第285條暨職業安全衛生法第6條第1項,雇主對於熔礦爐、熔鐵爐、玻璃熔解爐、或其他高溫操作場所，為防止爆炸或高熱物飛出，未有適當防護裝置及置備適當之防護具外，並使勞工確實使用。,,林聖壹
