主管機關,公告日期,處分日期,處分字號,事業單位名稱或負責人,違法法規法條,違反法規內容,罰鍰金額,備註說明
台北市,20170117,20161101,北市勞職字第10542941700號,藝潔事業有限公司,職業安全衛生設施規則第281條第1項暨職業安全衛生法第6條第1項第5款。,對於高度2公尺以上之作業，勞工有墜落之虞者，未使勞工確實使用安全帶。,,
勞動部勞工保險局,20210217,20201222,保退一字第10969911125號,藝潔事業有限公司吳秋安,勞工退休金條例第19條第1項,雇主未按時繳納勞工退休金致加徵滯納金。,8568,
台北市,20200904,20200601,北市勞職字第10960798651號,藝潔事業有限公司,職業安全衛生設施規則第281條第1項暨職業安全衛生法第6條第1項第5款;吊籠安全檢查構造標準第44條暨職業安全衛生法第6條第1項第5款,2公尺作業未使用安全帶、帽。;吊籠鋼索與突出物磨擦或接觸銳邊。,,
勞動部勞工保險局,20210412,20210224,保退一字第11069911025號,藝潔事業有限公司吳秋安,勞工退休金條例第19條第1項,雇主未按時繳納勞工退休金致加徵滯納金。,11471,
勞動部勞工保險局,20210610,20210422,保退一字第11069911045號,藝潔事業有限公司吳秋安,勞工退休金條例第19條第1項,雇主未按時繳納勞工退休金致加徵滯納金。,2742,
