主管機關,公告日期,處分日期,處分字號,事業單位名稱或負責人,違法法規法條,違反法規內容,罰鍰金額,備註說明
台北市,20160830,20160628,北市勞動字第10530482700號,衛豐保全股份有限公司王慧明,勞動基準法第24條,延長工作時間未依規定加給工資,,
桃園市,20160710,20160624,105年府勞條字1050154596號,衛豐保全股份有限公司王慧明,勞基法第32條第2項,延長工作時間超過法令規定,,
桃園市,20161210,20161117,105年府勞檢字10502814151號,衛豐保全股份有限公司韋格斯,勞基法第39條,假日工資未給或於休假日工作未依規定加給工資,,
台北市,20160830,20160628,北市勞動字第10530482700號,衛豐保全股份有限公司王慧明,勞動基準法第24條,延長工作時間未依規定加給工資,,
桃園市,20160710,20160624,105年府勞條字1050154596號,衛豐保全股份有限公司王慧明,勞基法第32條第2項,延長工作時間超過法令規定,,
桃園市,20161210,20161117,105年府勞檢字10502814151號,衛豐保全股份有限公司韋格斯,勞基法第39條,假日工資未給或於休假日工作未依規定加給工資,,
台北市,20211105,20210929,北市勞動字第11060254661號,衛豐保全股份有限公司范詩艷,勞動基準法第23條第1項,工資未定期給付勞工，或未提供工資各項目計算方式明細,20000,
桃園市,20220902,20220707,111年府勞條字1110181182號,衛豐保全股份有限公司范詩艷,勞基法第21條第1項,未達基本工資,20000,
