主管機關,公告日期,處分日期,處分字號,事業單位名稱或負責人,違法法規法條,違反法規內容,罰鍰金額,備註說明
職業安全衛生署,20220408,20220121,勞職授字第1110200310號,裕弘營造股份有限公司張江文,營造安全衛生設施標準第19條第1項暨職業安全衛生法第6條第1項,對於高度2公尺以上之外牆施工架工作臺及天井施工架工作臺作業場所，勞工有遭受墜落危險之虞，未於該處外牆施工架工作臺設置護欄(內側交叉拉桿及側下拉桿)、天井施工架工作臺設置護欄(內外側交叉拉桿及側下拉桿)。,,
職業安全衛生署,20221110,20220809,勞職授字第1110204453號,裕弘營造股份有限公司張江文,營造安全衛生設施標準第19條第1項暨職業安全衛生法第6條第1項,對於高度2公尺以上之外牆施工架工作臺及樓板開口部分作業場所，勞工有遭受墜落危險之虞，未於外牆施工架工作臺設置護欄(內側交叉拉桿及下拉桿)及樓板開口部分設置護欄、護蓋或安全網等防護設備。,,
職業安全衛生署,20230410,20230131,勞職授字第1120200377號,裕弘營造股份有限公司張江文,營造安全衛生設施標準第19條第1項暨職業安全衛生法第6條第1項,對於高度2公尺以上之施工架工作臺等場所，勞工有遭受墜落危險之虞，未於施工架工作臺設置護欄(內側交叉拉桿及內、外側下拉桿)。,,
職業安全衛生署,20230810,20230501,勞職授字第1120202193號,裕弘營造股份有限公司張江文,營造安全衛生設施標準第19條第1項暨職業安全衛生法第6條第1項,對於高度2公尺以上之外牆施工架工作臺、陽台開口部分作業場所，勞工有遭受墜落危險之虞，未於外牆施工架工作臺設置護欄(內外側交叉拉桿及下拉桿)及於陽台開口部分設置護欄、護蓋或安全網等防護設備。,,
台中市,20240310,20240227,府授勞檢字第1130048919號,裕弘營造股份有限公司張江文,職業安全衛生法第6條第1項,未符合規定之必要安全衛生設備及措施,,
台中市,20240812,20240712,府授勞檢字第1130192022號,裕弘營造股份有限公司張江文,職業安全衛生法第6條第1項,未符合規定之必要安全衛生設備及措施,,
