主管機關,公告日期,處分日期,處分字號,事業單位名稱或負責人,違法法規法條,違反法規內容,罰鍰金額,備註說明
新北市,20180815,20180604,新北府勞檢字第10735677071號,視茂股份有限公司,勞動基準法第32條第2項,延長工作時間超過法令規定,,
新北市,20180815,20180604,新北府勞檢字第1073567707號,視茂股份有限公司,勞動基準法第24條,延長工作時間未依規定加給工資,,
新北市,20220218,20211119,新北府勞檢字第1104746534號,視茂股份有限公司傅孫嘉,勞動基準法第24條,延長工作時間未依規定加給工資,20000,
新北市,20220218,20211119,新北府勞檢字第1104746534號,視茂股份有限公司傅孫嘉,勞動基準法第24條,延長工作時間未依規定加給工資,20000,
新北市,20220819,20220609,新北府勞檢字第1114747322號,視茂股份有限公司傅孫嘉,勞動基準法第30條第6項,出勤紀錄未依規定應逐日記載勞工出勤情形至分鐘,20000,
新北市,20220819,20220609,新北府勞檢字第1114747322號,視茂股份有限公司傅孫嘉,勞動基準法第30條第6項,出勤紀錄未依規定應逐日記載勞工出勤情形至分鐘,20000,
