主管機關,公告日期,處分日期,處分字號,事業單位名稱或負責人,違法法規法條,違反法規內容,罰鍰金額,備註說明
職業安全衛生署,20150917,20150720,勞職授字第1040202286號,詮順營造有限公司,營造安全衛生設施標準第19條第1項暨職業安全衛生法第6條第1項,對於高度2公尺以上之(窗戶)開口部分場所作業，勞工有遭受墜落危害之虞者，未依規定設置護欄、護蓋或安全網等防護設備。,,
職業安全衛生署,20150917,20150720,勞職授字第1040202287號,詮順營造有限公司,職業安全衛生法第27條第1項第1、2、3、4款,與該承攬人分別僱用勞工共同作業時，未設置協議組織，未指定工作場所負責人擔任指揮、監督及協調之工作；對於高度2公尺以上之窗戶開口部分從事窗戶嵌縫作業，未依規定「確實巡視」；未對該工作場所墜落危害「連繫調整」其工作逤必要之安全防護設備或措施；未對承攬人提供所需要安全衛生教育訓練之指導及協助。,,
職業安全衛生署,20150917,20150720,勞職授字第1040202286號,詮順營造有限公司,營造安全衛生設施標準第19條第1項暨職業安全衛生法第6條第1項,對於高度2公尺以上之(窗戶)開口部分場所作業，勞工有遭受墜落危害之虞者，未依規定設置護欄、護蓋或安全網等防護設備。,,
職業安全衛生署,20150917,20150720,勞職授字第1040202287號,詮順營造有限公司,職業安全衛生法第27條第1項第1、2、3、4款,與該承攬人分別僱用勞工共同作業時，未設置協議組織，未指定工作場所負責人擔任指揮、監督及協調之工作；對於高度2公尺以上之窗戶開口部分從事窗戶嵌縫作業，未依規定「確實巡視」；未對該工作場所墜落危害「連繫調整」其工作逤必要之安全防護設備或措施；未對承攬人提供所需要安全衛生教育訓練之指導及協助。,,
勞動部勞工保險局,20221212,20221026,保退一字第11169911105號,詮順營造有限公司顏全興,勞工退休金條例第19條第1項,雇主未按時繳納勞工退休金致加徵滯納金。,2578,
