主管機關,公告日期,處分日期,處分字號,事業單位名稱或負責人,違法法規法條,違反法規內容,罰鍰金額,備註說明
台北市,20170209,20161226,北市勞職字第10543978000號,誠冠營造股份有限公司,職業安全衛生設施規則第225條第1項暨職業安全衛生法第6條第1項第5款。,對於在高度2公尺以上之處所作業，勞工有墜落之虞者，未以架設施工架或其他方法設置工作台。,,
台北市,20181001,20180719,北市勞職字第10760210092號,誠冠營造股份有限公司,職業安全衛生法第27條第1項第2、3款,原事業單位未採取承攬管理必要措施。,,
台北市,20181201,20180920,北市勞職字第10760544471號,誠冠營造股份有限公司,1.營造安全衛生設施標準第19條第1項暨職業安全衛生法第6條第1項第5款;2.職業安全衛生法第37條第2項第3款,1.有墜落危險之處所未設防護設備。;2.發生職業災害未於8小時內通報。,,
桃園市,20180410,20180214,府勞檢字第1070039059號,誠冠營造股份有限公司傅文宏,職業安全衛生設施規則第230條第1項第3款暨職業安全衛生法第6條第1項;職業安全衛生設施規則第243條第1項暨職業安全衛生法第6條第1項;營造安全衛生設施標準第11條之1暨職業安全衛生法第6條第1項,雇主對於使用之合梯，應符合下列規定：一、…。三、梯腳與地面之角度應在七十五度以內，且兩梯腳間有金屬等硬質繫材扣牢，腳部有防滑絕緣腳座套。四、…。;雇主對於使用對地電壓在一百五十伏特以上移動式或攜帶式電動機具，或於含水或被其他導電度高之液體濕潤之潮濕場所、金屬板上或鋼架上等導電性良好場所使用移動式或攜帶式電動機具，為防止因漏電而生感電危害，應於各該電動機具之連接電路上設置適合其規格，具有高敏感度、高速型，能確實動作之防止感電用漏電斷路器。;雇主對於進入營繕工程工作場所作業人員，應提供適當安全帽，並使其正確戴用。,,
台北市,20200401,20200117,北市勞職字第10861173041號,誠冠營造股份有限公司,營造安全衛生設施標準第11-1條暨職業安全衛生法第6條第1項第1、3、5款,未提供安全帽使正確戴用。,,
職業安全衛生署,20220104,20211005,勞職授字第1100205070號,誠冠營造股份有限公司林家妙,職業安全衛生法第27條第1項第2款、第3款,與承攬人分別僱用勞工共同作業時，未採取工作之連繫與調整之必要措施、未巡視工作場所。,,
