主管機關,公告日期,處分日期,處分字號,事業單位名稱或負責人,違法法規法條,違反法規內容,罰鍰金額,備註說明
宜蘭縣,20161110,20161011,府勞資字第1050152943號,諾貝爾食品有限公司,勞基法第32條第2項;勞基法第36條,延長工時超過法定上限;勞工未每七日中至少有一日之休假作為例假,,
宜蘭縣,20161110,20161011,府勞資字第1050152943號,諾貝爾食品有限公司,勞基法第32條第2項;勞基法第36條,延長工時超過法定上限;勞工未每七日中至少有一日之休假作為例假,,
宜蘭縣,20210504,20210312,府勞資字第1090197529號,諾貝爾食品有限公司張智聰,勞動基準法第22條第2項;勞動基準法第24條第1項;勞動基準法第24條第2項;勞動基準法第32條第2項;勞動基準法第36條第1項;勞動基準法第70條,工資未全額給付;延長工作時間未依規定加給工資;休息日出勤工作未依規定加給工資;延長工作時間超過法定上限;使勞工連續出勤10天;未依法訂立工作規則，報請主管機關核備後並公開揭示之。,120000,
宜蘭縣,20220105,20211115,府勞資字第1100173015號,諾貝爾食品有限公司張智聰,勞動基準法第32條第2項;勞動基準法第36條第1項,延長工作時間超過法定上限;使勞工連續出勤7天以上,80000,
宜蘭縣,20240508,20240415,府勞資字第1130036471號,諾貝爾食品有限公司張智聰,勞動基準法第32條第2項,延長工作時間超過法定上限,20000,
職業安全衛生署,20250315,20250211,勞職授字第1140250459號,諾貝爾食品有限公司張智聰,職業安全衛生設施規則第239條暨職業安全衛生法第6條第1項,雇主使用之電氣器材及電線等，未符合國家標準規格。,,
