主管機關,公告日期,處分日期,處分字號,事業單位名稱或負責人,違法法規法條,違反法規內容,罰鍰金額,備註說明
台北市,20180801,20180627,北市勞動字第10760024051號,辰揚環保股份有限公司劉翰辰,勞動基準法第7條第1項;勞動基準法第22條第2項;勞動基準法第37條;勞動基準法第24條第2項;勞動基準法第36條第1項;勞動基準法第38條第1項,未按規定置備勞工名卡;工資未全額給付給勞工;依規定應放假之日未予休假;未依法給付休息日工作之工資;未使勞工每7日中有2日之休息，其中1日為例假，1日為休息日;未依規定給予特別休假,,
台北市,20180801,20180627,北市勞動字第10760024051號,辰揚環保股份有限公司劉翰辰,勞動基準法第7條第1項;勞動基準法第22條第2項;勞動基準法第37條;勞動基準法第24條第2項;勞動基準法第36條第1項;勞動基準法第38條第1項,未按規定置備勞工名卡;工資未全額給付給勞工;依規定應放假之日未予休假;未依法給付休息日工作之工資;未使勞工每7日中有2日之休息，其中1日為例假，1日為休息日;未依規定給予特別休假,,
新北市,20200221,20191212,新北府勞檢字第10842864651號,辰揚環保股份有限公司,勞動基準法第32條第2項,延長工作時間超過法令規定,,
新北市,20200221,20191212,新北府勞檢字第10842864652號,辰揚環保股份有限公司,勞動基準法第36條第1項,每七日中未有一日之休息作為例假,,
新北市,20200221,20191212,新北府勞檢字第10842864653號,辰揚環保股份有限公司,勞動基準法第39條,假日工資未給或於休假日工作未依規定加給工資,,
新北市,20200221,20191212,新北府勞檢字第1084286465號,辰揚環保股份有限公司,勞動基準法第24條,延長工作時間未依規定加給工資,,
勞動部勞工保險局,20240110,20231121,保退三字第11260187760號,辰揚環保股份有限公司劉翰辰,勞工退休金條例第15條第2項,雇主未依規定覈實申報調整勞工退休金提繳工資。,5000,
台中市,20240614,20240502,府授勞檢字第1130114689號,辰揚環保股份有限公司劉翰辰,職業安全衛生法第37條第2項,事業單位勞動場所發生職業災害，未於八小時內通報勞動檢查機構,,
