主管機關,公告日期,處分日期,處分字號,事業單位名稱或負責人,違法法規法條,違反法規內容,罰鍰金額,備註說明
職業安全衛生署,20160421,20160301,勞職授字第1050200643號,達昱營造有限公司,職業安全衛生設施規則第228條、營造安全衛生設施標準第19條第1項、第40條第1項、第45條第1項第3款暨職業安全衛生法第6條第1項,對於高差超過1.5公尺以上之施工架作業場所，未設置使勞工安全上下之設備；對於高度2公尺以上之施工架場所，勞工有遭受墜落危險之虞，未設置護欄、護蓋或安全網等防護設備；高度5公尺以上施工架，作業人員未事先就預期施工時之最大荷重，依結構力學原理妥為設計，置備施工圖說，並指派所僱之專任工程人員簽章確認強度計算書及施工圖說；施工架未在適當之垂直、水平距離處與構造物妥實連接。,,
職業安全衛生署,20170110,20161110,勞職授字第1050204227號,達昱營造有限公司,營造安全衛生設施標準第19條第1項、職業安全衛生設施規則第243條第1項暨職業安全衛生法第6條第1項,對於高度2公尺以上之開口部分，勞工有遭受墜落危險之虞，未設置護欄及安全網等防護設備；對於使用對地電壓在150伏特以上之臨時電箱(220V)，未於各該電動機具之連接電路上設置適合其規格，具有高敏感度、高速型，能確實動作之防止感電用漏電斷路器。,,
職業安全衛生署,20170210,20161205,勞職授字第1050204403號,達昱營造有限公司,營造安全衛生設施標準第19條第1項、職業安全衛生設施規則第228條暨職業安全衛生法第6第1項,對於高度2公尺以上之鋼構開口部分等場所，勞工有遭受墜落危險之虞，未設置護欄、護蓋或安全網等防護設備；對於高差超過1.5公尺以上之場所作業，未設置使勞工安全上下之設備。,,
職業安全衛生署,20170420,20170202,勞職授字第1060200314號,達昱營造有限公司,營造安全衛生設施標準第19條第1項,對於高度2公尺以上之施工架開口部分等場所作業，勞工有遭受墜落危險之虞，未設置護欄、護蓋或安全網等防護設備。,,
職業安全衛生署,20170603,20170313,勞職授字第1060201105號,達昱營造有限公司,營造安全衛生設施標準第19條第1項暨職業安全衛生法第6條第1項,對於高度2公尺以上外牆施工架開口部分作業，勞工有遭受墜落危險之虞，未設置護欄、護蓋或安全網等防護設備。,,
