主管機關,公告日期,處分日期,處分字號,事業單位名稱或負責人,違法法規法條,違反法規內容,罰鍰金額,備註說明
台北市,20170901,20170717,北市勞職字第10635326002號,達盛鋼鐵有限公司,營造安全衛生設施標準第19條第1項暨職業安全衛生法第6條第1項第5款。,對於高度2公尺以上之開口部分從事作業，未於開口處設置護欄、護蓋或安全網等防護設備，使勞工有遭受墜落危險之虞。,,
台北市,20210105,20201023,北市勞職字第10961061923號,達盛鋼鐵有限公司,營造安全衛生設施標準第19條第2項暨職業安全衛生法第6條第1項第5款,未使用安全帶等防墜措施。,,
台北市,20210505,20210217,北市勞職字第11060527433號,達盛鋼鐵有限公司,職業安全衛生法第6條第1項+營造安全衛生設施標準第11-1條,未提供安全帽使正確戴用。,,
台北市,20220705,20220408,北市勞職字第11160417203號,達盛鋼鐵有限公司李鳳琴,營造安全衛生設施標準第129條第7款暨職業安全衛生法第6條第1項5款,鋼筋混凝土作業未依規定辦理。,,
台北市,20230505,20230316,府勞職字第11260577363號,達盛鋼鐵有限公司李鳳琴,營造安全衛生設施標準第11-1條暨職業安全衛生法第6條第1項第1款、第3款、第5款,未提供安全帽使正確戴用。,,
