主管機關,公告日期,處分日期,處分字號,事業單位名稱或負責人,違法法規法條,違反法規內容,罰鍰金額,備註說明
台北市,20151105,20150903,府勞職字第10436966102號,達詮有限公司,職業安全衛生設施規則第281條第1項暨職業安全衛生法第6條第1項第5款,於高度2公尺以上之之高處作業，勞工有遭受墜落危險之虞者之工作場所，未使勞工確實使用安全帶、安全帽等必要之防護具。,,
台北市,20170801,20170626,北市勞職字第10635202200號,達詮有限公司,職業安全衛生設施規則第263條暨職業安全衛生法第6條第1項第3款。,對於電氣機具電路之接近場所從事作業，未設置護圍或於該電路四周裝置絕緣用防護裝備或採取移開該電路之措施。,,
台北市,20180223,20171201,北市勞職字第10641324402號,達詮有限公司,職業安全衛生設施規則第281條第1項暨職業安全衛生法第6條第1項第5款。,使勞工於高度2公尺以上從事作業，勞工有墜落之虞，未使勞工確實使用安全帶。,,
科技部新竹科學園區,20171003,20170921,竹環字第1060026678號,達詮有限公司廖仲偉,營造安全衛生設施標準第45條第1項第3款暨職業安全衛生法第6條第1項,施工架之垂直方向5.5公尺、水平方向7.5公尺內，未與構造物妥實連接，有立即發生倒塌、崩塌危險之虞。,,
台北市,20180523,20180301,北市勞職字第10731303202號,達詮有限公司,營造安全衛生設施標準第19條第1項暨職業安全衛生法第6條第1項第5款。,對於高度2公尺以上之開口部分從事作業，未於開口處設置護欄、護蓋或安全網等防護設備，使勞工有遭受墜落危險之虞。,,
台北市,20200605,20200327,北市勞職字第10960478353號,達詮有限公司,營造安全衛生設施標準第19條第1項暨職業安全衛生法第6條第1項第5款;職業安全衛生設施規則第90條暨職業安全衛生法第6條第1項第5款,有墜落危險之處所未設防護設備。;起重機具吊鉤或吊具未有防脫落裝置。,,
職業安全衛生署,20230109,20221020,勞職授字第11102060371號,達詮有限公司廖仲偉,職業安全衛生設施規則第281條第1項暨職業安全衛生法第6條第1項,對於在高度二公尺以上之高處作業，勞工有墜落之虞者，未使勞工確實使用安全帶、安全帽及其他必要之防護具，但經雇主採安全網等措施者，不在此限。,,
台北市,20230905,20230731,府勞職字第1126078409F號,達詮有限公司廖仲偉,營造安全衛生設施標準第19條第1項暨職業安全衛生法第6條第1項第5款,有墜落危險之處所未設防護設備。,,
新北市,20231215,20231006,新北府勞檢字第1124681903號,達詮有限公司廖仲偉,職業安全衛生法第6條第1項,未符合規定之必要安全衛生設備及措施,,
