主管機關,公告日期,處分日期,處分字號,事業單位名稱或負責人,違法法規法條,違反法規內容,罰鍰金額,備註說明
職業安全衛生署,20190910,20190510,勞職授字第1080201860號,鉅鑫天車有限公司,職業安全衛生法第24條,設置吊升荷重3公噸以上之固定式起重機，係屬中央主管機關指定具有危險性之機械，其操作人員未經中央主管機關指定認可之訓練或經技能檢定合格即行操作。,,
勞動部勞工保險局,20201012,20200821,保退一字第10969911085號,鉅鑫天車有限公司許秝靚,勞工退休金條例第19條第1項,雇主未按時繳納勞工退休金致加徵滯納金。,10355,
彰化縣,20211105,20210802,府勞動字第1100266358號,鉅鑫天車有限公司許秝靚,勞動基準法第59條第2款,勞工在醫療中不能工作時，雇主未依規定按其原領工資數額予以補償。,20000,
彰化縣,20211105,20210802,府勞動字第1100266358號,鉅鑫天車有限公司許秝靚,勞動基準法第59條第2款,勞工在醫療中不能工作時，雇主未依規定按其原領工資數額予以補償。,20000,
職業安全衛生署,20210908,20210506,勞職授字第1100202415號,鉅鑫天車有限公司,職業安全衛生法第16條第1項,設置吊升荷重3公噸以上之固定式起重機，係屬中央主管機關指定具有危險性之機械，未經勞動檢查機構或中央主管機關指定之代行檢查機構檢查合格，即行使用。,,
職業安全衛生署,20211006,20210609,勞職授字第11002028151號,鉅鑫天車有限公司,職業安全衛生設施規則第224條、第228條、第281條第1項暨職業安全衛生法第6條第1項,使勞工在高度2公尺以上之高處作業，勞工有墜落之虞，未使勞工確實使用安全帶、安全帽及其他必要之防護具，致發生職業安全衛生法第37條第2項之職業災害；另高度2公尺以上之工作場所邊緣及開口部分，勞工有遭受墜落危險之虞，未設有適當強度之護欄，且高差超過1.5公尺以上之場所，未設置使勞工安全上下之設備。,,
職業安全衛生署,20211006,20210609,勞職授字第1100202815號,鉅鑫天車有限公司,職業安全衛生法第37條第2項,勞動場所發生罹災人數在1人以上，且需住院治療之職業災害，未於8小時內通報勞動檢查機構。,,
職業安全衛生署,20230310,20221226,勞職授字第11102071682號,鉅鑫天車有限公司許秝靚,職業安全衛生法第26條第2項,承攬人就其承攬之全部或一部分交付再承攬時，承攬人未於事前告知該承攬人有關其事業工作環境、危害因素暨本法及有關安全衛生規定應採取之措施。,,
