主管機關,公告日期,處分日期,處分字號,事業單位名稱或負責人,違法法規法條,違反法規內容,罰鍰金額,備註說明
職業安全衛生署,20171121,20170831,勞職授字第1060203881號,銘登營造有限公司,營造安全衛生設施標準第19條第1項、第129條第1項第9款、職業安全衛生設施規則第228條職業安全衛生法第6條第1項,對於高度2公尺以上之施工架開口部分場所作業，未於該處設置護欄、護蓋或安全網等防護設備；對勞工於高差超過1.5公尺以上之施工架場所作業時，未設置使勞工安全上下之設備；暴露之鋼筋，未將尖端彎曲或加蓋。,,
職業安全衛生署,20171121,20170831,勞職授字第1060203881號,銘登營造有限公司,營造安全衛生設施標準第19條第1項、第129條第1項第9款、職業安全衛生設施規則第228條職業安全衛生法第6條第1項,對於高度2公尺以上之施工架開口部分場所作業，未於該處設置護欄、護蓋或安全網等防護設備；對勞工於高差超過1.5公尺以上之施工架場所作業時，未設置使勞工安全上下之設備；暴露之鋼筋，未將尖端彎曲或加蓋。,,
高雄市,20181207,20180705,高市勞條字第10734642700號,銘登營造有限公司董榮進,勞動基準法第24條;勞動基準法第36條,延長工作時間未依規定加給工資;未使勞工每七日中有二日之休息，其中一日為例假，一日為休息日,,
高雄市,20181207,20180705,高市勞條字第10734642700號,銘登營造有限公司董榮進,勞動基準法第24條;勞動基準法第36條,延長工作時間未依規定加給工資;未使勞工每七日中有二日之休息，其中一日為例假，一日為休息日,,
高雄市,20230310,20221013,高市勞檢字第11171873000號,銘登營造有限公司董榮進,職業安全衛生法第6條第1項第5款,對於高度約2.3公尺之棄土坑未設置護欄。,,
高雄市,20250210,20240321,高市勞檢字第11370496000號,銘登營造有限公司董榮進,職業安全衛生法第6條第1項第5款,對於施工構台至地下一樓之高差超過1.5公尺以上之場所作業時，未設置使勞工安全上下之設備。,,
