主管機關,公告日期,處分日期,處分字號,事業單位名稱或負責人,違法法規法條,違反法規內容,罰鍰金額,備註說明
職業安全衛生署,20201008,20200709,勞職授字第1090202845號,鑫德水泥製品有限公司,職業安全衛生設施規則第241條暨職業安全衛生法第6條第1項,對於電氣機具之帶電部分，如勞工於作業中或通行時，有因接觸或接近致發生感電之虞者，未設防止感電之護圍或絕緣被覆。,,
職業安全衛生署,20210401,20210122,勞職授字第1090200213號,鑫德水泥製品有限公司,職業安全衛生設施規則第50條第1項第1款暨職業安全衛生法第6條第1項,動力傳動裝置之轉軸、離地二公尺以內之轉軸或附近有勞工工作或通行而有接觸之危險者，未有適當之圍柵，掩蓋護網或套管。,,
職業安全衛生署,20211101,20210826,勞職授字第1100204422號,鑫德水泥製品有限公司,職業安全衛生設施規則第43條第1項暨職業安全衛生法第6條第1項,雇主對於機械之原動機、轉軸、齒輪、帶輪、飛輪、傳動輪、傳動帶等有危害勞工之虞之部分，未有護罩、護圍、套胴、跨橋等設備。,,
職業安全衛生署,20220401,20220126,勞職授字第11102001461號,鑫德水泥製品有限公司周季璿,職業安全衛生設施規則第281條第1項暨職業安全衛生法第6條第1項,勞工發生墜落，致職業安全衛生法第37條第2項之職業災害。,,
職業安全衛生署,20220401,20220126,勞職授字第1110200146號,鑫德水泥製品有限公司周季璿,勞工健康保護規則第15條第1項暨職業安全衛生法第20條第1項,雇主對在職勞工，未依下列規定，定期實施一般健康檢查：一、年滿六十五歲者，每年檢查一次。二、四十歲以上未滿六十五歲者，每三年檢查一次。三、未滿四十歲者，每五年檢查一次。,,
