主管機關,公告日期,處分日期,處分字號,事業單位名稱或負責人,違法法規法條,違反法規內容,罰鍰金額,備註說明
台北市,20150907,20150702,府勞職字第10434580102號,長屏企業股份有限公司,營造安全衛生設施標準第19條第1項暨職業安全衛生法第6條第1項第5款,對於高度2公尺以上之開口部分從事防火被覆作業，勞工有遭受墜落危險之虞者，未於開口處設置護欄、護蓋或安全網等防護設備。,,
職業安全衛生署,20191008,20190703,勞職授字第10802022792號,長屏企業股份有限公司,職業安全衛生設施規則第228條暨職業安全衛生法第6條第1項,"對於勞工使用高度1.5公尺以上之施工架從事輕鋼架隔間組裝作業,未於施工架設置安全上下設備。",,
台北市,20200805,20200519,北市勞職字第10960556645號,長屏企業股份有限公司,職業安全衛生設施規則第230條第1項第3款暨職業安全衛生法第6條第1項第5款,合梯未符合規定。,,
台北市,20200904,20200624,北市勞職字第1096082254C號,長屏企業股份有限公司,營造安全衛生設施標準第5條暨職業安全衛生法第6條第1項第13款,暴露鋼筋等材料未採取防護設施。,,
台北市,20211105,20210816,北市勞職字第11060785303號,長屏企業股份有限公司,營造安全衛生設施標準第11-1條暨職業安全衛生法第6條第1項第1、3、5款;職業安全衛生設施規則第41條第5款暨職業安全衛生法第6條第1項1款,未提供安全帽使正確戴用。;堆高機、研磨機等機具未依規定辦理。,,
