主管機關,公告日期,處分日期,處分字號,事業單位名稱或負責人,違法法規法條,違反法規內容,罰鍰金額,備註說明
職業安全衛生署,20171121,20170824,勞職授字第1060203349號,長榮空運倉儲股份有限公司,職業安全衛生設施規則第152條暨職業安全衛生法第6條第1項,於通道上有碰撞通道上其他物之虞，未事先清除通道之阻礙物及採取必要措施。,,
職業安全衛生署,20171121,20170824,勞職授字第1060203349號,長榮空運倉儲股份有限公司,職業安全衛生設施規則第152條暨職業安全衛生法第6條第1項,於通道上有碰撞通道上其他物之虞，未事先清除通道之阻礙物及採取必要措施。,,
桃園市,20181106,20180906,107年府勞檢字1070221883號,長榮空運倉儲股份有限公司林振才,勞基法第24條,延長工作時間未依規定加給工資,,
桃園市,20190606,20190424,108年府勞檢字1080094137號,長榮空運倉儲股份有限公司,勞基法第24條第1項,延長工作時間未依規定加給工資,,
桃園市,20190311,20190125,府勞檢字第1080022411號,長榮空運倉儲股份有限公司林振才,職業安全衛生設施規則第155條暨職業安全衛生法第6條第1項;職業安全衛生設施規則第116條第1款暨職業安全衛生法第6條第1項,雇主對於物料之搬運，應儘量利用機械以代替人力，凡四十公斤以上物品，以人力車輛或工具搬運為原則，五百公斤以上物品，以機動車輛或其他機械搬運為宜；運輸路線，應妥善規劃，並作標示。;雇主對於就業場所作業之車輛機械，應使駕駛者或有關人員負責執行下列事項：一、除非所有人員已遠離該機械（駕駛者等依規定就位者除外），否則不得起動。二、…。,,
桃園市,20210505,20210324,110年府勞檢字1100062196號,長榮空運倉儲股份有限公司李士亮,勞基法第32條第2項,延長工作時間超過法令規定,20000,
桃園市,20210705,20210517,府勞檢字第1100119850號,長榮空運倉儲股份有限公司李士亮,職業安全衛生設施規則第116條第15款暨職業安全衛生法第6條第1項,雇主對於勞動場所作業之車輛機械，應使駕駛者或有關人員負責執行下列事項：一、…。十五、車輛機械之作業或移動，有撞擊工作者之虞時，應置管制引導人員。,,
桃園市,20211210,20211001,府勞檢字第1100247283號,長榮空運倉儲股份有限公司李士亮,職業安全衛生設施規則第116條第15款暨職業安全衛生法第6條第1項,雇主對於勞動場所作業之車輛機械，應使駕駛者或有關人員負責執行下列事項：一、…。十五、車輛機械之作業或移動，有撞擊工作者之虞時，應置管制引導人員。,,
桃園市,20250109,20241129,府勞檢字第1130332730號,長榮空運倉儲股份有限公司李士亮,職業安全衛生設施規則第116條第1項第15款暨職業安全衛生法第6條第1項,雇主對於勞動場所作業之車輛機械，應使駕駛者或有關人員負責執行下列事項：一、…。十五、車輛機械之作業或移動，有撞擊工作者之虞時，應置管制引導人員。,,
