主管機關,公告日期,處分日期,處分字號,事業單位名稱或負責人,違法法規法條,違反法規內容,罰鍰金額,備註說明
職業安全衛生署,20180520,20180212,勞職授字第1070200603號,長立營造股份有限公司,職業安全衛生法第27條第1項第1、2、3,與承攬人共同作業時，未設置協議組織並指定工作場所負責人擔任指揮、未監督及協調之工作、未採取工作連繫與調整之必要措施、未巡視工作場所。,,
職業安全衛生署,20180520,20180212,勞職授字第1070200606號,長立營造股份有限公司,職業安全衛生設施規則第228條暨職業安全衛生法第6條第1項,對於RD1-1-30M道路過路箱涵高差超過1.5公尺以上，未設置使勞工安全上下之設備,,
職業安全衛生署,20180704,20180410,勞職授字第1070201558號,長立營造股份有限公司,營造安全衛生設施標準第5條暨職業安全衛生法第6條第1項,對於工作場所暴露之鋼筋材料等易生職業災害者，未採取彎曲尖端、加蓋或加裝護套等防護設施,,
職業安全衛生署,20201008,20200326,勞職授字第1090201205號,長立營造股份有限公司,職業安全衛生設施規則第243條第1款、營造安全衛生設施標準第11條之1、營造安全衛生設施標準第19條第1項、營造安全衛生設施標準第40條第1項第1款、營造安全衛生設施標準第45條第3款暨職業安全衛生法第6條第1項,工地使用220V水泥砂漿攪拌機工作場所，未於各該攪拌機之連接電路上設置適合其規格，具有高敏感度、高速型，能確實動作之防止感電用漏電斷路器；對於進入營繕工程工作場所作業人員，未提供適當安全帽，並使其正確戴用；對於高度二公尺以上之3F員工宿舍C外牆施工架及陽台開口部分等場所作業，勞工有遭受墜落危險之虞者，未於該處設置護欄、護蓋或安全網等防護設備；雇主對於高度五公尺以上4F露臺施工架之構築及拆除，未事先就預期施工時之最大荷重，依結構力學原理妥為設計，置備施工圖說，並指派所僱之專任工程人員簽章確認強度計算書及施工圖說；於辦公室外牆施工架之垂直方向五‧五公尺、水平方向七‧五公尺內，未與穩定構造物妥實連接,,
職業安全衛生署,20240309,20240122,勞職授字1130202392號,長立營造股份有限公司陳冠伶,營造安全衛生設施標準第19條第1項暨職業安全衛生法第6條第1項,對於高度2公尺以上之東側滯洪池機械清潔孔及頂板周圍開口部分等場所作業，未於該處設置護欄、護蓋或安全網等防護設備,,黃信章
