主管機關,公告日期,處分日期,處分字號,事業單位名稱或負責人,違法法規法條,違反法規內容,罰鍰金額,備註說明
台北市,20150505,20150326,府勞職字第10430565004號,開禾工程有限公司,職業安全衛生設施規則第230條第2項暨職業安全衛生法第6條第1項第5款,勞工以合梯當作二工作面之上下設備使用。,,
台北市,20150505,20150326,府勞職字第10430565004號,開禾工程有限公司,職業安全衛生設施規則第230條第2項暨職業安全衛生法第6條第1項第5款,勞工以合梯當作二工作面之上下設備使用。,,
台北市,20150505,20150326,府勞職字第10430565004號,開禾工程有限公司,職業安全衛生設施規則第230條第2項暨職業安全衛生法第6條第1項第5款,勞工以合梯當作二工作面之上下設備使用。,,
台北市,20201105,20200821,北市勞職字第10960904203號,開禾工程有限公司,營造安全衛生設施標準第11-1條暨職業安全衛生法第6條第1項第1、3、5款,未提供安全帽使正確戴用。,,
台北市,20210305,20201224,北市勞職字第10961214913號,開禾工程有限公司,職業安全衛生設施規則第230條第1項第3款暨職業安全衛生法第6條第1項第5款,合梯未符合規定。,,
台北市,20250205,20241203,北市勞職字第11361152755號,開禾工程有限公司鍾松吉,營造安全衛生設施標準第11-1條暨職業安全衛生法第6條第1項第1款、第3款、第5款,未提供安全帽使正確戴用。,,
