主管機關,公告日期,處分日期,處分字號,事業單位名稱或負責人,違法法規法條,違反法規內容,罰鍰金額,備註說明
台南市,20160210,20160114,府勞條字第1041245503號,開裕營造有限公司鄭守容,勞動基準法第30條第5項,未依規定置備勞工出勤紀錄表;,,
職業安全衛生署,20171121,20170817,勞職授字第1060203727號,開裕營造有限公司,營造安全衛生設施標準第11條之1暨職業安全衛生法第6條第1項,對於營造工地未使施作人員戴用安全帽。,,
台南市,20160210,20160114,府勞條字第1041245503號,開裕營造有限公司鄭守容,勞動基準法第30條第5項,未依規定置備勞工出勤紀錄表;,,
職業安全衛生署,20171121,20170817,勞職授字第1060203727號,開裕營造有限公司,營造安全衛生設施標準第11條之1暨職業安全衛生法第6條第1項,對於營造工地未使施作人員戴用安全帽。,,
職業安全衛生署,20200909,20200603,勞職授字第1090202241號,開裕營造有限公司,營造安全衛生設施標準第19條第1項暨職業安全衛生法第6條第1項,對於高度2公尺以上之9F~RF外牆施工架開口部分場所作業，未於該處設置護欄等防護設備,,
高雄市,20210802,20210114,高市勞檢字第11070066900號,開裕營造有限公司鄭守容,職業安全衛生法第6條第1項第5款,對於高度差2.2公尺之過牆管明挖洞道及電纜涵洞擋土支撐及每層高度差1.7公尺以上施工架之工作場所，未設置能使勞工安全上下之設備；對於高度約2.2公尺之過牆管明挖洞道及電纜涵洞擋土支撐、高度3.4公尺以上之施工架等作業場所，勞工有遭受墜落危險之虞，未於該處設置護欄、護蓋或安全網等防護設備；對於維持施工架之穩定，對於高度5.1公尺以上之多處施工架，未以斜撐材作適當而充分之支撐，在垂直方向5.5公尺、水平方向7.5公尺內，與穩定構造物妥實連接。,,
高雄市,20211102,20210407,高市勞檢字第11070611000號,開裕營造有限公司,職業安全衛生法第6條第1項第5款,對於高度二公尺以上之屋頂、鋼梁、開口部分、階梯、樓梯、坡道、工作臺、擋土牆、擋土支撐、施工構臺、橋梁墩柱及橋梁上部結構、橋臺等場所作業，勞工有遭受墜落危險之虞，未於該處設置護欄、護蓋或安全網等防護設備。,,
勞動部勞工保險局,20220810,20220627,保退一字第11169911065號,開裕營造有限公司鄭守容,勞工退休金條例第19條第1項,雇主未按時繳納勞工退休金致加徵滯納金。,12589,
勞動部勞工保險局,20230612,20230426,保退一字第11269911045號,開裕營造有限公司鄭守容,勞工退休金條例第19條第1項,雇主未按時繳納勞工退休金致加徵滯納金。,495,
