主管機關,公告日期,處分日期,處分字號,事業單位名稱或負責人,違法法規法條,違反法規內容,罰鍰金額,備註說明
新北市,20170218,20161123,新北府勞檢字第1053470136號,集凱科技股份有限公司,勞動基準法第30條第6項,出勤紀錄未依規定應逐日記載勞工出勤情形至分鐘,,
新北市,20201221,20171024,新北府勞檢字第10635848852號,集凱科技股份有限公司詹桂英,勞動基準法第24條,延長工作時間未依規定加給工資,,
新北市,20201221,20171024,新北府勞檢字第10635848853號,集凱科技股份有限公司詹桂英,勞動基準法第39條,假日工資未給或於休假日工作未依規定加給工資,,
新北市,20201221,20171024,新北府勞檢字第1063584885號,集凱科技股份有限公司詹桂英,勞動基準法第22條第2項,工資未全額直接給付勞工,,
新北市,20201221,20171208,新北府勞檢字第1063589724號,集凱科技股份有限公司詹桂英,勞動基準法第27條,經主管機關限期給付工資仍未給付,,
新北市,20190416,20190117,新北府勞檢字第10842413721號,集凱科技股份有限公司,勞動基準法第23條第2項,未依規定置備工資清冊,,
新北市,20190416,20190117,新北府勞檢字第1084241372號,集凱科技股份有限公司,勞動基準法第21條第1項,未達基本工資,,
