主管機關,公告日期,處分日期,處分字號,事業單位名稱或負責人,違法法規法條,違反法規內容,罰鍰金額,備註說明
職業安全衛生署,20220509,20220207,勞職授字第1110200547號,集業營造股份有限公司賴建樺,營造安全衛生設施標準第19條第1項暨職業安全衛生法第6條第1項,對於高度二公尺以上之開口部分、工作臺等場所作業，勞工有遭受墜落危險之虞者，未於該處設置護欄、護蓋或安全網等防護設備。,,
職業安全衛生署,20221209,20220912,勞職授字第1110205313號,集業營造股份有限公司賴建樺,職業安全衛生法第27條第1項第1款、第2款、第3款,與承攬人分別僱用勞工共同作業時，未設置協議組織並指定工作場所負責人擔任指揮、監督及協調之工作、未採取工作之連繫與調整之必要措施、未巡視工作場所。,,
職業安全衛生署,20240108,20231002,勞職授字第1120204713號,集業營造股份有限公司賴建樺,營造安全衛生設施標準第19條第1項暨職業安全衛生法第6條第1項,對於高度二公尺以上之開口部分、工作臺等場所作業，勞工有遭受墜落危險之虞者，未於該處設置護欄、護蓋或安全網等防護設備。,,
職業安全衛生署,20240915,20240216,勞職授字第1130202781號,集業營造股份有限公司賴建樺,營造安全衛生設施標準第19條第1項暨職業安全衛生法第6條第1項,對於高度二公尺以上之開口部分、工作臺等場所作業勞工有遭受墜落危險之虞者未於該處設置護欄、護蓋或安全網等防護設備。,,
職業安全衛生署,20240507,20240324,勞職授字第1130203450號,集業營造股份有限公司賴建樺,營造安全衛生設施標準第19條第1項營造安全衛生設施標準第11條之1暨職業安全衛生法第6條第1項,對於高度2公尺以上之外牆施工架開口部分場所作業，未於該處設置護欄、護蓋或安全網等防護設備；對於進入營繕工程工作場所作業人員，未提供適當安全帽，並使其正確戴用。,,林春陽
職業安全衛生署,20250215,20250122,勞職授字第1140250180A號,集業營造股份有限公司賴建樺,營造安全衛生設施標準第19條第1項、第40條第1項第1款暨職業安全衛生法第6條第1項,雇主對於高度二公尺以上之屋頂、鋼梁、開口部分、階梯、樓梯、坡道、工作臺、擋土牆、擋土支撐、施工構臺、橋梁墩柱及橋梁上部結構、橋臺等場所作業，勞工有遭受墜落危險之虞者，未於該處設置護欄、護蓋或安全網等防護設備；雇主對於施工構臺、懸吊式施工架、懸臂式施工架、高度七公尺以上且立面面積達三百三十平方公尺之施工架、高度七公尺以上之吊料平臺、升降機直井工作臺、鋼構橋橋面板下方工作臺或其他類似工作臺等之構築及拆除，未依下列規定辦理：一、事先就預期施工時之最大荷重，應由所僱之專任工程人員或委由相關執業技師，依結構力學原理妥為設計，置備施工圖說及強度計算書，經簽章確認後，據以執行。…。,,
職業安全衛生署,20250215,20250122,勞職授字第1140250180號,集業營造股份有限公司賴建樺,職業安全衛生法第27條第1項第2款、第3款,與承攬人分別僱用勞工共同作業時，未採取工作之連繫與調整之必要措施、未巡視工作場所。,,
職業安全衛生署,20250415,20250324,勞職授字第1140251223號,集業營造股份有限公司賴建樺,營造安全衛生設施標準第19條第1項暨職業安全衛生法第6條第1項,對於高度二公尺以上之開口部分、工作臺等場所作業，勞工有遭受墜落危險之虞者，未於該處設置護欄、護蓋或安全網等防護設備。,,
