主管機關,公告日期,處分日期,處分字號,事業單位名稱或負責人,違法法規法條,違反法規內容,罰鍰金額,備註說明
職業安全衛生署,20150917,20150720,勞職授字第1040202296號,青暉營造有限公司,營造安全衛生設施標準第19條第1項、第40條第1項暨職業安全衛生法第6條第1項,對於高度2公尺以上之(施工架)開口部分場所作業，勞工有遭受墜落危害之虞者，未依規定設置護欄、護蓋或安全網等防護設備；對於懸臂式施工架，未事先就預期施工時之最大荷重，依結構力學原理妥為設計，置備施工圖說，並指派所僱之專任工程人員簽章確認強度計算書及施工圖說。,,
職業安全衛生署,20161014,20160822,勞職授字第1050203005號,青暉營造有限公司,營造安全衛生設施標準第19條第1項暨職業安全衛生法第6條第1項,對於高度2公尺以上之施工架開口部分，勞工有遭受墜落危險之虞，未設置內交叉拉桿、下拉桿、護欄、護蓋或安全網等防護設備。,,
職業安全衛生署,20170901,20170524,勞職授字第1060202177號,青暉營造有限公司,營造安全衛生設施標準第19條第1項及職業安全衛生設施規則第228條暨職業安全衛生法第6第1項,對於高度2公尺以上之施工架開口部分等場所作業，勞工有遭受墜落危險之虞，未於該處設置護欄、護蓋或安全網等防護設備。對於高差超過1.5公尺以上施工架之場所作業時，未設置使勞工安全上下之設備。,,
高雄市,20190325,20181219,高市勞檢字第10772276200號,青暉營造有限公司,職業安全衛生法第6條第1項第5款,對於高度2公尺以上之施工構臺作業，勞工有遭受墜落危險之虞，未於該處設置護欄防護設備；工作場所周圍未設適當之固定式圍籬，並於顯著位置裝設警告標示。,,
職業安全衛生署,20210301,20201221,勞職授字第1090205586號,青暉營造有限公司,營造安全衛生設施標準第8條第1款、營造安全衛生設施標準第40條第1項第1款暨職業安全衛生法第6條第1項,對於工作場所周圍，未設適當之固定式圍籬，並於顯著位置裝設警告標示；對於懸臂式施工架之構築及拆除，未事先就預期施工時之最大荷重，依結構力學原理妥為設計，置備施工圖說，並指派所僱之專任工程人員簽章確認強度計算書及施工圖說,,
高雄市,20200616,20200214,高市勞檢字第10970266800號,青暉營造有限公司,職業安全衛生法第6條第1項第5款,1.對於進入營繕工程工作場所作業人員，未提供適當安全帽，並使其正確戴用。2.對於高度2公尺以上之開口部分場所作業，勞工有遭受墜落危險之虞，未於該處設置護欄、護蓋或安全網等防護設備。,,
職業安全衛生署,20210801,20210506,勞職授字第1100202341號,青暉營造有限公司,營造安全衛生設施標準第11條之1暨職業安全衛生法第6條第1項,對於進入營繕工程工作場所作業人員，未提供適當安全帽，並使其正確戴用,,
職業安全衛生署,20221001,20220726,勞職授字第1110204179號,青暉營造有限公司吳佩璋,營造安全衛生設施標準第19條第1項營造安全衛生設施標準第59條第1項第1款營造安全衛生設施標準第59條第1項第4款暨職業安全衛生法第6條第1項,對於高度二公尺以上之外牆施工架開口部分場所作業，勞工有遭受墜落危險之虞者，未於該處設置護欄、護蓋或安全網等防護設備；使用國家標準CNS4750型式之施工架，未符合國家標準同等以上之規定；鋼管施工架構件之連接部分或交叉部分，未以適當之金屬附屬配件確實連接固定,,
職業安全衛生署,20240910,20240708,勞職授字第1130205175號,青暉營造有限公司吳佩璋,營造安全衛生設施標準第19條第1項營造安全衛生設施標準第40條第1項第1款暨職業安全衛生法第6條第1項,對於高度2公尺以上之施工架開口部分等場所作業，未於該處設置護欄、護蓋或安全網等防護設備；對於高度7公尺以上且立面面積達330平方公尺之施工架等之構築及拆除，未由所僱之專任工程人員或委由相關執業技師，依結構力學原理妥為設計，置備施工圖說及強度計算書,,吳朝琴
