主管機關,公告日期,處分日期,處分字號,事業單位名稱或負責人,違法法規法條,違反法規內容,罰鍰金額,備註說明
職業安全衛生署,20161014,20160802,勞職授字第1050202698號,領航營造廠股份有限公司,營造安全衛生設施標準第19條第1項暨職業安全衛生法第6條第1項,對於高度超過2公尺以上之外牆施工架工作台，勞工有遭受墜落危險之虞，未設置護欄、護蓋或安全網等防護設備。,,
職業安全衛生署,20161014,20160802,勞職授字第1050202698號,領航營造廠股份有限公司,營造安全衛生設施標準第19條第1項暨職業安全衛生法第6條第1項,對於高度超過2公尺以上之外牆施工架工作台，勞工有遭受墜落危險之虞，未設置護欄、護蓋或安全網等防護設備。,,
桃園市,20180510,20180309,府勞檢字第1070053951號,領航營造廠股份有限公司李明鏡,職業安全衛生法第27條第1項第2款;職業安全衛生法第27條第1項第3款.職業安全衛生法第27條第1項第3款,事業單位與承攬人、再承攬人分別僱用勞工共同作業時，為防止職業災害，原事業單位應採取下列必要措施：一、…。二、工作之連繫與調整。三、…。;事業單位與承攬人、再承攬人分別僱用勞工共同作業時，為防止職業災害，原事業單位應採取下列必要措施：一、…。三、工作場所之巡視。四、…。,,
桃園市,20190311,20190222,府勞檢字第1080041521號,領航營造廠股份有限公司李明鏡,職業安全衛生設施規則第230條第1項第3款暨職業安全衛生法第6條第1項;職業安全衛生設施規則第253條暨職業安全衛生法第6條第1項;營造安全衛生設施標準第11條之1暨職業安全衛生法第6條第1項,雇主對於使用之合梯，應符合下列規定：一、…。三、梯腳與地面之角度應在七十五度以內，且兩梯腳間有金屬等硬質繫材扣牢，腳部有防滑絕緣腳座套。四、…。;雇主不得於通路上使用臨時配線或移動電線。但經妥為防護而車輛或其他物體通過該配線或移動電線時不致損傷其絕緣被覆者，不在此限。;雇主對於進入營繕工程工作場所作業人員，應提供適當安全帽，並使其正確戴用。,,
桃園市,20201008,20200824,府勞檢字第1090211274號,領航營造廠股份有限公司,1.職業安全衛生設施規則第190條第3款暨職業安全衛生法第6條第1項2.營造安全衛生設施標準第19條第1項暨職業安全衛生法第6條第1項,1.對於雇主為金屬之熔接、熔斷或加熱等作業所須使用可燃性氣體及氧氣之容器，應依下列規定辦理：一、…。三、容器應直立穩妥放置，防止傾倒危險，並不得撞擊。四、…。2.雇主對於高度二公尺以上之屋頂、鋼樑、開口部分、階梯、樓梯、坡道、工作臺、擋土牆、擋土支撐、施工構臺、橋樑墩柱及橋樑上部結構、橋臺等場所作業，勞工有遭受墜落危險之虞者，應於該處設置護欄、護蓋或安全網等防護設備。,,
桃園市,20201117,20200903,府勞檢字第1090222516號,領航營造廠股份有限公司李明鏡,職業安全衛生設施規則第108條第1款暨職業安全衛生法第6條第1項;職業安全衛生設施規則第108條第4款暨職業安全衛生法第6條第1項;職業安全衛生設施規則第108條第5款暨職業安全衛生法第6條第1項;營造安全衛生設施標準第5條暨職業安全衛生法第6條第1項;營造安全衛生設施標準第46條第1項第2款暨職業安全衛生法第6條第1項,雇主對於高壓氣體之貯存，應依下列規定辦理：一、貯存場所應有適當之警戒標示，禁止煙火接近。二、…。;雇主對於高壓氣體之貯存，應依下列規定辦理：一、…。四、可燃性氣體、有毒性氣體及氧氣之鋼瓶，應分開貯存。五、…。;雇主對於高壓氣體之貯存，應依下列規定辦理：一、…。五、應安穩置放並加固定及裝妥護蓋。六、…。;雇主對於工作場所暴露之鋼筋、鋼材、鐵件、鋁件及其他材料等易生職業災害者，應採取彎曲尖端、加蓋或加裝護套等防護設施。;雇主對於施工架上物料之運送、儲存及荷重之分配，應依下列規定辦理：一、…。二、施工架上不得放置或運轉動力機械及設備，或以施工架作為固定混凝土輸送管、垃圾管槽之用，以免因振動而影響作業安全。但無作業危險之虞者，不在此限。三、…。,,
桃園市,20210202,20201228,府勞檢字第1090339112號,領航營造廠股份有限公司李明鏡,營造安全衛生設施標準第19條第1項暨職業安全衛生法第6條第1項;營造安全衛生設施標準第135條第3款暨職業安全衛生法第6條第1項,雇主對於高度二公尺以上之屋頂、鋼梁、開口部分、階梯、樓梯、坡道、工作臺、擋土牆、擋土支撐、施工構臺、橋梁墩柱及橋梁上部結構、橋臺等場所作業，勞工有遭受墜落危險之虞者，應於該處設置護欄、護蓋或安全網等防護設備。;雇主以可調鋼管支柱為模板支撐之支柱時，應依下列規定辦理：一、…。三、可調鋼管支撐於調整高度時，應以制式之金屬附屬配件為之，不得以鋼筋等替代使用。四、…。,,
桃園市,20211210,20211001,府勞檢字第1100245822號,領航營造廠股份有限公司李明鏡,營造安全衛生設施標準第11條之1暨職業安全衛生法第6條第1項;營造安全衛生設施標準第171條暨職業安全衛生法第6條第1項,雇主對於進入營繕工程工作場所作業人員，應提供適當安全帽，並使其正確戴用。;雇主對於營造工程工作場所應保持環境衛生。寢室、廚房、浴室或廁所應指定專人負責環境衛生之維護，以保持清潔。,,
桃園市,20220907,20220728,府勞檢字第1110205868號,領航營造廠股份有限公司李明鏡,營造安全衛生設施標準第5條暨職業安全衛生法第6條第1項;營造安全衛生設施標準第11條之1暨職業安全衛生法第6條第1項;營造安全衛生設施標準第12條暨職業安全衛生法第6條第1項;營造安全衛生設施標準第19條第1項暨職業安全衛生法第6條第1項;營造安全衛生設施標準第45條第1款暨職業安全衛生法第6條第1項;營造安全衛生設施標準第59條第1項第4款暨職業安全衛生法第6條第1項;營造安全衛生設施標準第129條第7款暨職業安全衛生法第6條第1項;職業安全衛生設施規則第230條第1項第3款暨職業安全衛生法第6條第1項,雇主對於工作場所暴露之鋼筋、鋼材、鐵件、鋁件及其他材料等易生職業災害者，應採取彎曲尖端、加蓋或加裝護套等防護設施。;雇主對於進入營繕工程工作場所作業人員，應提供適當安全帽，並使其正確戴用。;雇主對於工作場所儲存有易燃性物料時，應有防止太陽直接照射之遮蔽物外，並應隔離儲存、設置禁止煙火之警告標誌及適當之滅火器材。;雇主對於高度二公尺以上之屋頂、鋼梁、開口部分、階梯、樓梯、坡道、工作臺、擋土牆、擋土支撐、施工構臺、橋梁墩柱及橋梁上部結構、橋臺等場所作業，勞工有遭受墜落危險之虞者，應於該處設置護欄、護蓋或安全網等防護設備。;雇主為維持施工架及施工構臺之穩定，應依下列規定辦理：一、施工架及施工構臺不得與混凝土模板支撐或其他臨時構造連接。二、…。;雇主對於鋼管施工架之設置，應依下列規定辦理：一、…。四、構件之連接部分或交叉部分，應以適當之金屬附屬配件確實連接固定，並以適當之斜撐材補強。五、…。;雇主對於從事鋼筋混凝土之作業時，應依下列規定辦理：一、…。七、禁止使用鋼筋作為拉索支持物、工作架或起重支持架等。八、…。;雇主對於使用之合梯，應符合下列規定：一、…。三、梯腳與地面之角度應在七十五度以內，且兩梯腳間有金屬等硬質繫材扣牢，腳部有防滑絕緣腳座套。四、…。,,
職業安全衛生署,20240810,20240606,勞職授字第1130204770號,領航營造廠股份有限公司李明鏡,營造安全衛生設施標準第19條第1項暨職業安全衛生法第6條第1項,對於高度二公尺以上之開口部分、工作臺等場所作業，勞工有遭受墜落危險之虞者，未於該處設置護欄、護蓋或安全網等防護設備。,,
職業安全衛生署,20250415,20250317,勞職授字第1140251101號,領航營造廠股份有限公司李明鏡,營造安全衛生設施標準第19條第1項暨職業安全衛生法第6條第1項,對於高度二公尺以上之開口部分、工作臺等場所作業，勞工有遭受墜落危險之虞者，未於該處設置護欄、護蓋或安全網等防護設備。,,
