主管機關,公告日期,處分日期,處分字號,事業單位名稱或負責人,違法法規法條,違反法規內容,罰鍰金額,備註說明
職業安全衛生署,20160110,20151201,勞職授字第1040204090號,駿丞企業有限公司,營造安全衛生設施標準第19條、職業安全衛生設施規則第228條暨職業安全衛生法第6條第1項,對於外牆施工架工作臺(高度約6.8公尺)開口部分從事作業，勞工有遭受墜落之虞，未設置護欄（交叉拉桿、下拉桿）等防止墜落之措施，亦未設置使勞工安全上下之設備。,,
職業安全衛生署,20160110,20151201,勞職授字第1040204090號,駿丞企業有限公司,營造安全衛生設施標準第19條、職業安全衛生設施規則第228條暨職業安全衛生法第6條第1項,對於外牆施工架工作臺(高度約6.8公尺)開口部分從事作業，勞工有遭受墜落之虞，未設置護欄（交叉拉桿、下拉桿）等防止墜落之措施，亦未設置使勞工安全上下之設備。,,
職業安全衛生署,20190809,20190423,勞職授字第1080201499號,駿丞企業有限公司,職業安全衛生法第26條第2項,承攬人就其承攬之全部或一部分交付再承攬時，承攬人未於事前告知該承攬人有關其事業工作環境、危害因素暨本法及有關安全衛生規定應採取之措施。,,
職業安全衛生署,20201013,20200618,勞職授字第1090202536號,駿丞企業有限公司,營造安全衛生設施標準第19條第2項暨職業安全衛生法第6條第1項,對於高度2公尺以上之施工架組立場所作業，勞工有遭受墜落危險之虞，未採取使勞工使用安全帶等防止墜落之措施。,,
勞動部勞工保險局,20240410,20240226,保退一字第11369911025號,駿丞企業有限公司葉心為,勞工退休金條例第19條第1項,雇主未按時繳納勞工退休金致加徵滯納金。,491,
