主管機關,公告日期,處分日期,處分字號,事業單位名稱或負責人,違法法規法條,違反法規內容,罰鍰金額,備註說明
台北市,20191105,20190812,北市勞職字第10860790727號,高權起重工程有限公司,職業安全衛生設施規則第230條第2項暨職業安全衛生法第6條第1項第5款;職業安全衛生設施規則第281條第1項暨職業安全衛生法第6條第1項第5款,合梯作為上下設備、站立於頂板作業。;2公尺作業未使用安全帶、帽。,,
台北市,20200805,20200507,北市勞職字第10960535777號,高權起重工程有限公司,營造安全衛生設施標準第129條第7款暨職業安全衛生法第6條第1項第5款,鋼筋混凝土作業未依規定辦理。,,
台北市,20220304,20211209,北市勞職字第11061277191號,高權起重工程有限公司李月嬌,職業安全衛生設施規則第92條第1項暨職業安全衛生法第6條1項第5款,起重機具運轉時未禁止人員進入吊掛區。,,
職業安全衛生署,20240205,20231206,勞職授字第1120205702B號,高權起重工程有限公司李月嬌,起重升降機具安全規則第32條暨職業安全衛生法第6條第1項,使用具有外伸撐座之移動式起重機，或擴寬式履帶起重機作業時，未將其外伸撐座或履帶伸至最大極限位置。,,
台北市,20240408,20240226,北市勞職字第11360540013號,高權起重工程有限公司李月嬌,起重升降機具安全規則第29條第1項第1款暨職業安全衛生法第6條第1項,對於使用移動式起重機作業，為防止其作業中發生翻倒、被夾、感電等危害，未事前調查該起重機作業範圍之地形、地質狀況、作業空間、運搬物重量與所用起重機種類、型式及性能等，並採必要措施。,,
職業安全衛生署,20250515,20250429,勞職授字第1140251876C號,高權起重工程有限公司李月嬌,起重升降機具安全規則第32條、第64條;移動式起重機安全檢查構造標準第31條暨職業安全衛生法第6條第1項,雇主使用具有外伸撐座之移動式起重機，或擴寬式履帶起重機作業時，未將其外伸撐座或履帶伸至最大極限位置。…；雇主對於起重機具之作業，未規定一定之運轉指揮信號，並指派專人負責指揮。…；移動式起重機，未設置過負荷預防裝置。…，致發生職業安全衛生法第37條第2項第1款之職業災害。,,職業災害
