主管機關,公告日期,處分日期,處分字號,事業單位名稱或負責人,違法法規法條,違反法規內容,罰鍰金額,備註說明
嘉義縣,20180301,20180207,府授社勞資字第1070026391號,高竟實業有限公司,勞動基準法第30條第6項,未依勞動基準法第30條第6項規定每日記載勞工出勤情形之時間至分鐘為止,,
勞動部勞工保險局,20201012,20200821,保退一字第10969911085號,高竟實業有限公司韋理文,勞工退休金條例第19條第1項,雇主未按時繳納勞工退休金致加徵滯納金。,3221,
勞動部勞工保險局,20211012,20210823,保退一字第11069911085號,高竟實業有限公司韋理文,勞工退休金條例第19條第1項,雇主未按時繳納勞工退休金致加徵滯納金。,911,
新北市,20221216,20221011,新北府勞檢字第11147631971號,高竟實業有限公司韋理文,職業安全衛生法第27條第1項,事業單位與承攬人、再承攬人分別僱用勞工共同作業時，為防止職業災害，原事業單位未採取必要措施,,
職業安全衛生署,20241015,20240826,勞職授字第1130206023號,高竟實業有限公司韋理文,職業安全衛生設施規則第153條暨職業安全衛生法第6條第1項,對於搬運、堆放或處置物料，未防止倒塌、崩塌或掉落，未採取繩索捆綁、護網、擋樁、限制高度或變更堆積等必要設施，未禁止與作業無關人員進入該等場所。,,
