主管機關,公告日期,處分日期,處分字號,事業單位名稱或負責人,違法法規法條,違反法規內容,罰鍰金額,備註說明
高雄市,20200610,20191204,高市勞條字第10839841000號,高聿企業有限公司徐春玉,勞動基準法第22條第2項;勞動基準法第24條;勞動基準法第36條;勞動基準法第38條,工資未全額直接給付勞工；延長工作時間未依規定加給工資；每七日中未有一日之休息作為例假；未依規定給予特別休假,,
高雄市,20200610,20191204,高市勞條字第10839841000號,高聿企業有限公司徐春玉,勞動基準法第22條第2項;勞動基準法第24條;勞動基準法第36條;勞動基準法第38條,工資未全額直接給付勞工；延長工作時間未依規定加給工資；每七日中未有一日之休息作為例假；未依規定給予特別休假,,
台北市,20200904,20200701,北市勞動字第10960301411號,高聿企業有限公司徐春玉,勞動基準法第22條第2項;勞動基準法第30條第5項,工資未全額給付給勞工;未依規定置備勞工出勤紀錄,110000,訴願駁回
台北市,20200904,20200701,北市勞動字第10960301411號,高聿企業有限公司徐春玉,勞動基準法第22條第2項;勞動基準法第30條第5項,工資未全額給付給勞工;未依規定置備勞工出勤紀錄,110000,訴願駁回
勞動部勞工保險局,20220310,20220119,保退二字第11160005721號,高聿企業有限公司徐春玉,勞工退休金條例第15條第2項,雇主未依規定覈實申報調整勞工退休金提繳工資。,5000,
