主管機關,公告日期,處分日期,處分字號,事業單位名稱或負責人,違法法規法條,違反法規內容,罰鍰金額,備註說明
職業安全衛生署,20191106,20190826,勞職授字第10802033442號,高陞鷹架股份有限公司,職業安全衛生設施規則第281條第2項暨職業安全衛生法第6條第1項,"對於勞工在高度2公尺以上之高處拆除施工架作業,勞工有墜落之虞者,未使勞工確實使用捲揚式防墜器。",,
職業安全衛生署,20210802,20210517,勞職授字第1100202669號,高陞鷹架股份有限公司,營造安全衛生設施標準第19條第1項、第2項暨職業安全衛生法第6條第1項,對於高度二公尺以上之屋頂、鋼梁、開口部分、階梯、樓梯、坡道、工作臺、擋土牆、擋土支撐、施工構臺、橋梁墩柱及橋梁上部結構、橋臺等場所作業，勞工有遭受墜落危險之虞者，未於該處設置護欄、護蓋或安全網等防護設備。設置前項設備有困難，或因作業之需要臨時將護欄、護蓋或安全網等防護設備開啟或拆除者，未採取使勞工使用安全帶等防止墜落措施。,,
職業安全衛生署,20211104,20210823,勞職授字第1100204354號,高陞鷹架股份有限公司,營造安全衛生設施標準第19條第1項、第2項暨職業安全衛生法第6條第1項,對於高度二公尺以上之屋頂、鋼梁、開口部分、階梯、樓梯、坡道、工作臺、擋土牆、擋土支撐、施工構臺、橋梁墩柱及橋梁上部結構、橋臺等場所作業，勞工有遭受墜落危險之虞者，未於該處設置護欄、護蓋或安全網等防護設備。設置前項設備有困難，或因作業之需要臨時將護欄、護蓋或安全網等防護設備開啟或拆除者，未採取使勞工使用安全帶等防止墜落措施。,,
新北市,20220415,20220112,新北府勞檢字第11147302921號,高陞鷹架股份有限公司蘇芷萍,職業安全衛生法第37條第2項,事業單位勞動場所發生職業災害，未於八小時內通報勞動檢查機構,,
新北市,20220415,20220112,新北府勞檢字第1114730292號,高陞鷹架股份有限公司蘇芷萍,職業安全衛生法第6條第1項,未符合規定之必要安全衛生設備及措施,,
