主管機關,公告日期,處分日期,處分字號,事業單位名稱或負責人,違法法規法條,違反法規內容,罰鍰金額,備註說明
桃園市,20190909,20190701,108年府勞檢字1080155713號,鴻佰科技股份有限公司吳惠鋒,勞基法第32條第2項,延長工作時間超過法令規定,,
桃園市,20220907,20220719,府勞檢字第1110189722號,鴻佰科技股份有限公司唐繼龍,職業安全衛生設施規則第21條暨職業安全衛生法第6條第1項;職業安全衛生設施規則第288條暨職業安全衛生法第6條第1項,雇主對於勞工工作場所之通道、地板、階梯、坡道、工作台或其他勞工踩踏場所，應保持不致使勞工跌倒、滑倒、踩傷、滾落等之安全狀態，或採取必要之預防措施。;雇主對於勞工在作業中使用之物質，有因接觸而傷害皮膚、感染、或經由皮膚滲透吸收而發生中毒等之虞時，應置備不浸透性防護衣、防護手套、防護靴、防護鞋等適當防護具，或提供必要之塗敷用防護膏，並使勞工使用。,,
桃園市,20240501,20240304,113年府勞檢字1130054266號,鴻佰科技股份有限公司林雲有,勞基法第36條第1項,每7日中未有2日之休息作為例假及休息日,50000,
桃園市,20250205,20241217,113年府勞檢字11303536491號,鴻佰科技股份有限公司周泰裕,勞基法第36條第1項,每7日中未有2日之休息作為例假及休息日,100000,
桃園市,20250205,20241217,113年府勞檢字1130353649號,鴻佰科技股份有限公司周泰裕,勞基法第32條第2項,延長工作時間超過法令規定,50000,
職業安全衛生署,20250315,20250205,勞職授字第1140250360號,鴻佰科技股份有限公司周泰裕,職業安全衛生設施規則第21條暨職業安全衛生法第6條第1項,對於勞工工作場所之通道、地板、階梯、坡道、工作台或其他勞工踩踏場所，未保持不致使勞工跌倒、滑倒、踩傷、滾落等之安全狀態，未採取必要之預防措施。,,職業災害
