主管機關,公告日期,處分日期,處分字號,事業單位名稱或負責人,違法法規法條,違反法規內容,罰鍰金額,備註說明
新北市,20170817,20170603,新北府勞檢字第10635680641號,莊文輝即鼎源企業行,勞動基準法第30條第6項,出勤紀錄未依規定應逐日記載勞工出勤情形至分鐘,,
新北市,20170817,20170603,新北府勞檢字第10635680642號,莊文輝即鼎源企業行,勞動基準法第32條第2項,延長工作時間超過法令規定,,
新北市,20170817,20170603,新北府勞檢字第10635680643號,莊文輝即鼎源企業行,勞動基準法第36條,每七日中未有一日之休息作為例假,,
新北市,20170817,20170603,新北府勞檢字第10635680644號,莊文輝即鼎源企業行,勞動基準法第39條,假日工資未給或於休假日工作未依規定加倍發給,,
新北市,20170817,20170603,新北府勞檢字第1063568064號,莊文輝即鼎源企業行,勞動基準法第24條,延長工作時間未依規定加給工資,,
新北市,20170817,20170606,新北府勞檢字第1063569062號,莊文輝即鼎源企業行,勞動基準法第22條第2項,工資未全額直接給付勞工,,
新北市,20220218,20211105,新北府勞檢字第1104745204號,莊文輝即鼎源企業行,勞動基準法第30條第6項,出勤紀錄未依規定應逐日記載勞工出勤情形至分鐘,40000,
新北市,20220218,20211105,新北府勞檢字第1104745204號,莊文輝即鼎源企業行,勞動基準法第30條第6項,出勤紀錄未依規定應逐日記載勞工出勤情形至分鐘,40000,
