主管機關,公告日期,處分日期,處分字號,事業單位名稱或負責人,違法法規法條,違反法規內容,罰鍰金額,備註說明
新北市,20211015,20210823,新北府勞檢字第1104735323號,鼎珍食品工業股份有限公司華百川,勞動基準法第32條第2項,延長工作時間超過法令規定,20000,
勞動部勞工保險局,20230210,20221213,保退三字第11160172120號,鼎珍食品工業股份有限公司華百川,勞工退休金條例第15條第2項,雇主未依規定覈實申報調整勞工退休金提繳工資。,5000,
新北市,20221216,20221021,新北府勞檢字第1114764961號,鼎珍食品工業股份有限公司華百川,職業安全衛生法第6條第1項,未符合規定之必要安全衛生設備及措施,,
新北市,20230421,20230111,新北府勞檢字第1124650409號,鼎珍食品工業股份有限公司華百川,職業安全衛生法第24條,具有危險性機械或設備之操作人員，雇主應僱用經中央主管機關認可之訓練或經技能檢定之合格人員充任之。,,
新北市,20230421,20230111,新北府勞檢字第1124650411號,鼎珍食品工業股份有限公司華百川,職業安全衛生法第6條第1項,未符合規定之必要安全衛生設備及措施,,
