主管機關,公告日期,處分日期,處分字號,事業單位名稱或負責人,違法法規法條,違反法規內容,罰鍰金額,備註說明
勞動部勞工保險局,20211210,20211025,保退一字第11069911105號,鼎豐匯餐有限公司魏福彬,勞工退休金條例第19條第1項,雇主未按時繳納勞工退休金致加徵滯納金。,638,
勞動部勞工保險局,20220810,20220627,保退一字第11169911065號,鼎豐匯餐有限公司魏福彬,勞工退休金條例第19條第1項,雇主未按時繳納勞工退休金致加徵滯納金。,3696,
勞動部勞工保險局,20221011,20220824,保退一字第11169911085號,鼎豐匯餐有限公司魏福彬,勞工退休金條例第19條第1項,雇主未按時繳納勞工退休金致加徵滯納金。,4362,
新北市,20250214,20241210,新北府勞檢字第11346692221號,鼎豐匯餐有限公司魏彥城,勞動基準法第30條第6項,出勤紀錄未依規定應逐日記載勞工出勤情形至分鐘,10000,
新北市,20250214,20241210,新北府勞檢字第1134669222號,鼎豐匯餐有限公司魏彥城,勞動基準法第23條第2項,未依規定置備工資清冊,10000,
