主管機關,公告日期,處分日期,處分字號,事業單位名稱或負責人,違法法規法條,違反法規內容,罰鍰金額,備註說明
高雄市,20200708,20200225,高市勞條字第10931285300號,齊力物流有限公司吳怡嬅,勞動基準法第24條;勞動基準法第30條第6項;勞動基準法第36條,延長工作時間未依規定加給工資;未逐日記載勞工出勤情形至分鐘為止;每七日中未有一日之休息作為例假;,,
高雄市,20200708,20200225,高市勞條字第10931285300號,齊力物流有限公司吳怡嬅,勞動基準法第24條;勞動基準法第30條第6項;勞動基準法第36條,延長工作時間未依規定加給工資;未逐日記載勞工出勤情形至分鐘為止;每七日中未有一日之休息作為例假;,,
高雄市,20220708,20220512,高市勞條字第11133221900號,齊力物流有限公司吳怡嬅,勞動基準法第36條,每七日中未有一日之休息作為例假,20000,
高雄市,20220708,20220512,高市勞條字第11133221900號,齊力物流有限公司吳怡嬅,勞動基準法第36條,每七日中未有一日之休息作為例假,20000,
勞動部勞工保險局,20241210,20241028,保退一字第11369911105號,齊力物流有限公司吳怡嬅,勞工退休金條例第19條第1項,雇主未按時繳納勞工退休金致加徵滯納金。,6586,
