主管機關,公告日期,處分日期,處分字號,事業單位名稱或負責人,違法法規法條,違反法規內容,處分金額或滯納金,備註說明
基隆市,20200710,20200521,"基府社關罰貳
1090210642","百意聖有限公司
(張新枝)",勞工退休金條例第12條第2項,雇主未依規定於終止勞動契約後30日內發給新制資遣費。,300000,
基隆市,20201210,20200413,基府社關罰貳1090215654,"優利資源整合股份有限公司
(李芃葳)",勞工退休金條例第12條第1項,雇主未依規定標準發給勞工退休金條例工作年資之資遣費。,30000,
基隆市,20200110,20191119,基府社關罰貳1080272714,東逸企業股份有限公司(陳怡潾),勞工退休金條例第12條第1項,雇主未依規定標準發給勞工退休金條例工作年資之資遣費。,300000,
基隆市,20200410,20190917,基府社關罰貳1080262577,"獨身貴族實業股份有限公司
(馮聖欽)",勞工退休金條例第12條第1項,雇主未依規定標準發給勞工退休金條例工作年資之資遣費。,300000,1090317訴願決定
